date,Transaction,single_value_bpm,value_bpm,single_value_vorp,value_vorp,transaction_type,player_name
2022-06-23 00:00:00,added Christian Braun to DEN,0.0,0,0.0,0.0,draft,Christian Braun
2022-06-23 00:00:00,lost JaMychal Green to OKC,-0.0,0,-0.0,0.0,trade,JaMychal Green
2022-06-23 00:00:00,added Peyton Watson to DEN,0.0,0,0.0,0.0,trade,Peyton Watson
2022-06-23 00:00:00,added Maxwell Lewis to DEN,0.0,0,0.0,0.0,trade,Maxwell Lewis
2022-06-23 00:00:00,added Tyler Kolek to DEN,0.0,0,0.0,0.0,trade,Tyler Kolek
2022-07-03 00:00:00,added Christian Braun to DEN,-5195.9,-5195,1.4,1.4,signing,Christian Braun
2022-07-03 00:00:00,added Peyton Watson to DEN,-6870.5,-12066,-0.1,1.2999999999999998,signing,Peyton Watson
2022-07-03 00:00:00,added Collin Gillespie to DEN,0.0,-12066,0.0,1.2999999999999998,signing,Collin Gillespie
2022-07-06 00:00:00,lost Will Barton to WAS,2111.4,-9955,0.1,1.4,trade,Will Barton
2022-07-06 00:00:00,lost Monte Morris to WAS,-847.5,-10802,-1.1,0.2999999999999998,trade,Monte Morris
2022-07-06 00:00:00,added Kentavious Caldwell-Pope to DEN,-5743.799999999999,-16546,1.0,1.2999999999999998,trade,Kentavious Caldwell-Pope
2022-07-06 00:00:00,added Ish Smith to DEN,-2626.8,-19173,-0.5,0.7999999999999998,trade,Ish Smith
2022-07-06 00:00:00,lost Tyler Kolek to POR,-0.0,-19173,-0.0,0.7999999999999998,trade,Tyler Kolek
2022-07-06 00:00:00,added Ismael Kamagate to DEN,0.0,-19173,0.0,0.7999999999999998,trade,Ismael Kamagate
2022-07-07 00:00:00,added Vlatko Čančar to DEN,-1600.2000000000005,-20773,0.0,0.7999999999999998,signing,Vlatko Čančar
2022-07-07 00:00:00,added Bruce Brown to DEN,-1140.0,-21913,0.9,1.6999999999999995,signing,Bruce Brown
2022-07-09 00:00:00,added Davon Reed to DEN,-1921.5,-23834,-0.3,1.3999999999999997,signing,Davon Reed
2022-07-11 00:00:00,added DeAndre Jordan to DEN,-1054.8000000000002,-24889,0.0,1.3999999999999997,signing,DeAndre Jordan
2022-07-19 00:00:00,added Jack White to DEN,-125.4,-25015,0.0,1.3999999999999997,signing,Jack White
2022-08-25 00:00:00,added Justin Tillman to DEN,0.0,-25015,0.0,1.3999999999999997,signing,Justin Tillman
2022-09-26 00:00:00,added Grant Golden to DEN,0.0,-25015,0.0,1.3999999999999997,signing,Grant Golden
2022-10-10 00:00:00,added Chasson Randle to DEN,0.0,-25015,0.0,1.3999999999999997,signing,Chasson Randle
2022-10-10 00:00:00,added Grant Golden to DEN,0.0,-25015,0.0,1.3999999999999997,signing,Grant Golden
2023-02-09 00:00:00,lost Davon Reed to LAL,-116.1,-25131,-0.0,1.3999999999999997,multitrade,Davon Reed
2023-02-09 00:00:00,lost Bones Hyland to LAC,1494.3,-23636,-0.1999999999999999,1.1999999999999995,multitrade,Bones Hyland
2023-02-09 00:00:00,added Thomas Bryant to DEN,-1353.0,-24989,-0.2,0.9999999999999998,multitrade,Thomas Bryant
2023-02-14 00:00:00,added Reggie Jackson to DEN,-1626.8999999999996,-26616,-0.2999999999999999,0.7,signing,Reggie Jackson
2023-06-22 00:00:00,added Maxwell Lewis to DEN,0.0,-26616,0.0,0.7,draft,Maxwell Lewis
2023-06-23 00:00:00,lost Maxwell Lewis to LAL,1666.0,-24950,0.4,1.1,multitrade,Maxwell Lewis
2023-06-23 00:00:00,added Jalen Pickett to DEN,0.0,-24950,0.0,1.1,multitrade,Jalen Pickett
2023-06-23 00:00:00,added Julian Strawther to DEN,0.0,-24950,0.0,1.1,multitrade,Julian Strawther
2023-06-23 00:00:00,added Hunter Tyson to DEN,0.0,-24950,0.0,1.1,multitrade,Hunter Tyson
2023-06-23 00:00:00,added Kevin McCullar Jr. to DEN,0.0,-24950,0.0,1.1,multitrade,Kevin McCullar Jr.
2023-07-06 00:00:00,added Hunter Tyson to DEN,-2323.2,-27273,-0.4,0.7000000000000001,signing,Hunter Tyson
2023-07-06 00:00:00,added Julian Strawther to DEN,-9590.4,-36864,-1.5,-0.7999999999999999,signing,Julian Strawther
2023-07-06 00:00:00,added Jalen Pickett to DEN,-1230.7,-38094,0.1,-0.7,signing,Jalen Pickett
2023-07-06 00:00:00,added Justin Holiday to DEN,-1379.2,-39474,0.1,-0.6,signing,Justin Holiday
2023-07-16 00:00:00,added Reggie Jackson to DEN,-5814.400000000001,-45288,-0.6,-1.2,signing,Reggie Jackson
2023-07-17 00:00:00,added Collin Gillespie to DEN,-607.5,-45896,0.0,-1.2,signing,Collin Gillespie
2023-07-18 00:00:00,added Braxton Key to DEN,126.0,-45770,0.1,-1.1,signing,Braxton Key
2023-07-18 00:00:00,added James Huff to DEN,63.7,-45706,0.0,-1.1,signing,James Huff
2023-07-20 00:00:00,added DeAndre Jordan to DEN,-673.1999999999999,-46379,0.0,-1.1,signing,DeAndre Jordan
2024-02-08 00:00:00,lost Ismael Kamagate to LAC,-0.0,-46379,-0.0,-1.1,trade,Ismael Kamagate
2024-06-26 00:00:00,added Ryan Dunn to DEN,0.0,-46379,0.0,-1.1,draft,Ryan Dunn
2024-06-26 00:00:00,lost Ryan Dunn to PHO,5922.400000000001,-40457,0.8,-0.2999999999999998,trade,Ryan Dunn
2024-06-26 00:00:00,lost Kevin McCullar Jr. to PHO,-0.0,-40457,-0.0,-0.2999999999999998,trade,Kevin McCullar Jr.
2024-06-26 00:00:00,added DaRon Holmes to DEN,0.0,-40457,0.0,-0.2999999999999998,trade,DaRon Holmes
2024-06-26 00:00:00,lost future 2nd round pick to PHO,2496.390231116585,-37960,-0.9566674055829228,-1.2566674055829226,trade,future 2nd round pick
2024-06-26 00:00:00,lost future 2nd round pick to PHO,2496.390231116585,-35464,-0.9566674055829228,-2.2133348111658453,trade,future 2nd round pick
2024-07-03 00:00:00,added Trey Alexander to DEN,-1198.8000000000002,-36663,-0.2,-2.413334811165845,signing,Trey Alexander
2024-07-06 00:00:00,lost future 2nd round pick to MIN,2496.390231116585,-34166,-0.9566674055829228,-3.370002216748768,multitrade,future 2nd round pick
2024-07-06 00:00:00,lost future 2nd round pick to DAL,2496.390231116585,-31670,-0.9566674055829228,-4.326669622331691,multitrade,future 2nd round pick
2024-07-06 00:00:00,lost Reggie Jackson to CHO,-0.0,-31670,-0.0,-4.326669622331691,multitrade,Reggie Jackson
2024-07-06 00:00:00,lost future 2nd round pick to CHO,2496.390231116585,-29174,-0.9566674055829228,-5.283337027914614,multitrade,future 2nd round pick
2024-07-06 00:00:00,lost future 2nd round pick to CHO,2496.390231116585,-26677,-0.9566674055829228,-6.240004433497537,multitrade,future 2nd round pick
2024-07-06 00:00:00,added future 2nd round pick to DEN,-2496.390231116585,-29174,0.9566674055829228,-5.283337027914614,multitrade,future 2nd round pick
2024-07-06 00:00:00,added Vlatko Cancar to DEN,-965.6,-30139,-0.2,-5.483337027914614,signing,Vlatko Cancar
2024-07-09 00:00:00,added DeRon Holmes to DEN,0.0,-30139,0.0,-5.483337027914614,signing,DeRon Holmes
2024-07-10 00:00:00,added P.J. Hall to DEN,-92.4,-30232,0.0,-5.483337027914614,signing,P.J. Hall
2024-07-12 00:00:00,added Dario Saric to DEN,-1008.0,-31240,-0.1,-5.583337027914614,signing,Dario Saric
2024-07-24 00:00:00,added DeAndre Jordan to DEN,-874.9,-32114,0.1,-5.483337027914614,signing,DeAndre Jordan
2024-07-26 00:00:00,added Russell Westbrook to DEN,-2450.4,-34565,0.4,-5.083337027914614,signing,Russell Westbrook
2024-07-30 00:00:00,added Spencer Jones to DEN,-1062.5,-35627,-0.2,-5.283337027914614,signing,Spencer Jones
