date,Transaction,single_value_bpm,value_bpm,single_value_vorp,value_vorp,transaction_type,player_name
1968-06-04 00:00:00,added Gary Gregor to PHO,0.0,0,0.0,0.0,draft,Gary Gregor
1968-06-04 00:00:00,added Dick Cunningham to PHO,0.0,0,0.0,0.0,draft,Dick Cunningham
1968-06-04 00:00:00,added Art Beatty to PHO,0.0,0,0.0,0.0,draft,Art Beatty
1968-06-04 00:00:00,added Rich Jones to PHO,0.0,0,0.0,0.0,draft,Rich Jones
1968-06-04 00:00:00,added Harry Hollines to PHO,0.0,0,0.0,0.0,draft,Harry Hollines
1968-06-04 00:00:00,added Rod Knowles to PHO,0.0,0,0.0,0.0,draft,Rod Knowles
1968-06-04 00:00:00,added Charles Parks to PHO,0.0,0,0.0,0.0,draft,Charles Parks
1968-06-04 00:00:00,added Brian Clare to PHO,0.0,0,0.0,0.0,draft,Brian Clare
1968-06-04 00:00:00,added Merv Jackson to PHO,0.0,0,0.0,0.0,draft,Merv Jackson
1968-06-04 00:00:00,added Lee Davis to PHO,0.0,0,0.0,0.0,draft,Lee Davis
1968-06-04 00:00:00,added Ron Boone to PHO,0.0,0,0.0,0.0,draft,Ron Boone
1968-06-04 00:00:00,added Bill Davis to PHO,0.0,0,0.0,0.0,draft,Bill Davis
1968-06-04 00:00:00,added Pat Hobart to PHO,0.0,0,0.0,0.0,draft,Pat Hobart
1968-08-27 00:00:00,lost Em Bryant to BOS,-0.0,0,-0.0,0.0,trade,Em Bryant
1968-08-27 00:00:00,added Gene Williams to PHO,0.0,0,0.0,0.0,trade,Gene Williams
1968-09-11 00:00:00,lost Dennis Hamilton to ATL,-0.0,0,-0.0,0.0,trade,Dennis Hamilton
1968-09-11 00:00:00,added Lloyd Kerr to PHO,0.0,0,0.0,0.0,trade,Lloyd Kerr
1968-09-12 00:00:00,lost Dick Cunningham to MIL,-0.0,0,-0.0,0.0,trade,Dick Cunningham
1968-09-12 00:00:00,added John Arthurs to PHO,0.0,0,0.0,0.0,trade,John Arthurs
1968-10-18 00:00:00,added Ed Biedenbach to PHO,0.0,0,0.0,0.0,signing,Ed Biedenbach
1968-12-17 00:00:00,lost McCoy McLemore to DET,-0.0,0,-0.0,0.0,trade,McCoy McLemore
1968-12-17 00:00:00,added Jim Fox to PHO,0.0,0,0.0,0.0,trade,Jim Fox
1968-12-17 00:00:00,added Lamar Green to PHO,0.0,0,0.0,0.0,trade,Lamar Green
1969-01-20 00:00:00,lost George Wilson to PHI,-0.0,0,-0.0,0.0,trade,George Wilson
1969-01-20 00:00:00,added Jerry Chambers to PHO,0.0,0,0.0,0.0,trade,Jerry Chambers
1969-04-07 00:00:00,added Neal Walk to PHO,0.0,0,0.0,0.0,draft,Neal Walk
1969-04-07 00:00:00,added Gene Williams to PHO,0.0,0,0.0,0.0,draft,Gene Williams
1969-04-07 00:00:00,added Floyd Kerr to PHO,0.0,0,0.0,0.0,draft,Floyd Kerr
1969-04-07 00:00:00,added Lamar Green to PHO,0.0,0,0.0,0.0,draft,Lamar Green
1969-04-07 00:00:00,added Lloyd Kerr to PHO,0.0,0,0.0,0.0,draft,Lloyd Kerr
1969-04-07 00:00:00,added Dennis Stewart to PHO,0.0,0,0.0,0.0,draft,Dennis Stewart
1969-04-07 00:00:00,added Rich Jones to PHO,0.0,0,0.0,0.0,draft,Rich Jones
1969-04-07 00:00:00,added Dan Sadlier to PHO,0.0,0,0.0,0.0,draft,Dan Sadlier
1969-04-07 00:00:00,added Bill Sweek to PHO,0.0,0,0.0,0.0,draft,Bill Sweek
1969-04-07 00:00:00,added Bob Edwards to PHO,0.0,0,0.0,0.0,draft,Bob Edwards
1969-04-07 00:00:00,added Steve Jennings to PHO,0.0,0,0.0,0.0,draft,Steve Jennings
1969-04-07 00:00:00,added Rick Abrahamson to PHO,0.0,0,0.0,0.0,draft,Rick Abrahamson
1969-04-07 00:00:00,added Fred Lind to PHO,0.0,0,0.0,0.0,draft,Fred Lind
1969-04-07 00:00:00,added Bob Miller to PHO,0.0,0,0.0,0.0,draft,Bob Miller
1969-04-07 00:00:00,added Andy White to PHO,0.0,0,0.0,0.0,draft,Andy White
1969-04-07 00:00:00,added Marv Schmitt to PHO,0.0,0,0.0,0.0,draft,Marv Schmitt
1969-04-07 00:00:00,added Bob Beamon to PHO,0.0,0,0.0,0.0,draft,Bob Beamon
1969-04-07 00:00:00,added Wayne Huckel to PHO,0.0,0,0.0,0.0,draft,Wayne Huckel
1969-04-07 00:00:00,added Howie Dickenman to PHO,0.0,0,0.0,0.0,draft,Howie Dickenman
1969-04-07 00:00:00,added Al Nuness to PHO,0.0,0,0.0,0.0,draft,Al Nuness
1969-04-07 00:00:00,added Solomon Davis to PHO,0.0,0,0.0,0.0,draft,Solomon Davis
1969-04-07 00:00:00,added Jim Plump to PHO,0.0,0,0.0,0.0,draft,Jim Plump
1969-05-08 00:00:00,lost Gary Gregor to ATL,-0.0,0,-0.0,0.0,trade,Gary Gregor
1969-05-08 00:00:00,added Paul Silas to PHO,0.0,0,0.0,0.0,trade,Paul Silas
1969-06-20 00:00:00,added Connie Hawkins to PHO,0.0,0,0.0,0.0,signing,Connie Hawkins
1969-09-13 00:00:00,lost Bill Melchionni to PHI,-0.0,0,-0.0,0.0,trade,Bill Melchionni
1969-09-13 00:00:00,added Joe DePre to PHO,0.0,0,0.0,0.0,trade,Joe DePre
1969-09-20 00:00:00,lost Gene Tormohlen to ATL,-0.0,0,-0.0,0.0,trade,Gene Tormohlen
1969-09-20 00:00:00,added Vann Williford to PHO,0.0,0,0.0,0.0,trade,Vann Williford
1969-10-26 00:00:00,lost Dick Snyder to SEA,-0.0,0,-0.0,0.0,trade,Dick Snyder
1969-10-26 00:00:00,added Art Harris to PHO,0.0,0,0.0,0.0,trade,Art Harris
1970-03-23 00:00:00,added Greg Howard to PHO,0.0,0,0.0,0.0,draft,Greg Howard
1970-03-23 00:00:00,added Fred Taylor to PHO,0.0,0,0.0,0.0,draft,Fred Taylor
1970-03-23 00:00:00,added Joe DePre to PHO,0.0,0,0.0,0.0,draft,Joe DePre
1970-03-23 00:00:00,added Greg McDivitt to PHO,0.0,0,0.0,0.0,draft,Greg McDivitt
1970-03-23 00:00:00,added Vann Williford to PHO,0.0,0,0.0,0.0,draft,Vann Williford
1970-03-23 00:00:00,added Bob Lienhard to PHO,0.0,0,0.0,0.0,draft,Bob Lienhard
1970-03-23 00:00:00,added John Canine to PHO,0.0,0,0.0,0.0,draft,John Canine
1970-03-23 00:00:00,added Joe Thomas to PHO,0.0,0,0.0,0.0,draft,Joe Thomas
1970-03-23 00:00:00,added Heyward Dotson to PHO,0.0,0,0.0,0.0,draft,Heyward Dotson
1970-03-23 00:00:00,added Steve Patterson to PHO,0.0,0,0.0,0.0,draft,Steve Patterson
1970-03-23 00:00:00,added Carl Ashley to PHO,0.0,0,0.0,0.0,draft,Carl Ashley
1970-03-23 00:00:00,added Gerhard Schreur to PHO,0.0,0,0.0,0.0,draft,Gerhard Schreur
1970-03-23 00:00:00,added Jim Walls to PHO,0.0,0,0.0,0.0,draft,Jim Walls
1970-03-23 00:00:00,added Ric Cobb to PHO,0.0,0,0.0,0.0,draft,Ric Cobb
1970-03-23 00:00:00,added Fred Carpenter to PHO,0.0,0,0.0,0.0,draft,Fred Carpenter
1970-03-23 00:00:00,added Chad Calabria to PHO,0.0,0,0.0,0.0,draft,Chad Calabria
1970-03-23 00:00:00,added Walt Williams to PHO,0.0,0,0.0,0.0,draft,Walt Williams
1970-04-23 00:00:00,lost Jim Fox to CHI,-0.0,0,-0.0,0.0,trade,Jim Fox
1970-04-23 00:00:00,lost Howard Porter to CHI,-0.0,0,-0.0,0.0,trade,Howard Porter
1970-04-23 00:00:00,added Clem Haskins to PHO,0.0,0,0.0,0.0,trade,Clem Haskins
1970-05-20 00:00:00,lost Gail Goodrich to LAL,-0.0,0,-0.0,0.0,trade,Gail Goodrich
1970-05-20 00:00:00,added Mel Counts to PHO,0.0,0,0.0,0.0,trade,Mel Counts
1970-07-08 00:00:00,lost Heyward Dotson to NYK,-0.0,0,-0.0,0.0,trade,Heyward Dotson
1970-07-08 00:00:00,added Bob Kissane to PHO,0.0,0,0.0,0.0,trade,Bob Kissane
1971-03-29 00:00:00,added John Roche to PHO,0.0,0,0.0,0.0,draft,John Roche
1971-03-29 00:00:00,added Mo Layton to PHO,0.0,0,0.0,0.0,draft,Mo Layton
1971-03-29 00:00:00,added Walt Szerbiak to PHO,0.0,0,0.0,0.0,draft,Walt Szerbiak
1971-03-29 00:00:00,added Ken Gardner to PHO,0.0,0,0.0,0.0,draft,Ken Gardner
1971-03-29 00:00:00,added Bob Kissane to PHO,0.0,0,0.0,0.0,draft,Bob Kissane
1971-03-29 00:00:00,added William Graham to PHO,0.0,0,0.0,0.0,draft,William Graham
1971-03-29 00:00:00,added Ralph Brateris to PHO,0.0,0,0.0,0.0,draft,Ralph Brateris
1971-03-29 00:00:00,added Vernell Ellzy to PHO,0.0,0,0.0,0.0,draft,Vernell Ellzy
1971-03-29 00:00:00,added Mike Johnson to PHO,0.0,0,0.0,0.0,draft,Mike Johnson
1971-03-29 00:00:00,added Tom Newell to PHO,0.0,0,0.0,0.0,draft,Tom Newell
1971-03-29 00:00:00,added Paul Litz to PHO,0.0,0,0.0,0.0,draft,Paul Litz
1971-03-29 00:00:00,added Floyd Mason to PHO,0.0,0,0.0,0.0,draft,Floyd Mason
1971-03-29 00:00:00,added Ron Dorsey to PHO,0.0,0,0.0,0.0,draft,Ron Dorsey
1971-03-29 00:00:00,added Ken Booker to PHO,0.0,0,0.0,0.0,draft,Ken Booker
1971-03-29 00:00:00,added Curtis Carter to PHO,0.0,0,0.0,0.0,draft,Curtis Carter
1971-04-02 00:00:00,lost Bob Nash to DET,1320.7,1320,0.2,0.2,trade,Bob Nash
1971-04-02 00:00:00,added Otto Moore to PHO,0.0,1320,0.0,0.2,trade,Otto Moore
1971-08-13 00:00:00,lost Greg Howard to CLE,-0.0,1320,-0.0,0.2,trade,Greg Howard
1971-08-13 00:00:00,added Scott English to PHO,0.0,1320,0.0,0.2,trade,Scott English
1971-12-27 00:00:00,lost Fred Taylor to CIN,-0.0,1320,-0.0,0.2,trade,Fred Taylor
1971-12-27 00:00:00,added Joe Reaves to PHO,0.0,1320,0.0,0.2,trade,Joe Reaves
1972-01-04 00:00:00,added Jeff Webb to PHO,0.0,1320,0.0,0.2,signing,Jeff Webb
1972-03-14 00:00:00,lost Paul Silas to BOS,-0.0,1320,-0.0,0.2,trade,Paul Silas
1972-03-14 00:00:00,added Charlie Scott to PHO,0.0,1320,0.0,0.2,trade,Charlie Scott
1972-04-07 00:00:00,lost Otto Moore to HOU,-0.0,1320,-0.0,0.2,trade,Otto Moore
1972-04-07 00:00:00,added Corky Calhoun to PHO,0.0,1320,0.0,0.2,trade,Corky Calhoun
1972-04-10 00:00:00,lost Tom Patterson to BAL,-0.0,1320,-0.0,0.2,trade,Tom Patterson
1972-04-10 00:00:00,added Gus Johnson to PHO,0.0,1320,0.0,0.2,trade,Gus Johnson
1972-04-10 00:00:00,added Corky Calhoun to PHO,-4716.4,-3395,0.0,0.2,draft,Corky Calhoun
1972-04-10 00:00:00,added Scott English to PHO,0.0,-3395,0.0,0.2,draft,Scott English
1972-04-10 00:00:00,added Don Buse to PHO,0.0,-3395,0.0,0.2,draft,Don Buse
1972-04-10 00:00:00,added Claude Terry to PHO,0.0,-3395,0.0,0.2,draft,Claude Terry
1972-04-10 00:00:00,added Matt Gantt to PHO,0.0,-3395,0.0,0.2,draft,Matt Gantt
1972-04-10 00:00:00,added Wardell Dyson to PHO,0.0,-3395,0.0,0.2,draft,Wardell Dyson
1972-04-10 00:00:00,added Charles Edge to PHO,0.0,-3395,0.0,0.2,draft,Charles Edge
1972-04-10 00:00:00,added Bernie Fryer to PHO,0.0,-3395,0.0,0.2,draft,Bernie Fryer
1972-04-10 00:00:00,added Russell Golden to PHO,0.0,-3395,0.0,0.2,draft,Russell Golden
1972-04-10 00:00:00,added Bill Kennedy to PHO,0.0,-3395,0.0,0.2,draft,Bill Kennedy
1972-04-10 00:00:00,added Al Vilcheck to PHO,0.0,-3395,0.0,0.2,draft,Al Vilcheck
1972-04-10 00:00:00,added John Belcher to PHO,0.0,-3395,0.0,0.2,draft,John Belcher
1972-04-10 00:00:00,added Mark Soderberg to PHO,0.0,-3395,0.0,0.2,draft,Mark Soderberg
1972-04-10 00:00:00,added Kelly Utley to PHO,0.0,-3395,0.0,0.2,draft,Kelly Utley
1972-04-10 00:00:00,added Ray Golson to PHO,0.0,-3395,0.0,0.2,draft,Ray Golson
1972-09-19 00:00:00,lost Truck Robinson to LAL,-0.0,-3395,-0.0,0.2,trade,Truck Robinson
1972-09-19 00:00:00,added Paul Stovall to PHO,0.0,-3395,0.0,0.2,trade,Paul Stovall
1972-10-10 00:00:00,lost Mel Counts to PHI,-0.0,-3395,-0.0,0.2,trade,Mel Counts
1972-10-10 00:00:00,added Gary Melchionni to PHO,0.0,-3395,0.0,0.2,trade,Gary Melchionni
1972-11-22 00:00:00,lost Allan Hornyak to CLE,-0.0,-3395,-0.0,0.2,trade,Allan Hornyak
1972-11-22 00:00:00,added Walt Wesley to PHO,0.0,-3395,0.0,0.2,trade,Walt Wesley
1973-04-24 00:00:00,added Mike Bantom to PHO,-8786.100000000002,-12181,-2.775557561562892e-17,0.1999999999999999,draft,Mike Bantom
1973-04-24 00:00:00,added Gary Melchionni to PHO,-3544.5,-15726,0.5,0.7,draft,Gary Melchionni
1973-04-24 00:00:00,added Joe Reaves to PHO,-163.4,-15889,0.0,0.7,draft,Joe Reaves
1973-04-24 00:00:00,added Steve Mitchell to PHO,0.0,-15889,0.0,0.7,draft,Steve Mitchell
1973-04-24 00:00:00,added Ron Robinson to PHO,0.0,-15889,0.0,0.7,draft,Ron Robinson
1973-04-24 00:00:00,added Clinton Harris to PHO,0.0,-15889,0.0,0.7,draft,Clinton Harris
1973-04-24 00:00:00,added Gene Doyle to PHO,0.0,-15889,0.0,0.7,draft,Gene Doyle
1973-04-24 00:00:00,added Jerry Bisbano to PHO,0.0,-15889,0.0,0.7,draft,Jerry Bisbano
1973-04-24 00:00:00,added Jim Owens to PHO,-1397.0,-17286,0.0,0.7,draft,Jim Owens
1973-04-24 00:00:00,added Sandy Smith to PHO,0.0,-17286,0.0,0.7,draft,Sandy Smith
1973-04-24 00:00:00,added Claude White to PHO,0.0,-17286,0.0,0.7,draft,Claude White
1973-04-24 00:00:00,added Lynn Greer to PHO,0.0,-17286,0.0,0.7,draft,Lynn Greer
1973-04-24 00:00:00,added Laymon Williamson to PHO,0.0,-17286,0.0,0.7,draft,Laymon Williamson
1973-04-24 00:00:00,added Kalevi Sarkalahti to PHO,0.0,-17286,0.0,0.7,draft,Kalevi Sarkalahti
1973-10-08 00:00:00,lost Bob Carrington to ATL,-0.0,-17286,-0.0,0.7,trade,Bob Carrington
1973-10-08 00:00:00,lost Eddie Johnson to ATL,-10469.7,-27756,-12.3,-11.6,trade,Eddie Johnson
1973-10-08 00:00:00,added Bob Christian to PHO,0.0,-27756,0.0,-11.6,trade,Bob Christian
1973-10-09 00:00:00,lost Walt Wesley to CAP,-0.0,-27756,-0.0,-11.6,trade,Walt Wesley
1973-10-09 00:00:00,added Earl Williams to PHO,0.0,-27756,0.0,-11.6,trade,Earl Williams
1973-10-09 00:00:00,added Bayard Forrest to PHO,0.0,-27756,0.0,-11.6,trade,Bayard Forrest
1973-10-30 00:00:00,lost Connie Hawkins to LAL,-0.0,-27756,-0.0,-11.6,trade,Connie Hawkins
1973-10-30 00:00:00,added Keith Erickson to PHO,0.0,-27756,0.0,-11.6,trade,Keith Erickson
1973-10-30 00:00:00,added Fred Saunders to PHO,0.0,-27756,0.0,-11.6,trade,Fred Saunders
1974-01-24 00:00:00,lost Otis Johnson to GSW,-0.0,-27756,-0.0,-11.6,trade,Otis Johnson
1974-01-24 00:00:00,added Bill Chamberlain to PHO,-513.8,-28270,0.1,-11.500000000000002,trade,Bill Chamberlain
1974-05-28 00:00:00,added John Shumate to PHO,2139.0,-26131,1.0,-10.500000000000002,draft,John Shumate
1974-05-28 00:00:00,added Fred Saunders to PHO,-2446.4,-28577,0.0,-10.500000000000002,draft,Fred Saunders
1974-05-28 00:00:00,added George Gervin to PHO,0.0,-28577,0.0,-10.500000000000002,draft,George Gervin
1974-05-28 00:00:00,added Earl Williams to PHO,-1664.0,-30241,0.1,-10.400000000000002,draft,Earl Williams
1974-05-28 00:00:00,added Randy Allen to PHO,0.0,-30241,0.0,-10.400000000000002,draft,Randy Allen
1974-05-28 00:00:00,added Ralph Bobik to PHO,0.0,-30241,0.0,-10.400000000000002,draft,Ralph Bobik
1974-05-28 00:00:00,added Collis Temple to PHO,0.0,-30241,0.0,-10.400000000000002,draft,Collis Temple
1974-05-28 00:00:00,added Clyde Dickey to PHO,0.0,-30241,0.0,-10.400000000000002,draft,Clyde Dickey
1974-05-28 00:00:00,added Tom Holland to PHO,0.0,-30241,0.0,-10.400000000000002,draft,Tom Holland
1974-05-28 00:00:00,added Ted Evans to PHO,0.0,-30241,0.0,-10.400000000000002,draft,Ted Evans
1974-05-28 00:00:00,added Mark Wasley to PHO,0.0,-30241,0.0,-10.400000000000002,draft,Mark Wasley
1974-09-06 00:00:00,lost Clem Haskins to WSB,-0.0,-30241,-0.0,-10.400000000000002,trade,Clem Haskins
1974-09-06 00:00:00,added Dave Stallworth to PHO,0.0,-30241,0.0,-10.400000000000002,trade,Dave Stallworth
1974-09-06 00:00:00,added Allen Murphy to PHO,0.0,-30241,0.0,-10.400000000000002,trade,Allen Murphy
1974-09-16 00:00:00,lost Neal Walk to NOJ,-0.0,-30241,-0.0,-10.400000000000002,trade,Neal Walk
1974-09-16 00:00:00,lost Clyde Mayes to NOJ,-0.0,-30241,-0.0,-10.400000000000002,trade,Clyde Mayes
1974-09-16 00:00:00,added Dennis Awtrey to PHO,0.0,-30241,0.0,-10.400000000000002,trade,Dennis Awtrey
1974-09-16 00:00:00,added Nate Hawthorne to PHO,-5935.6,-36177,-0.6,-11.000000000000002,trade,Nate Hawthorne
1974-09-16 00:00:00,added Curtis Perry to PHO,0.0,-36177,0.0,-11.000000000000002,trade,Curtis Perry
1974-09-16 00:00:00,added Adrian Dantley to PHO,0.0,-36177,0.0,-11.000000000000002,trade,Adrian Dantley
1974-11-27 00:00:00,lost Corky Calhoun to LAL,6461.6,-29715,-0.0,-11.000000000000002,trade,Corky Calhoun
1974-11-27 00:00:00,added Jacky Dorsey to PHO,0.0,-29715,0.0,-11.000000000000002,trade,Jacky Dorsey
1974-11-27 00:00:00,added Mike Bratz to PHO,0.0,-29715,0.0,-11.000000000000002,trade,Mike Bratz
1975-01-02 00:00:00,added Greg Jackson to PHO,-3564.9999999999995,-33280,-0.5,-11.500000000000002,signing,Greg Jackson
1975-05-23 00:00:00,lost Charlie Scott to BOS,-0.0,-33280,-0.0,-11.500000000000002,trade,Charlie Scott
1975-05-23 00:00:00,added Paul Westphal to PHO,50623.4,17342,20.0,8.499999999999998,trade,Paul Westphal
1975-05-23 00:00:00,added Jimmy Dan Conner to PHO,0.0,17342,0.0,8.499999999999998,trade,Jimmy Dan Conner
1975-05-23 00:00:00,added Butch Feher to PHO,0.0,17342,0.0,8.499999999999998,trade,Butch Feher
1975-05-29 00:00:00,lost Adrian Dantley to BUF,-4505.6,12837,-2.5,5.999999999999998,trade,Adrian Dantley
1975-05-29 00:00:00,added Ricky Sobers to PHO,0.0,12837,0.0,5.999999999999998,trade,Ricky Sobers
1975-05-29 00:00:00,added Alvan Adams to PHO,75934.5,88771,32.9,38.9,draft,Alvan Adams
1975-05-29 00:00:00,added Ricky Sobers to PHO,-2034.3,86737,1.5,40.4,draft,Ricky Sobers
1975-05-29 00:00:00,added Allen Murphy to PHO,0.0,86737,0.0,40.4,draft,Allen Murphy
1975-05-29 00:00:00,added Jimmy Dan Conner to PHO,0.0,86737,0.0,40.4,draft,Jimmy Dan Conner
1975-05-29 00:00:00,added Bayard Forrest to PHO,0.0,86737,0.0,40.4,draft,Bayard Forrest
1975-05-29 00:00:00,added Sam McCants to PHO,0.0,86737,0.0,40.4,draft,Sam McCants
1975-05-29 00:00:00,added Joe Pace to PHO,0.0,86737,0.0,40.4,draft,Joe Pace
1975-05-29 00:00:00,added Biff Burrell to PHO,0.0,86737,0.0,40.4,draft,Biff Burrell
1975-05-29 00:00:00,added Dave Edmonds to PHO,0.0,86737,0.0,40.4,draft,Dave Edmonds
1975-05-29 00:00:00,added Jack Schrader to PHO,0.0,86737,0.0,40.4,draft,Jack Schrader
1975-05-29 00:00:00,added Owen Brown to PHO,0.0,86737,0.0,40.4,draft,Owen Brown
1975-05-29 00:00:00,added Mike Moon to PHO,0.0,86737,0.0,40.4,draft,Mike Moon
1975-06-09 00:00:00,lost Jacky Dorsey to POR,153.0,86890,-0.0,40.4,trade,Jacky Dorsey
1975-06-09 00:00:00,added Phil Lumpkin to PHO,-1184.0,85706,-0.1,40.3,trade,Phil Lumpkin
1975-09-17 00:00:00,lost Greg Jackson to WSB,-0.0,85706,-0.0,40.3,trade,Greg Jackson
1975-09-30 00:00:00,lost Earl Williams to DET,393.4,86099,-0.2,40.1,trade,Earl Williams
1975-09-30 00:00:00,added Earl Tatum to PHO,0.0,86099,0.0,40.1,trade,Earl Tatum
1975-11-03 00:00:00,lost John Roche to LAL,-0.0,86099,-0.0,40.1,trade,John Roche
1975-11-03 00:00:00,lost Earl Tatum to LAL,-882.0,85217,-1.2000000000000002,38.89999999999999,trade,Earl Tatum
1975-11-03 00:00:00,added Pat Riley to PHO,0.0,85217,0.0,38.89999999999999,trade,Pat Riley
1975-11-22 00:00:00,lost Mike Bantom to SEA,2776.2,87993,-0.4,38.49999999999999,acquisition,Mike Bantom
1976-01-20 00:00:00,lost John Roche to LAL,-0.0,87993,-0.0,38.49999999999999,trade,John Roche
1976-02-01 00:00:00,lost John Shumate to BUF,-4765.4,83228,-3.3,35.2,trade,John Shumate
1976-02-01 00:00:00,added Gar Heard to PHO,0.0,83228,0.0,35.2,trade,Gar Heard
1976-02-01 00:00:00,added Al Fleming to PHO,0.0,83228,0.0,35.2,trade,Al Fleming
1976-06-08 00:00:00,added Ron Lee to PHO,1046.8000000000002,84275,2.6000000000000005,37.8,draft,Ron Lee
1976-06-08 00:00:00,added Al Fleming to PHO,0.0,84275,0.0,37.8,draft,Al Fleming
1976-06-08 00:00:00,added Butch Feher to PHO,292.2,84567,0.3,38.1,draft,Butch Feher
1976-06-08 00:00:00,added Ira Terrell to PHO,-875.5,83692,0.7,38.8,draft,Ira Terrell
1976-06-08 00:00:00,added Paul Miller to PHO,0.0,83692,0.0,38.8,draft,Paul Miller
1976-06-08 00:00:00,added Ralph Walker to PHO,0.0,83692,0.0,38.8,draft,Ralph Walker
1976-06-08 00:00:00,added Carl Brown to PHO,0.0,83692,0.0,38.8,draft,Carl Brown
1976-06-08 00:00:00,added Brad Warble to PHO,0.0,83692,0.0,38.8,draft,Brad Warble
1976-06-08 00:00:00,added Tom DeBerry to PHO,0.0,83692,0.0,38.8,draft,Tom DeBerry
1976-06-08 00:00:00,added John Irving to PHO,0.0,83692,0.0,38.8,draft,John Irving
1976-06-08 00:00:00,added Gary Jackson to PHO,0.0,83692,0.0,38.8,draft,Gary Jackson
1976-08-25 00:00:00,lost Glen Williams to BUF,-0.0,83692,-0.0,38.8,trade,Glen Williams
1976-08-25 00:00:00,added Tom Van Arsdale to PHO,0.0,83692,0.0,38.8,trade,Tom Van Arsdale
1976-09-23 00:00:00,added Marv Roberts to PHO,0.0,83692,0.0,38.8,signing,Marv Roberts
1976-12-08 00:00:00,added Dale Schlueter to PHO,0.0,83692,0.0,38.8,signing,Dale Schlueter
1977-03-18 00:00:00,lost Paul Mokeski to SEA,-0.0,83692,-0.0,38.8,trade,Paul Mokeski
1977-03-18 00:00:00,added Bayard Forrest to PHO,-1456.0000000000002,82236,0.7,39.5,trade,Bayard Forrest
1977-06-10 00:00:00,added Walter Davis to PHO,44693.1,126929,22.9,62.4,draft,Walter Davis
1977-06-10 00:00:00,added Mike Bratz to PHO,-10817.3,116111,-0.8,61.6,draft,Mike Bratz
1977-06-10 00:00:00,added Greg Griffin to PHO,-2743.0,113368,-0.5,61.1,draft,Greg Griffin
1977-06-10 00:00:00,added Cecil Rellford to PHO,0.0,113368,0.0,61.1,draft,Cecil Rellford
1977-06-10 00:00:00,added Billy McKinney to PHO,0.0,113368,0.0,61.1,draft,Billy McKinney
1977-06-10 00:00:00,added Alvin Scott to PHO,1701.6999999999994,115070,6.1,67.2,draft,Alvin Scott
1977-06-10 00:00:00,added Alvin Joseph to PHO,0.0,115070,0.0,67.2,draft,Alvin Joseph
1977-07-15 00:00:00,lost Dale Schlueter to POR,-0.0,115070,-0.0,67.2,trade,Dale Schlueter
1977-07-15 00:00:00,added Wayne Smith to PHO,0.0,115070,0.0,67.2,trade,Wayne Smith
1977-09-06 00:00:00,lost Ricky Sobers to IND,2883.2,117953,-2.3,64.9,trade,Ricky Sobers
1977-09-06 00:00:00,added Don Buse to PHO,5082.0,123035,5.1,70.0,trade,Don Buse
1978-06-09 00:00:00,added Marty Byrnes to PHO,-2936.0,120099,-0.4,69.6,draft,Marty Byrnes
1978-06-09 00:00:00,added Joel Kramer to PHO,-5356.1,114743,0.7,70.3,draft,Joel Kramer
1978-06-09 00:00:00,added Bob Miller to PHO,0.0,114743,0.0,70.3,draft,Bob Miller
1978-06-09 00:00:00,added Wayne Smith to PHO,0.0,114743,0.0,70.3,draft,Wayne Smith
1978-06-09 00:00:00,added Andre Wakefield to PHO,0.0,114743,0.0,70.3,draft,Andre Wakefield
1978-06-09 00:00:00,added Charles Thompson to PHO,0.0,114743,0.0,70.3,draft,Charles Thompson
1978-06-09 00:00:00,added Steve Malovic to PHO,0.0,114743,0.0,70.3,draft,Steve Malovic
1978-06-09 00:00:00,added George Fowler to PHO,0.0,114743,0.0,70.3,draft,George Fowler
1978-06-09 00:00:00,added Nate Stokes to PHO,0.0,114743,0.0,70.3,draft,Nate Stokes
1978-06-09 00:00:00,added Lewis Cohen to PHO,0.0,114743,0.0,70.3,draft,Lewis Cohen
1978-10-11 00:00:00,lost Dennis Awtrey to BOS,-0.0,114743,-0.0,70.3,trade,Dennis Awtrey
1978-10-11 00:00:00,added Johnny High to PHO,0.0,114743,0.0,70.3,trade,Johnny High
1979-01-12 00:00:00,lost Marty Byrnes to NOJ,1431.0,116174,0.1,70.39999999999999,trade,Marty Byrnes
1979-01-12 00:00:00,lost Ron Lee to NOJ,1114.4,117289,0.1,70.49999999999999,trade,Ron Lee
1979-01-12 00:00:00,lost Larry Knight to NOJ,-0.0,117289,-0.0,70.49999999999999,trade,Larry Knight
1979-01-12 00:00:00,lost John Duren to NOJ,-0.0,117289,-0.0,70.49999999999999,trade,John Duren
1979-01-12 00:00:00,added Truck Robinson to PHO,-11061.6,106227,1.9,72.39999999999999,trade,Truck Robinson
1979-01-16 00:00:00,added Ted McClain to PHO,0.0,106227,0.0,72.39999999999999,signing,Ted McClain
1979-05-22 00:00:00,added Jeff Cook to PHO,-7730.1,98497,0.7999999999999998,73.19999999999999,signing,Jeff Cook
1979-06-22 00:00:00,lost Steve Malovic to WSB,26.4,98523,-0.0,73.19999999999999,trade,Steve Malovic
1979-06-22 00:00:00,added Kyle Macy to PHO,0.0,98523,0.0,73.19999999999999,trade,Kyle Macy
1979-06-22 00:00:00,added John Campbell to PHO,0.0,98523,0.0,73.19999999999999,trade,John Campbell
1979-06-25 00:00:00,added Kyle Macy to PHO,11199.2,109722,8.2,81.39999999999999,draft,Kyle Macy
1979-06-25 00:00:00,added Johnny High to PHO,-7147.9,102575,0.5,81.89999999999999,draft,Johnny High
1979-06-25 00:00:00,added Al Green to PHO,0.0,102575,0.0,81.89999999999999,draft,Al Green
1979-06-25 00:00:00,added Malcolm Cesare to PHO,0.0,102575,0.0,81.89999999999999,draft,Malcolm Cesare
1979-06-25 00:00:00,added Mark Eaton to PHO,0.0,102575,0.0,81.89999999999999,draft,Mark Eaton
1979-06-25 00:00:00,added Dale Shackleford to PHO,0.0,102575,0.0,81.89999999999999,draft,Dale Shackleford
1979-06-25 00:00:00,added Ollie Matson to PHO,0.0,102575,0.0,81.89999999999999,draft,Ollie Matson
1979-06-25 00:00:00,added Charles Jones to PHO,0.0,102575,0.0,81.89999999999999,draft,Charles Jones
1979-06-25 00:00:00,added Hosea Champine to PHO,0.0,102575,0.0,81.89999999999999,draft,Hosea Champine
1979-06-25 00:00:00,added Korky Nelson to PHO,0.0,102575,0.0,81.89999999999999,draft,Korky Nelson
1979-08-24 00:00:00,lost Don Koonce to DET,-0.0,102575,-0.0,81.89999999999999,trade,Don Koonce
1979-08-24 00:00:00,added Andre Wakefield to PHO,0.0,102575,0.0,81.89999999999999,trade,Andre Wakefield
1980-02-15 00:00:00,lost Brook Steppe to NJN,-0.0,102575,-0.0,81.89999999999999,trade,Brook Steppe
1980-02-15 00:00:00,lost Pace Mannion to NJN,511.2,103086,-0.0,81.89999999999999,trade,Pace Mannion
1980-02-15 00:00:00,added Rich Kelley to PHO,4016.2,107102,3.2,85.1,trade,Rich Kelley
1980-06-04 00:00:00,lost Paul Westphal to SEA,-862.4000000000001,106240,-0.7,84.39999999999999,trade,Paul Westphal
1980-06-04 00:00:00,added Dennis Johnson to PHO,10821.0,117061,6.9,91.3,trade,Dennis Johnson
1980-06-09 00:00:00,lost Elston Turner to DAL,7596.599999999999,124657,0.3,91.6,trade,Elston Turner
1980-06-09 00:00:00,added Wiley Peck to PHO,0.0,124657,0.0,91.6,trade,Wiley Peck
1980-06-10 00:00:00,added Kimberly Belton to PHO,0.0,124657,0.0,91.6,draft,Kimberly Belton
1980-06-10 00:00:00,added John Campbell to PHO,0.0,124657,0.0,91.6,draft,John Campbell
1980-06-10 00:00:00,added Doug True to PHO,0.0,124657,0.0,91.6,draft,Doug True
1980-06-10 00:00:00,added Leroy Stampley to PHO,0.0,124657,0.0,91.6,draft,Leroy Stampley
1980-06-10 00:00:00,added Mark Stevens to PHO,0.0,124657,0.0,91.6,draft,Mark Stevens
1980-06-10 00:00:00,added Coby Leavitt to PHO,0.0,124657,0.0,91.6,draft,Coby Leavitt
1980-06-10 00:00:00,added Ron Williams to PHO,0.0,124657,0.0,91.6,draft,Ron Williams
1980-06-10 00:00:00,added Jim Connolly to PHO,0.0,124657,0.0,91.6,draft,Jim Connolly
1980-06-10 00:00:00,added Keith French to PHO,0.0,124657,0.0,91.6,draft,Keith French
1980-06-10 00:00:00,added Randy Carroll to PHO,0.0,124657,0.0,91.6,draft,Randy Carroll
1980-06-25 00:00:00,added John McCullough to PHO,0.0,124657,0.0,91.6,signing,John McCullough
1980-06-25 00:00:00,added Mike Niles to PHO,-2032.8,122624,-0.5,91.1,signing,Mike Niles
1980-11-25 00:00:00,lost Don Buse to IND,-7122.900000000001,115501,-3.6,87.5,trade,Don Buse
1980-11-25 00:00:00,added Al Leslie to PHO,0.0,115501,0.0,87.5,trade,Al Leslie
1980-11-25 00:00:00,added Jose Slaughter to PHO,0.0,115501,0.0,87.5,trade,Jose Slaughter
1981-04-28 00:00:00,added John McCullough to PHO,0.0,115501,0.0,87.5,signing,John McCullough
1981-06-08 00:00:00,lost Al Leslie to IND,-0.0,115501,-0.0,87.5,trade,Al Leslie
1981-06-08 00:00:00,lost Jose Slaughter to IND,2163.0,117664,0.3,87.8,trade,Jose Slaughter
1981-06-08 00:00:00,added Dudley Bradley to PHO,-1030.7,116634,0.2,88.0,trade,Dudley Bradley
1981-06-09 00:00:00,added Larry Nance to PHO,55453.4,172087,21.9,109.9,draft,Larry Nance
1981-06-09 00:00:00,added Sam Clancy to PHO,0.0,172087,0.0,109.9,draft,Sam Clancy
