date,Transaction,single_value,value
2010-08-11,lost Darren Collison to IND,-8222.4,-8222
2010-08-11,lost James Posey to IND,1678.0,-6544
2010-08-11,added Trevor Ariza to NOH,715.0,-5829
2010-08-11,lost Julian Wright to TOR,-0.0,-5829
2010-08-11,added Marco Belinelli to NOP,0.0,-5829
2010-09-20,added Joe Alexander to NOP,0.0,-5829
2010-09-23,lost Craig Brackins to PHI,1204.5,-4624
2010-09-23,lost Darius Songaila to PHI,731.3000000000001,-3893
2010-09-23,added Willie Green to NOP,0.0,-3893
2010-09-23,added Jason Smith to NOP,-2988.0,-6881
2010-09-24,added Pops Mensah-Bonsu to NOP,0.0,-6881
2010-09-24,added Jannero Pargo to NOP,0.0,-6881
2010-10-13,added D.J. Mbenga to NOP,0.0,-6881
2010-10-23,lost Tobias Harris to POR,-0.0,-6881
2010-10-23,added Jerryd Bayless to NOP,0.0,-6881
2010-11-20,lost Jerryd Bayless to TOR,417.8999999999999,-6463
2010-11-20,lost Peja Stojaković to TOR,-341.0,-6804
2010-11-20,added David Andersen to NOP,0.0,-6804
2010-11-20,added Marcus Banks to NOP,0.0,-6804
2010-11-20,added Jarrett Jack to NOP,-46.2,-6850
2011-02-04,added Sasha Pavlović to NOP,0.0,-6850
2011-02-23,lost Marcus Thornton to SAC,-1854.5000000000005,-8705
2011-02-23,added Carl Landry to NOP,0.0,-8705
2011-03-26,added Patrick Ewing to NOP,0.0,-8705
2011-06-23,added Josh Harrellson to NOP,0.0,-8705
2011-06-23,lost Josh Harrellson to NYK,-54.0,-8759
2011-12-09,added Trey Johnson to NOP,0.0,-8759
2011-12-09,added DaJuan Summers to NOP,0.0,-8759
2011-12-09,added Lance Thomas to NOP,0.0,-8759
2011-12-09,added Carldell Johnson to NOP,0.0,-8759
2011-12-09,added Brian Butch to NOP,0.0,-8759
2011-12-14,lost Chris Paul to LAC,-117970.5,-126729
2011-12-14,lost Artūras Gudaitis to LAC,-0.0,-126729
2011-12-14,added Al-Farouq Aminu to NOP,-1227.0,-127956
2011-12-14,added Eric Gordon to NOP,-3194.6,-131151
2011-12-14,added Chris Kaman to NOP,0.0,-131151
2011-12-14,added Austin Rivers to NOP,0.0,-131151
2011-12-23,added Gustavo Ayón to NOP,0.0,-131151
2011-12-24,lost Quincy Pondexter to MEM,4774.3,-126377
2011-12-24,added Greivis Vásquez to NOP,0.0,-126377
2012-01-04,lost Glen Rice Jr. to PHI,-0.0,-126377
2012-01-04,added Xavier Henry to NOH,-6598.5,-132975
2012-02-06,added Lance Thomas to NOP,0.0,-132975
2012-02-08,added Donald Sloan to NOP,0.0,-132975
2012-02-15,added Solomon Jones to NOP,0.0,-132975
2012-03-09,added Jeff Foote to NOP,0.0,-132975
2012-04-10,added Jerome Dyson to NOP,0.0,-132975
2012-04-18,added Darryl Watkins to NOP,0.0,-132975
2012-06-20,lost Trevor Ariza to WAS,-7301.0,-140276
2012-06-20,lost Emeka Okafor to WAS,1436.4,-138840
2012-06-20,added Rashard Lewis to NOP,0.0,-138840
2012-06-20,added Darius Miller to NOP,0.0,-138840
2012-06-28,added Anthony Davis to NOP,93245.6,-45594
2012-06-28,added Austin Rivers to NOP,-6868.599999999999,-52463
2012-06-28,added Darius Miller to NOP,-2024.4000000000012,-54487
2012-07-11,lost Gustavo Ayón to ORL,1142.0,-53345
2012-07-11,added Ryan Anderson to NOP,208.9,-53136
2012-07-11,lost Darryl Watkins to PHI,-0.0,-53136
2012-07-11,lost Jarrett Jack to GSW,-1174.5,-54311
2012-07-11,added Edin Bavčić to NOH,0.0,-54311
2012-07-13,added Brad Miller to NOP,0.0,-54311
2012-07-13,added Lorenzo Brown to NOP,0.0,-54311
2012-07-13,added Rade Zagorac to NOP,0.0,-54311
2012-07-27,lost Jerome Dyson to PHO,-0.0,-54311
2012-07-27,lost Brad Miller to PHO,-0.0,-54311
2012-07-27,lost Rade Zagorac to PHO,-0.0,-54311
2012-07-27,lost Lorenzo Brown to MIN,1372.5,-52938
2012-07-27,added Robin Lopez to NOH,1281.6,-51657
2012-07-27,added Hakim Warrick to NOH,98.0,-51559
2012-08-04,added Roger Mason to NOP,0.0,-51559
2012-08-16,added Brian Roberts to NOP,-2833.9,-54393
2012-10-01,added Solomon Alabi to NOP,0.0,-54393
2012-11-13,lost Hakim Warrick to CHA,2458.2,-51934
2012-11-13,added Matt Carroll to NOP,0.0,-51934
2012-12-16,added Dominic McGuire to NOP,0.0,-51934
2013-01-07,added Donald Sloan to NOP,0.0,-51934
2013-03-03,added Henry Sims to NOP,0.0,-51934
2013-03-08,added Terrel Harris to NOP,0.0,-51934
2013-03-12,added Lou Amundson to NOP,-1196.0,-53130
2013-06-27,added Nerlens Noel to NOP,0.0,-53130
2013-07-10,added Greg Stiemsma to NOP,-1711.9,-54842
2013-07-10,lost Greivis Vásquez to SAC,837.0,-54005
2013-07-10,lost Terrel Harris to POR,-0.0,-54005
2013-07-10,lost Robin Lopez to POR,-3287.4,-57293
2013-07-10,added Jeff Withey to NOP,0.0,-57293
2013-07-10,added Tyreke Evans to NOP,5745.3,-51547
2013-07-12,lost Nerlens Noel to PHI,-718.5000000000002,-52266
2013-07-12,lost Elfrid Payton to PHI,-0.0,-52266
2013-07-12,added Jrue Holiday to NOP,10797.7,-41468
2013-07-12,added Pierre Jackson to NOP,0.0,-41468
2013-07-18,added Anthony Morrow to NOP,-1283.4,-42752
2013-07-29,added Jeff Withey to NOP,7.300000000000011,-42744
2013-08-22,added Lance Thomas to NOP,-403.2,-43147
2013-08-22,added Arinze Onuaku to NOP,-90.0,-43237
2014-01-21,lost Edin Bavčić to BRK,-0.0,-43237
2014-01-21,added Tyshawn Taylor to NOP,0.0,-43237
2014-02-04,added Luke Babbitt to NOP,-852.3000000000002,-44090
2014-04-11,added James Southerland to NOP,59.400000000000006,-44030
2014-04-14,added Melvin Ely to NOP,-278.1,-44308
2014-06-27,lost Pierre Jackson to PHI,-0.0,-44308
2014-06-27,added Russ Smith to NOP,0.0,-44308
2014-07-11,added Alonzo Gee to NOP,-4243.2,-48552
2014-07-14,added Scotty Hopson to NOP,0.0,-48552
2014-07-15,lost Melvin Ely to WAS,-0.0,-48552
2014-07-15,lost Alonzo Gee to HOU,-0.0,-48552
2014-07-15,lost Scotty Hopson to HOU,-0.0,-48552
2014-07-15,lost Sam Dekker to HOU,270.6,-48281
2014-07-15,added Ömer Aşık to NOP,-2378.4,-50659
2014-07-15,added Omri Casspi to NOP,0.0,-50659
2014-07-15,added Russ Smith to NOP,-730.8,-51390
2014-07-19,added Patric Young to NOP,0.0,-51390
2014-07-22,added Jimmer Fredette to NOP,-2392.3,-53783
2014-07-25,added Darius Miller to NOP,-485.8999999999997,-54268
2014-08-26,added John Salmons to NOP,-891.0,-55159
2014-09-10,added Dionte Christmas to NOP,0.0,-55159
2014-09-10,added Vernon Macklin to NOP,0.0,-55159
2014-09-26,added Kevin Jones to NOP,0.0,-55159
2014-10-01,added D.J. Stephens to NOP,0.0,-55159
2014-12-04,added Gal Mekel to NOP,-485.9,-55645
2014-12-04,added Dante Cunningham to NOP,-4130.0,-59775
2015-01-12,lost Russ Smith to MEM,-66.00000000000001,-59841
2015-01-12,lost Austin Rivers to BOS,-0.0,-59841
2015-01-12,added Quincy Pondexter to NOP,-1628.9,-61470
2015-01-12,added Branden Dawson to NOP,0.0,-61470
2015-01-14,added Nate Wolters to NOP,-787.5,-62258
2015-02-04,added Toney Douglas to NOP,0.0,-62258
2015-02-19,lost John Salmons to PHO,-0.0,-62258
2015-02-19,added Norris Cole to NOP,-1639.1999999999998,-63897
2015-02-19,added Justin Hamilton to NOP,0.0,-63897
2015-02-19,added Shawne Williams to NOP,0.0,-63897
2015-02-19,added Ish Smith to NOP,185.1,-63712
2015-02-19,added Latavious Williams to NOP,0.0,-63712
2015-03-04,added Elliot Williams to NOP,-492.8,-64205
2015-03-24,added Toney Douglas to NOP,-300.9,-64506
2015-06-25,added Branden Dawson to NOP,0.0,-64506
2015-06-25,lost Branden Dawson to LAC,165.3,-64340
2015-07-09,added Ömer Aşık to NOP,-7106.799999999999,-71447
2015-07-09,added Alexis Ajinça to NOP,-5371.2,-76818
2015-07-09,added Dante Cunningham to NOP,-8157.199999999999,-84975
2015-07-16,added Luke Babbitt to NOP,-2112.5,-87088
2015-07-16,added Alonzo Gee to NOP,-4243.2,-91331
2015-07-28,added Kendrick Perkins to NOP,-2710.0,-94041
2015-08-19,added Bryce Dejean-Jones to NOP,0.0,-94041
2015-09-08,added Sean Kilpatrick to NOP,0.0,-94041
2015-09-08,added Jeff Adrien to NOP,0.0,-94041
2015-09-15,added Norris Cole to NOP,-4552.4,-98594
2015-09-18,added Chris Douglas-Roberts to NOP,0.0,-98594
2015-09-22,added Corey Webster to NOP,0.0,-98594
2015-10-11,added Jerome Jordan to NOP,0.0,-98594
2015-10-14,added Mirza Begić to NOP,0.0,-98594
2015-10-15,added Bo McCalebb to NOP,0.0,-98594
2015-10-16,added Nate Robinson to NOP,-105.8,-98699
2015-10-30,added Toney Douglas to NOP,0.0,-98699
2015-11-10,added Jimmer Fredette to NOP,-159.9,-98859
2015-12-24,lost Ish Smith to PHI,3730.6,-95129
2015-12-24,added David Michineau to NOP,0.0,-95129
2015-12-24,added Frank Mason III to NOP,0.0,-95129
2016-01-21,added Bryce Dejean-Jones to NOP,0.0,-95129
2016-02-18,lost Tony Carr to MIA,-0.0,-95129
2016-02-18,added Jarnell Stokes to NOP,0.0,-95129
2016-02-19,added Bryce Dejean-Jones to NOP,-697.5,-95826
2016-03-09,added Orlando Johnson to NOP,-723.6,-96550
2016-03-16,added Tim Frazier to NOP,0.0,-96550
2016-03-25,added Jordan Hamilton to NOP,0.0,-96550
2016-03-26,added Tim Frazier to NOP,375.1999999999998,-96175
2016-03-30,added James Ennis to NOP,0.0,-96175
2016-04-04,added Jordan Hamilton to NOP,-1003.2,-97178
2016-04-09,added James Ennis to NOP,338.4,-96839
2016-06-23,added Buddy Hield to NOP,0.0,-96839
2016-06-23,added David Michineau to NOP,0.0,-96839
2016-06-23,added Diamond Stone to NOP,0.0,-96839
2016-06-23,lost David Michineau to LAC,-0.0,-96839
2016-06-23,lost Diamond Stone to LAC,499.2000000000001,-96340
2016-06-23,added Cheick Diallo to NOP,0.0,-96340
2016-07-10,lost Luke Babbitt to MIA,3464.0,-92876
2016-07-10,added Tony Carr to NOP,0.0,-92876
2016-07-21,added Langston Galloway to NOP,-1680.0,-94556
2016-07-21,added Solomon Hill to NOP,-10468.2,-105024
2016-07-21,added E'Twaun Moore to NOP,-13168.5,-118193
2016-07-22,added Cheick Diallo to NOP,-2239.9,-120433
2016-07-22,added Alonzo Gee to NOP,0.0,-120433
2016-07-22,added Buddy Hield to NOP,-3250.8,-123684
2016-07-22,added Tim Frazier to NOP,-5299.2,-128983
2016-07-22,added Terrence Jones to NOP,-632.0,-129615
2016-08-11,added Robert Sacre to NOP,0.0,-129615
2016-08-11,added Chris Copeland to NOP,0.0,-129615
2016-08-12,added Shawn Dawson to NOP,0.0,-129615
2016-09-14,added Lance Stephenson to NOP,-583.2,-130198
2016-09-24,added Quinn Cook to NOP,0.0,-130198
2016-10-15,added Quincy Ford to NOP,0.0,-130198
2016-11-07,added Archie Goodwin to NOP,99.0,-130099
2016-11-21,added Anthony Brown to NOP,-643.5,-130742
2016-12-10,added Reggie Williams to NOP,0.0,-130742
2017-01-03,added Donatas Motiejūnas to NOP,-2059.7,-132802
2017-02-20,lost Tyreke Evans to SAC,-282.6,-133085
2017-02-20,lost Langston Galloway to SAC,1762.5,-131322
2017-02-20,lost Buddy Hield to SAC,-5865.5,-137188
2017-02-20,lost Zach Collins to SAC,-0.0,-137188
2017-02-20,lost Frank Mason III to SAC,3611.7,-133576
2017-02-20,added Omri Casspi to NOP,-127.2,-133703
2017-02-20,added DeMarcus Cousins to NOP,11320.9,-122382
2017-02-23,added Hollis Thompson to NOP,-592.1,-122974
2017-02-24,added Jarrett Jack to NOP,-46.2,-123021
2017-02-25,added Reggie Williams to NOP,-63.2,-123084
2017-03-06,added Jordan Crawford to NOP,0.0,-123084
2017-03-08,added Wayne Selden to NOP,-84.60000000000001,-123168
2017-03-16,added Jordan Crawford to NOP,574.6,-122594
2017-03-19,added Quinn Cook to NOP,0.0,-122594
2017-04-08,added Quinn Cook to NOP,-111.0,-122705
2017-04-10,added Axel Toupane to NOP,-180.4,-122885
2017-06-21,lost Tim Frazier to WAS,754.2,-122131
2017-06-21,added Edmond Sumner to NOP,0.0,-122131
2017-06-22,added Dwayne Bacon to NOP,0.0,-122131
2017-06-22,added Edmond Sumner to NOP,0.0,-122131
2017-06-22,lost Edmond Sumner to IND,4806.299999999999,-117325
2017-06-22,lost Dwayne Bacon to CHO,10831.0,-106494
2017-06-22,added Frank Jackson to NOP,0.0,-106494
2017-07-06,added Jrue Holiday to NOP,15699.8,-90794
2017-07-11,added Frank Jackson to NOP,-9760.9,-100555
2017-07-19,added Rajon Rondo to NOP,-511.5,-101066
2017-07-24,added Darius Miller to NOP,-8788.9,-109855
2017-08-02,added Charles Cooke to NOP,-547.2,-110402
2017-08-02,added Jalen Jones to NOP,-138.7,-110541
2017-08-03,added Ian Clark to NOP,-5092.5,-115634
2017-09-01,lost Quincy Pondexter to CHI,1450.4,-114183
2017-09-01,lost Tony Carr to CHI,-0.0,-114183
2017-09-01,added Ater Majok to NOP,0.0,-114183
2017-09-14,added Perry Jones to NOP,0.0,-114183
2017-09-15,added Tony Allen to NOP,-1501.5,-115685
2017-09-25,added Martell Webster to NOP,0.0,-115685
2017-09-25,added Cliff Alexander to NOP,0.0,-115685
2017-09-25,added Dante Cunningham to NOP,-2230.0,-117915
2017-10-22,added Jameer Nelson to NOP,-2332.2000000000003,-120247
2017-10-28,added Josh Smith to NOP,-175.2,-120422
2018-01-10,added DeAndre Liggins to NOP,0.0,-120422
2018-01-14,added Mike James to NOP,-181.8,-120604
2018-02-01,lost Tony Allen to CHI,-0.0,-120604
2018-02-01,lost Ömer Aşık to CHI,610.0,-119994
2018-02-01,lost Jameer Nelson to CHI,-0.0,-119994
2018-02-01,lost Chandler Hutchison to CHI,5500.7,-114493
2018-02-01,added Nikola Mirotić to NOP,1731.0,-112762
2018-02-01,added Tony Carr to NOP,0.0,-112762
2018-02-03,added Emeka Okafor to NOP,0.0,-112762
2018-02-05,added DeAndre Liggins to NOP,-439.2,-113201
2018-02-08,lost Dante Cunningham to BRK,402.3,-112799
2018-02-08,added Rashad Vaughn to NOP,0.0,-112799
2018-02-21,added Walt Lemon Jr. to NOP,-287.0,-113086
2018-02-26,added Emeka Okafor to NOP,-423.6,-113510
2018-03-15,added Larry Drew II to NOP,-291.5,-113801
2018-04-05,added Jordan Crawford to NOP,222.6,-113579
2018-06-21,added Tony Carr to NOP,0.0,-113579
2018-07-08,added Elfrid Payton to NOP,-2848.0,-116427
2018-07-08,added Julius Randle to NOP,3348.0,-113079
2018-07-08,added Ian Clark to NOP,-4962.299999999999,-118041
2018-07-17,added Trevon Bluiett to NOP,0.0,-118041
2018-07-20,added Garlon Green to NOP,0.0,-118041
2018-07-23,added Kenrich Williams to NOP,-4046.9,-122088
2018-07-27,added Troy Williams to NOP,0.0,-122088
2018-08-08,added Jahlil Okafor to NOP,-1495.9,-123584
2018-09-04,added Darius Morris to NOP,0.0,-123584
2018-09-19,added Jarrett Jack to NOP,0.0,-123584
2018-09-29,added Brandon McCoy to NOP,0.0,-123584
2018-10-15,lost Alexis Ajinça to LAC,-0.0,-123584
2018-10-15,added Wesley Johnson to NOP,-1168.7,-124752
2018-12-05,added Andrew Harrison to NOP,-349.6,-125102
2019-02-07,lost Wesley Johnson to WAS,1397.3,-123705
2019-02-07,added Markieff Morris to NOP,0.0,-123705
2019-02-07,added Hunter Tyson to NOP,0.0,-123705
2019-02-07,lost Nikola Mirotić to MIL,-640.0,-124345
2019-02-07,added Stanley Johnson to NOP,-1111.5,-125456
2019-02-07,added Jason Smith to NOP,-176.0,-125632
2019-02-07,added Jordan Bone to NOP,0.0,-125632
2019-02-07,added Elijah Hughes to NOP,0.0,-125632
2019-02-07,added Sam Merrill to NOP,0.0,-125632
2019-02-07,added Greg Brown III to NOP,0.0,-125632
