date,Transaction,single_value_bpm,value_bpm,single_value_vorp,value_vorp,transaction_type,player_name
1972-04-10 00:00:00,added Russ Lee to MIL,-514.6,-514,0.0,0.0,draft,Russ Lee
1972-04-10 00:00:00,added Julius Erving to MIL,0.0,-514,0.0,0.0,draft,Julius Erving
1972-04-10 00:00:00,added Chuck Terry to MIL,-137.6,-652,0.0,0.0,draft,Chuck Terry
1972-04-10 00:00:00,added George Adams to MIL,0.0,-652,0.0,0.0,draft,George Adams
1972-04-10 00:00:00,added Art White to MIL,0.0,-652,0.0,0.0,draft,Art White
1972-04-10 00:00:00,added Ron Harris to MIL,0.0,-652,0.0,0.0,draft,Ron Harris
1972-04-10 00:00:00,added Mickey Davis to MIL,0.0,-652,0.0,0.0,draft,Mickey Davis
1972-04-10 00:00:00,added Charles Kirkland to MIL,0.0,-652,0.0,0.0,draft,Charles Kirkland
1972-04-10 00:00:00,added Jim Regenold to MIL,0.0,-652,0.0,0.0,draft,Jim Regenold
1972-04-10 00:00:00,added Jolly Spight to MIL,0.0,-652,0.0,0.0,draft,Jolly Spight
1972-09-18 00:00:00,added Dick Cunningham to MIL,0.0,-652,0.0,0.0,acquisition,Dick Cunningham
1972-10-09 00:00:00,lost Toby Kimball to KCO,-0.0,-652,-0.0,0.0,trade,Toby Kimball
1972-10-09 00:00:00,added Clyde Turner to MIL,0.0,-652,0.0,0.0,trade,Clyde Turner
1972-10-10 00:00:00,lost Gary Melchionni to PHI,-0.0,-652,-0.0,0.0,trade,Gary Melchionni
1972-10-10 00:00:00,added Gary Gregor to MIL,0.0,-652,0.0,0.0,trade,Gary Gregor
1972-11-15 00:00:00,added Terry Driscoll to MIL,0.0,-652,0.0,0.0,signing,Terry Driscoll
1973-04-24 00:00:00,added Swen Nater to MIL,2744.0,2091,1.7,1.7,draft,Swen Nater
1973-04-24 00:00:00,added Clyde Turner to MIL,0.0,2091,0.0,1.7,draft,Clyde Turner
1973-04-24 00:00:00,added Harry Rogers to MIL,0.0,2091,0.0,1.7,draft,Harry Rogers
1973-04-24 00:00:00,added Larry Jackson to MIL,0.0,2091,0.0,1.7,draft,Larry Jackson
1973-04-24 00:00:00,added James Floyd to MIL,0.0,2091,0.0,1.7,draft,James Floyd
1973-04-24 00:00:00,added Eddie Childress to MIL,0.0,2091,0.0,1.7,draft,Eddie Childress
1973-04-24 00:00:00,added Walt McGary to MIL,0.0,2091,0.0,1.7,draft,Walt McGary
1973-04-24 00:00:00,added Bob Vacca to MIL,0.0,2091,0.0,1.7,draft,Bob Vacca
1973-04-24 00:00:00,added Ron Battle to MIL,0.0,2091,0.0,1.7,draft,Ron Battle
1973-08-24 00:00:00,added Ron Williams to MIL,0.0,2091,0.0,1.7,acquisition,Ron Williams
1973-09-10 00:00:00,added Bob Verga to MIL,0.0,2091,0.0,1.7,signing,Bob Verga
1973-11-05 00:00:00,added Cornell Warner to MIL,0.0,2091,0.0,1.7,signing,Cornell Warner
1974-01-08 00:00:00,added Dick Garrett to MIL,0.0,2091,0.0,1.7,signing,Dick Garrett
1974-05-28 00:00:00,added Gary Brokaw to MIL,-9105.0,-7013,-0.3,1.4,draft,Gary Brokaw
1974-05-28 00:00:00,added Greg McDougald to MIL,0.0,-7013,0.0,1.4,draft,Greg McDougald
1974-05-28 00:00:00,added Lionel Billingly to MIL,0.0,-7013,0.0,1.4,draft,Lionel Billingly
1974-05-28 00:00:00,added John Johnson to MIL,0.0,-7013,0.0,1.4,draft,John Johnson
1974-05-28 00:00:00,added Larry Williams to MIL,0.0,-7013,0.0,1.4,draft,Larry Williams
1974-05-28 00:00:00,added Bob Hornstein to MIL,0.0,-7013,0.0,1.4,draft,Bob Hornstein
1974-05-28 00:00:00,added Ralph Palomar to MIL,0.0,-7013,0.0,1.4,draft,Ralph Palomar
1974-05-28 00:00:00,added Mike Deane to MIL,0.0,-7013,0.0,1.4,draft,Mike Deane
1974-05-28 00:00:00,added Bruce Featherston to MIL,0.0,-7013,0.0,1.4,draft,Bruce Featherston
1974-05-30 00:00:00,added George Thompson to MIL,0.0,-7013,0.0,1.4,trade,George Thompson
1974-05-30 00:00:00,added George Thompson to MIL,0.0,-7013,0.0,1.4,signing,George Thompson
1974-06-10 00:00:00,added Kevin Restani to MIL,-9338.1,-16351,0.7999999999999999,2.2,acquisition,Kevin Restani
1974-07-07 00:00:00,added Bob Rule to MIL,0.0,-16351,0.0,2.2,signing,Bob Rule
1974-10-08 00:00:00,lost Russ Lee to NOJ,417.0,-15934,-0.0,2.2,trade,Russ Lee
1974-10-08 00:00:00,lost Rich Kelley to NOJ,-19711.7,-35646,-8.899999999999999,-6.699999999999999,trade,Rich Kelley
1974-10-08 00:00:00,added Steve Kuberski to MIL,0.0,-35646,0.0,-6.699999999999999,trade,Steve Kuberski
1974-10-08 00:00:00,added Clyde Mayes to MIL,0.0,-35646,0.0,-6.699999999999999,trade,Clyde Mayes
1974-11-08 00:00:00,lost Lucius Allen to LAL,-0.0,-35646,-0.0,-6.699999999999999,trade,Lucius Allen
1974-11-08 00:00:00,added Jim Price to MIL,-1881.6,-37527,1.8,-4.9,trade,Jim Price
1974-11-27 00:00:00,added Walt Wesley to MIL,0.0,-37527,0.0,-4.9,signing,Walt Wesley
1975-05-29 00:00:00,added Clyde Mayes to MIL,-3412.8,-40940,-0.4,-5.3,draft,Clyde Mayes
1975-05-29 00:00:00,added Cornelius Cash to MIL,0.0,-40940,0.0,-5.3,draft,Cornelius Cash
1975-05-29 00:00:00,added Brian Hammel to MIL,0.0,-40940,0.0,-5.3,draft,Brian Hammel
1975-05-29 00:00:00,added Bill Campion to MIL,0.0,-40940,0.0,-5.3,draft,Bill Campion
1975-05-29 00:00:00,added Oliver Purnell to MIL,0.0,-40940,0.0,-5.3,draft,Oliver Purnell
1975-05-29 00:00:00,added Wilbur Thomas to MIL,0.0,-40940,0.0,-5.3,draft,Wilbur Thomas
1975-05-29 00:00:00,added Bob McCurdy to MIL,0.0,-40940,0.0,-5.3,draft,Bob McCurdy
1975-05-29 00:00:00,added Eric Hays to MIL,0.0,-40940,0.0,-5.3,draft,Eric Hays
1975-05-29 00:00:00,added Romie Thomas to MIL,0.0,-40940,0.0,-5.3,draft,Romie Thomas
1975-06-05 00:00:00,added Alex English to MIL,0.0,-40940,0.0,-5.3,trade,Alex English
1975-06-05 00:00:00,added Bayard Forrest to MIL,0.0,-40940,0.0,-5.3,trade,Bayard Forrest
1975-06-16 00:00:00,lost Kareem Abdul-Jabbar to LAL,-0.0,-40940,-0.0,-5.3,trade,Kareem Abdul-Jabbar
1975-06-16 00:00:00,lost Walt Wesley to LAL,-0.0,-40940,-0.0,-5.3,trade,Walt Wesley
1975-06-16 00:00:00,added Junior Bridgeman to MIL,-3060.7,-44001,8.299999999999999,2.999999999999999,trade,Junior Bridgeman
1975-06-16 00:00:00,added Dave Meyers to MIL,-5230.1,-49231,2.5,5.499999999999999,trade,Dave Meyers
1975-06-16 00:00:00,added Elmore Smith to MIL,0.0,-49231,0.0,5.499999999999999,trade,Elmore Smith
1975-06-16 00:00:00,added Brian Winters to MIL,-5966.0,-55197,7.699999999999999,13.2,trade,Brian Winters
1975-09-23 00:00:00,lost Ron Williams to LAL,-0.0,-55197,-0.0,13.2,trade,Ron Williams
1975-09-23 00:00:00,added James Rappis to MIL,0.0,-55197,0.0,13.2,trade,James Rappis
1975-10-22 00:00:00,lost Bayard Forrest to SEA,-0.0,-55197,-0.0,13.2,trade,Bayard Forrest
1975-10-22 00:00:00,added Jim Fox to MIL,0.0,-55197,0.0,13.2,trade,Jim Fox
1975-10-22 00:00:00,lost Cornell Warner to LAL,-0.0,-55197,-0.0,13.2,acquisition,Cornell Warner
1976-06-08 00:00:00,added Quinn Buckner to MIL,5914.1,-49283,7.800000000000001,21.0,draft,Quinn Buckner
1976-06-08 00:00:00,added Alex English to MIL,-170.39999999999998,-49453,1.0,22.0,draft,Alex English
1976-06-08 00:00:00,added Scott Lloyd to MIL,-4343.0,-53796,-0.6,21.4,draft,Scott Lloyd
1976-06-08 00:00:00,added Lloyd Walton to MIL,-5922.9,-59719,0.9,22.3,draft,Lloyd Walton
1976-06-08 00:00:00,added Dan Frost to MIL,0.0,-59719,0.0,22.3,draft,Dan Frost
1976-06-08 00:00:00,added Tom Lockhart to MIL,0.0,-59719,0.0,22.3,draft,Tom Lockhart
1976-06-08 00:00:00,added James Rappis to MIL,0.0,-59719,0.0,22.3,draft,James Rappis
1976-06-08 00:00:00,added Phil Spence to MIL,0.0,-59719,0.0,22.3,draft,Phil Spence
1976-06-08 00:00:00,added Ron Barrow to MIL,0.0,-59719,0.0,22.3,draft,Ron Barrow
1976-06-08 00:00:00,added Bob Warner to MIL,0.0,-59719,0.0,22.3,draft,Bob Warner
1976-06-08 00:00:00,added Bennie Shaw to MIL,0.0,-59719,0.0,22.3,draft,Bennie Shaw
1976-06-08 00:00:00,added Hugo Cabrera to MIL,0.0,-59719,0.0,22.3,draft,Hugo Cabrera
1976-08-05 00:00:00,lost Bird Averitt to BUF,9793.2,-49926,1.5,23.8,trade,Bird Averitt
1976-08-05 00:00:00,added Glen Williams to MIL,0.0,-49926,0.0,23.8,trade,Glen Williams
1976-11-02 00:00:00,lost Jim Price to BUF,732.6,-49193,-0.0,23.8,trade,Jim Price
1976-11-02 00:00:00,added Tate Armstrong to MIL,0.0,-49193,0.0,23.8,trade,Tate Armstrong
1976-11-12 00:00:00,added Glenn McDonald to MIL,-458.2,-49651,-0.1,23.7,signing,Glenn McDonald
1976-12-08 00:00:00,lost Wilson Washington to PHI,220.4,-49431,0.1,23.8,trade,Wilson Washington
1976-12-08 00:00:00,lost Maurice Cheeks to PHI,-89200.59999999999,-138632,-36.9,-13.1,trade,Maurice Cheeks
1976-12-08 00:00:00,added Fred Carter to MIL,0.0,-138632,0.0,-13.1,trade,Fred Carter
1977-01-13 00:00:00,lost Gary Brokaw to CLE,-59.6,-138691,-0.3,-13.400000000000002,trade,Gary Brokaw
1977-01-13 00:00:00,lost Elmore Smith to CLE,-0.0,-138691,-0.0,-13.400000000000002,trade,Elmore Smith
1977-01-13 00:00:00,added Rowland Garrett to MIL,-919.2,-139610,0.0,-13.400000000000002,trade,Rowland Garrett
1977-01-13 00:00:00,added Ernie Grunfeld to MIL,-2751.5,-142362,0.8,-12.6,trade,Ernie Grunfeld
1977-01-13 00:00:00,added George Johnson to MIL,-578.5,-142940,0.4,-12.2,trade,George Johnson
1986-09-30 00:00:00,,0.0,-142940,0.0,-12.2,,
1986-09-30 00:00:00,added Scooter McCray to CLE,-669.6,-143610,0.0,-12.2,signing,Scooter McCray
1986-12-09 00:00:00,lost Dirk Minniefield to HOU,3399.4,-140211,0.1,-12.1,trade,Dirk Minniefield
1987-01-13 00:00:00,added Craig Ehlo to CLE,10624.6,-129586,10.1,-2.0000000000000018,signing,Craig Ehlo
1987-01-24 00:00:00,added Tyrone Corbin to CLE,-3801.8,-133388,-0.1,-2.100000000000002,signing,Tyrone Corbin
1987-02-15 00:00:00,lost Ben Poquette to CHI,167.0,-133221,-0.0,-2.100000000000002,trade,Ben Poquette
1987-02-15 00:00:00,added Chucky Brown to CLE,0.0,-133221,0.0,-2.100000000000002,trade,Chucky Brown
1987-06-22 00:00:00,added Kevin Johnson to CLE,-208.6,-133429,0.5,-1.600000000000002,draft,Kevin Johnson
1987-06-22 00:00:00,added Kannard Johnson to CLE,-116.4,-133546,0.0,-1.600000000000002,draft,Kannard Johnson
1987-06-22 00:00:00,added Donald Royal to CLE,0.0,-133546,0.0,-1.600000000000002,draft,Donald Royal
1987-06-22 00:00:00,added Chris Dudley to CLE,-9570.7,-143116,-1.5,-3.100000000000002,draft,Chris Dudley
1987-06-22 00:00:00,added Carven Holcombe to CLE,0.0,-143116,0.0,-3.100000000000002,draft,Carven Holcombe
1987-06-22 00:00:00,added Carl Lott to CLE,0.0,-143116,0.0,-3.100000000000002,draft,Carl Lott
1987-06-22 00:00:00,added Harold Jensen to CLE,0.0,-143116,0.0,-3.100000000000002,draft,Harold Jensen
1987-06-22 00:00:00,added Michael Foster to CLE,0.0,-143116,0.0,-3.100000000000002,draft,Michael Foster
1987-10-08 00:00:00,lost Darryl Dawkins to UTA,572.0,-142544,0.1,-3.0000000000000018,trade,Darryl Dawkins
1987-10-08 00:00:00,lost Melvin Turpin to UTA,1617.6,-140927,-0.1,-3.100000000000002,trade,Melvin Turpin
1987-10-08 00:00:00,added Kent Benson to CLE,-46.8,-140974,0.0,-3.100000000000002,trade,Kent Benson
1987-10-08 00:00:00,added Dell Curry to CLE,-299.8,-141273,0.7,-2.400000000000002,trade,Dell Curry
1987-10-08 00:00:00,lost John Bagley to NJN,8317.0,-132956,-0.1,-2.500000000000002,trade,John Bagley
1987-10-08 00:00:00,lost Keith Lee to NJN,3443.9999999999995,-129512,0.4,-2.1000000000000023,trade,Keith Lee
1987-10-08 00:00:00,added James Bailey to CLE,0.0,-129512,0.0,-2.1000000000000023,trade,James Bailey
1987-10-08 00:00:00,added Darryl Dawkins to CLE,0.0,-129512,0.0,-2.1000000000000023,trade,Darryl Dawkins
1987-10-29 00:00:00,lost James Bailey to PHO,4953.3,-124559,0.8,-1.3000000000000025,trade,James Bailey
1987-10-29 00:00:00,added Greg Grant to CLE,0.0,-124559,0.0,-1.3000000000000025,trade,Greg Grant
1987-11-10 00:00:00,added Johnny Rogers to CLE,-1075.2,-125634,-0.2,-1.5000000000000022,signing,Johnny Rogers
1988-02-25 00:00:00,lost Tyrone Corbin to PHO,-2588.9,-128223,-1.8,-3.3000000000000025,trade,Tyrone Corbin
1988-02-25 00:00:00,lost Kevin Johnson to PHO,-97768.19999999998,-225991,-36.8,-40.1,trade,Kevin Johnson
1988-02-25 00:00:00,lost Mark West to PHO,5455.099999999999,-220536,-4.4,-44.5,trade,Mark West
1988-02-25 00:00:00,lost Dan Majerle to PHO,-37099.6,-257636,-19.3,-63.8,trade,Dan Majerle
1988-02-25 00:00:00,lost Dean Garrett to PHO,-0.0,-257636,-0.0,-63.8,trade,Dean Garrett
1988-02-25 00:00:00,lost Greg Grant to PHO,2101.8,-255534,0.2,-63.6,trade,Greg Grant
1988-02-25 00:00:00,added Larry Nance to CLE,55564.8,-199969,21.6,-41.99999999999999,trade,Larry Nance
1988-02-25 00:00:00,added Mike Sanders to CLE,-5835.4,-205805,-0.2,-42.2,trade,Mike Sanders
1988-02-25 00:00:00,added Randolph Keys to CLE,0.0,-205805,0.0,-42.2,trade,Randolph Keys
1988-03-29 00:00:00,added Kevin Henderson to CLE,-144.0,-205949,0.0,-42.2,signing,Kevin Henderson
1988-06-23 00:00:00,lost Steve Bardo to MIA,-0.0,-205949,-0.0,-42.2,trade,Steve Bardo
1988-06-23 00:00:00,added Darnell Valentine to CLE,-1629.0,-207578,0.0999999999999999,-42.1,trade,Darnell Valentine
1988-06-28 00:00:00,added Randolph Keys to CLE,-6046.0,-213624,-0.8999999999999999,-42.99999999999999,draft,Randolph Keys
1988-06-28 00:00:00,added Winston Bennett to CLE,-11396.5,-225020,-1.7999999999999998,-44.79999999999999,draft,Winston Bennett
1988-08-02 00:00:00,added Tree Rollins to CLE,-3712.7,-228733,-0.3,-45.09999999999999,signing,Tree Rollins
1989-06-27 00:00:00,added John Morton to CLE,-4797.6,-233531,-0.3999999999999999,-45.49999999999999,draft,John Morton
1989-06-27 00:00:00,added Chucky Brown to CLE,-11045.9,-244576,-1.2000000000000002,-46.69999999999999,draft,Chucky Brown
1989-09-05 00:00:00,lost Mark Buford to PHO,-0.0,-244576,-0.0,-46.69999999999999,trade,Mark Buford
1989-09-05 00:00:00,added Steve Kerr to CLE,-1446.5,-246023,1.3,-45.39999999999999,trade,Steve Kerr
1989-09-26 00:00:00,added Paul Mokeski to CLE,-3008.3,-249031,-0.5,-45.89999999999999,signing,Paul Mokeski
1989-10-05 00:00:00,added Gary Voce to CLE,-27.6,-249059,0.0,-45.89999999999999,signing,Gary Voce
1989-11-16 00:00:00,lost Ron Harper to LAC,-17238.5,-266297,-10.1,-55.99999999999999,trade,Ron Harper
1989-11-16 00:00:00,lost Loy Vaught to LAC,20432.6,-245865,-2.7,-58.7,trade,Loy Vaught
1989-11-16 00:00:00,lost Joe Wylie to LAC,-0.0,-245865,-0.0,-58.7,trade,Joe Wylie
1989-11-16 00:00:00,lost Elmore Spencer to LAC,11568.2,-234297,1.5,-57.2,trade,Elmore Spencer
1989-11-16 00:00:00,added Danny Ferry to CLE,-15527.999999999998,-249825,3.8,-53.4,trade,Danny Ferry
1989-11-16 00:00:00,added Reggie Williams to CLE,-2981.0,-252806,-0.5,-53.9,trade,Reggie Williams
1990-02-21 00:00:00,lost Chris Dudley to NJN,16067.999999999998,-236738,1.2999999999999998,-52.6,trade,Chris Dudley
1990-02-21 00:00:00,added Žan Tabak to CLE,0.0,-236738,0.0,-52.6,trade,Žan Tabak
1990-02-21 00:00:00,added Richard Petruška to CLE,0.0,-236738,0.0,-52.6,trade,Richard Petruška
1990-02-21 00:00:00,lost Žan Tabak to HOU,1528.8,-235209,0.3,-52.3,trade,Žan Tabak
1990-02-21 00:00:00,lost Curtis Blair to HOU,-0.0,-235209,-0.0,-52.3,trade,Curtis Blair
1990-02-21 00:00:00,lost Richard Petruška to HOU,754.4,-234454,0.1,-52.2,trade,Richard Petruška
1990-02-21 00:00:00,added Derrick Chievous to CLE,-1620.3000000000002,-236075,-0.3,-52.5,trade,Derrick Chievous
1990-02-22 00:00:00,lost Randolph Keys to CHH,4984.700000000001,-231090,0.7,-51.8,trade,Randolph Keys
1990-02-22 00:00:00,added Jimmy Oliver to CLE,0.0,-231090,0.0,-51.8,trade,Jimmy Oliver
1990-06-27 00:00:00,added Stefano Rusconi to CLE,0.0,-231090,0.0,-51.8,draft,Stefano Rusconi
1990-06-27 00:00:00,lost Stefano Rusconi to PHO,342.0,-230748,0.1,-51.7,trade,Stefano Rusconi
1990-06-27 00:00:00,added Miloš Babić to CLE,-572.0,-231320,-0.1,-51.8,trade,Miloš Babić
1990-07-30 00:00:00,added Henry James to CLE,0.0,-231320,0.0,-51.8,signing,Henry James
1990-09-27 00:00:00,added Gerald Paddio to CLE,-7676.5,-238996,-1.3,-53.1,signing,Gerald Paddio
1990-12-03 00:00:00,added Darnell Valentine to CLE,-1656.9,-240653,0.5,-52.6,signing,Darnell Valentine
1990-12-13 00:00:00,added Mike Woodson to CLE,-933.8,-241587,-0.2,-52.8,signing,Mike Woodson
1990-12-31 00:00:00,added Henry James to CLE,0.0,-241587,0.0,-52.8,signing,Henry James
1991-01-21 00:00:00,added Henry James to CLE,-1060.5,-242648,0.0,-52.8,signing,Henry James
1991-06-26 00:00:00,added Terrell Brandon to CLE,41829.6,-200818,16.6,-36.2,draft,Terrell Brandon
1991-06-26 00:00:00,added Jimmy Oliver to CLE,-1310.4,-202128,-0.2,-36.4,draft,Jimmy Oliver
1991-06-26 00:00:00,lost Terrell Bell to HOU,-0.0,-202128,-0.0,-36.4,trade,Terrell Bell
1991-06-26 00:00:00,added Keith Hughes to CLE,0.0,-202128,0.0,-36.4,trade,Keith Hughes
1991-07-17 00:00:00,added John Battle to CLE,-11756.0,-213884,-1.4000000000000004,-37.8,signing,John Battle
1991-08-14 00:00:00,added Henry James to CLE,-5629.0,-219513,-1.0,-38.8,signing,Henry James
1992-03-12 00:00:00,added Mike Sanders to CLE,0.0,-219513,0.0,-38.8,signing,Mike Sanders
1992-03-19 00:00:00,added Bobby Phills to CLE,0.0,-219513,0.0,-38.8,signing,Bobby Phills
1992-03-22 00:00:00,added Mike Sanders to CLE,-2789.9,-222303,0.1999999999999999,-38.6,signing,Mike Sanders
1992-03-29 00:00:00,added Bobby Phills to CLE,2148.5,-220155,5.0,-33.599999999999994,signing,Bobby Phills
1992-08-31 00:00:00,added Jerome Lane to CLE,-14.9,-220170,0.1,-33.49999999999999,signing,Jerome Lane
1992-10-08 00:00:00,added Jay Guidinger to CLE,-1096.5,-221266,-0.2,-33.7,signing,Jay Guidinger
1992-10-08 00:00:00,added Gerald Wilkins to CLE,-1529.0,-222795,2.1,-31.599999999999994,signing,Gerald Wilkins
1992-12-02 00:00:00,lost Steve Kerr to ORL,1056.0,-221739,-0.0,-31.599999999999994,trade,Steve Kerr
1992-12-02 00:00:00,added Reggie Geary to CLE,0.0,-221739,0.0,-31.599999999999994,trade,Reggie Geary
1993-06-15 00:00:00,added Gerald Madkins to CLE,-730.4,-222470,-0.1,-31.7,signing,Gerald Madkins
1993-06-30 00:00:00,added Chris Mills to CLE,-2748.4999999999995,-225218,5.0,-26.7,draft,Chris Mills
1993-07-15 00:00:00,lost Clifford Rozier to GSW,8588.4,-216630,1.1,-25.599999999999994,trade,Clifford Rozier
1993-07-15 00:00:00,added Tyrone Hill to CLE,-12172.8,-228802,1.5,-24.099999999999994,trade,Tyrone Hill
1993-11-09 00:00:00,added Sedric Toney to CLE,-678.4,-229481,-0.1,-24.2,signing,Sedric Toney
1993-12-23 00:00:00,added Rod Higgins to CLE,547.0,-228934,0.4,-23.8,signing,Rod Higgins
1994-01-19 00:00:00,added Jay Guidinger to CLE,-812.2,-229746,-0.1,-23.9,signing,Jay Guidinger
1994-03-18 00:00:00,added Gary Alexander to CLE,-326.8,-230073,-0.1,-24.0,signing,Gary Alexander
1994-04-15 00:00:00,added Tim Kempton to CLE,-330.0,-230403,-0.1,-24.1,signing,Tim Kempton
1994-06-29 00:00:00,added Gary Collier to CLE,0.0,-230403,0.0,-24.1,draft,Gary Collier
1994-08-02 00:00:00,added Michael Cage to CLE,-118.20000000000005,-230521,2.3,-21.8,signing,Michael Cage
1994-10-05 00:00:00,added Steve Colter to CLE,-752.0,-231273,0.2,-21.6,signing,Steve Colter
1994-10-05 00:00:00,added Greg Dreiling to CLE,-2849.7000000000003,-234123,-0.5,-22.1,signing,Greg Dreiling
1994-10-31 00:00:00,added Tony Campbell to CLE,-2707.2,-236830,-0.1,-22.200000000000003,signing,Tony Campbell
1995-01-26 00:00:00,added Elmer Bennett to CLE,257.40000000000003,-236573,0.1,-22.1,signing,Elmer Bennett
1995-02-23 00:00:00,added Fred Roberts to CLE,0.0,-236573,0.0,-22.1,signing,Fred Roberts
1995-03-16 00:00:00,added Fred Roberts to CLE,-758.1999999999999,-237331,-0.1,-22.200000000000003,signing,Fred Roberts
1995-06-14 00:00:00,lost George Banks to MIA,-0.0,-237331,-0.0,-22.200000000000003,trade,George Banks
1995-06-14 00:00:00,added Harold Miner to CLE,-1237.6,-238568,-0.2,-22.4,trade,Harold Miner
1995-06-14 00:00:00,added Donny Marshall to CLE,0.0,-238568,0.0,-22.4,trade,Donny Marshall
1995-06-28 00:00:00,added Bob Sura to CLE,4856.4,-233712,5.0,-17.400000000000002,draft,Bob Sura
1995-06-28 00:00:00,added Donny Marshall to CLE,-2724.2,-236436,-0.3,-17.700000000000003,draft,Donny Marshall
1995-09-27 00:00:00,lost Mark Price to WSB,317.5,-236119,-0.0,-17.700000000000003,trade,Mark Price
1995-09-27 00:00:00,added Vitaly Potapenko to CLE,0.0,-236119,0.0,-17.700000000000003,trade,Vitaly Potapenko
1995-10-05 00:00:00,added Joe Courtney to CLE,-1600.0,-237719,-0.3,-18.000000000000004,signing,Joe Courtney
1995-10-05 00:00:00,added John Amaechi to CLE,-3248.7,-240967,-0.6,-18.600000000000005,signing,John Amaechi
1995-10-07 00:00:00,lost Hot Rod Williams to PHO,2909.8,-238058,-1.7999999999999998,-20.40000000000001,trade,Hot Rod Williams
1995-10-07 00:00:00,added Antonio Lang to CLE,-4150.7,-242208,-0.4,-20.800000000000004,trade,Antonio Lang
1995-10-07 00:00:00,added Dan Majerle to CLE,4497.3,-237711,2.3,-18.500000000000004,trade,Dan Majerle
1995-10-07 00:00:00,added Brevin Knight to CLE,0.0,-237711,0.0,-18.500000000000004,trade,Brevin Knight
1995-10-23 00:00:00,added John Crotty to CLE,-802.1,-238513,0.1,-18.4,signing,John Crotty
1996-03-05 00:00:00,added Darryl Johnson to CLE,-235.2,-238748,0.0,-18.4,signing,Darryl Johnson
1996-06-26 00:00:00,added Vitaly Potapenko to CLE,-15314.3,-254063,-2.3000000000000003,-20.700000000000003,draft,Vitaly Potapenko
1996-06-26 00:00:00,added Zydrunas Ilgauskas to CLE,-2601.4999999999995,-256664,10.500000000000002,-10.2,draft,Zydrunas Ilgauskas
1996-06-26 00:00:00,added Reggie Geary to CLE,-344.4,-257009,0.0,-10.2,draft,Reggie Geary
1996-08-09 00:00:00,added Mark West to CLE,-3260.6,-260269,-0.3,-10.500000000000002,signing,Mark West
1996-09-06 00:00:00,added Shawnelle Scott to CLE,-455.0,-260724,0.0,-10.500000000000002,signing,Shawnelle Scott
1996-09-23 00:00:00,added Carl Thomas to CLE,-231.0,-260955,0.0,-10.500000000000002,signing,Carl Thomas
1997-06-25 00:00:00,added Derek Anderson to CLE,4691.1,-256264,2.6,-7.900000000000002,draft,Derek Anderson
1997-06-25 00:00:00,added Brevin Knight to CLE,10587.3,-245677,5.5,-2.400000000000002,draft,Brevin Knight
1997-06-25 00:00:00,added Cedric Henderson to CLE,-17872.8,-263550,-1.4,-3.800000000000002,draft,Cedric Henderson
1997-09-22 00:00:00,added Henry James to CLE,-564.4,-264114,-0.1,-3.900000000000002,signing,Henry James
1997-09-25 00:00:00,lost Terrell Brandon to MIL,-7358.3,-271472,-2.9,-6.8000000000000025,multitrade,Terrell Brandon
1997-09-25 00:00:00,lost Tyrone Hill to MIL,2273.2,-269199,-0.7000000000000001,-7.500000000000003,multitrade,Tyrone Hill
1997-09-25 00:00:00,lost Pat Garrity to MIL,-0.0,-269199,-0.0,-7.500000000000003,multitrade,Pat Garrity
1997-09-25 00:00:00,added Sherman Douglas to CLE,0.0,-269199,0.0,-7.500000000000003,multitrade,Sherman Douglas
1997-09-25 00:00:00,added Shawn Kemp to CLE,2623.2,-266576,4.1,-3.400000000000003,multitrade,Shawn Kemp
1997-10-01 00:00:00,lost Sean May to PHO,-0.0,-266576,-0.0,-3.400000000000003,multitrade,Sean May
1997-10-01 00:00:00,added Tony Dumas to CLE,-282.0,-266858,0.0,-3.400000000000003,multitrade,Tony Dumas
1997-10-01 00:00:00,added Wesley Person to CLE,19292.6,-247565,10.1,6.699999999999997,multitrade,Wesley Person
1997-10-02 00:00:00,added Mitchell Butler to CLE,-597.4,-248163,0.0,6.699999999999997,signing,Mitchell Butler
1997-10-02 00:00:00,added Adrian Caldwell to CLE,0.0,-248163,0.0,6.699999999999997,signing,Adrian Caldwell
1997-10-20 00:00:00,lost Sherman Douglas to DEN,-0.0,-248163,-0.0,6.699999999999997,trade,Sherman Douglas
1997-10-20 00:00:00,lost Eddie House to DEN,-0.0,-248163,-0.0,6.699999999999997,trade,Eddie House
1997-10-20 00:00:00,added Greg Graham to CLE,-492.80000000000007,-248655,-0.1,6.599999999999997,trade,Greg Graham
1997-12-12 00:00:00,added Scott Brooks to CLE,811.2,-247844,0.4,6.999999999999997,signing,Scott Brooks
1998-02-02 00:00:00,added Carl Thomas to CLE,0.0,-247844,0.0,6.999999999999997,signing,Carl Thomas
1998-02-22 00:00:00,added Carl Thomas to CLE,27.200000000000003,-247817,0.1,7.099999999999997,signing,Carl Thomas
1998-06-24 00:00:00,added Ryan Stack to CLE,-2658.2,-250475,-0.5,6.599999999999997,draft,Ryan Stack
1999-01-21 00:00:00,added Litterial Green to CLE,-54.0,-250529,0.0,6.599999999999997,signing,Litterial Green
1999-01-21 00:00:00,added Antonio Lang to CLE,-260.0,-250789,0.0,6.599999999999997,signing,Antonio Lang
1999-01-24 00:00:00,added Johnny Newman to CLE,-2941.9,-253731,-0.3,6.299999999999997,signing,Johnny Newman
1999-02-04 00:00:00,added Roy Rogers to CLE,0.0,-253731,0.0,6.299999999999997,signing,Roy Rogers
1999-03-10 00:00:00,added Earl Boykins to CLE,0.0,-253731,0.0,6.299999999999997,signing,Earl Boykins
1999-03-11 00:00:00,lost Vitaly Potapenko to BOS,19719.7,-234011,2.0,8.299999999999997,trade,Vitaly Potapenko
1999-03-11 00:00:00,added Andrew DeClercq to CLE,-4380.099999999999,-238392,0.2,8.499999999999996,trade,Andrew DeClercq
1999-03-11 00:00:00,added Andre Miller to CLE,23740.8,-214651,10.0,18.5,trade,Andre Miller
1999-03-13 00:00:00,added Corie Blount to CLE,-1067.2,-215718,-0.1,18.399999999999995,signing,Corie Blount
1999-03-19 00:00:00,added Mitchell Butler to CLE,-710.6,-216429,0.0,18.399999999999995,signing,Mitchell Butler
1999-03-23 00:00:00,added Earl Boykins to CLE,0.0,-216429,0.0,18.399999999999995,signing,Earl Boykins
1999-04-02 00:00:00,added Earl Boykins to CLE,-423.1,-216852,0.2,18.599999999999994,signing,Earl Boykins
2006-01-31 00:00:00,,0.0,-216852,0.0,18.599999999999994,,
2006-01-31 00:00:00,lost Aaron Williams to NOK,2283.6,-214568,0.2,18.799999999999997,trade,Aaron Williams
2006-01-31 00:00:00,added Edin Bavčić to TOR,0.0,-214568,0.0,18.799999999999997,trade,Edin Bavčić
2006-01-31 00:00:00,added Jack McClinton to TOR,0.0,-214568,0.0,18.799999999999997,trade,Jack McClinton
2006-02-03 00:00:00,lost Jalen Rose to NYK,-0.0,-214568,-0.4,18.399999999999995,trade,Jalen Rose
2006-02-03 00:00:00,lost Renaldo Balkman to NYK,576.9000000000001,-213991,-0.9,17.499999999999996,trade,Renaldo Balkman
2006-02-03 00:00:00,added Antonio Davis to TOR,-974.1,-214965,-0.1,17.399999999999995,trade,Antonio Davis
