date,Transaction,single_value,value
2008-06-26 00:00:00,added Joe Alexander to MIL,-2506,-2506
2008-06-26 00:00:00,added Luc Mbah a Moute to MIL,-11518,-14024
2008-06-26 00:00:00,lost Yi Jianlian to NJN,12185,-1839
2008-06-26 00:00:00,lost Bobby Simmons to NJN,1422,-417
2008-06-26 00:00:00,added Richard Jefferson to MIL,587,170
2008-07-16 00:00:00,added Tyronn Lue to MIL,-392,-221
2008-07-17 00:00:00,added Malik Allen to MIL,-2605,-2826
2008-08-13 00:00:00,lost Desmond Mason to OKC,5426,2599
2008-08-13 00:00:00,lost Mo Williams to CLE,-6660,-4060
2008-08-13 00:00:00,added Damon Jones to MIL,-432,-4492
2008-08-13 00:00:00,added Adrian Griffin to MIL,0,-4492
2008-08-13 00:00:00,added Luke Ridnour to MIL,3869,-622
2008-09-09 00:00:00,added Francisco Elson to MIL,-2502,-3125
2008-09-29 00:00:00,added Ron Howard to MIL,0,-3125
2009-02-05 00:00:00,lost Tyronn Lue to ORL,103,-3022
2009-02-05 00:00:00,added Keith Bogans to MIL,0,-3022
2009-02-09 00:00:00,added Eddie Gill to MIL,55,-2966
2009-06-23 00:00:00,lost Richard Jefferson to SAS,-467,-3433
2009-06-23 00:00:00,added Bruce Bowen to MIL,0,-3433
2009-06-23 00:00:00,added Fabricio Oberto to MIL,0,-3433
2009-06-23 00:00:00,added Kurt Thomas to MIL,-2307,-5741
2009-06-23 00:00:00,lost Fabricio Oberto to DET,0,-5741
2009-06-23 00:00:00,added Amir Johnson to MIL,0,-5741
2009-06-25 00:00:00,added Brandon Jennings to MIL,14123,8381
2009-06-25 00:00:00,added Jodie Meeks to MIL,-1458,6923
2009-07-31 00:00:00,added Hakim Warrick to MIL,-1024,5899
2009-07-31 00:00:00,lost Malik Allen to DEN,2599,8498
2009-07-31 00:00:00,added Walter Sharpe to MIL,0,8498
2009-07-31 00:00:00,added Sonny Weems to MIL,0,8498
2009-08-18 00:00:00,lost Amir Johnson to TOR,-2584,5914
2009-08-18 00:00:00,lost Sonny Weems to TOR,9235,15150
2009-08-18 00:00:00,added Carlos Delfino to MIL,5649,20800
2009-08-18 00:00:00,added Roko Ukić to MIL,-174,20625
2010-01-19 00:00:00,added Jerry Stackhouse to MIL,-1453,19171
2010-02-18 00:00:00,lost Francisco Elson to PHI,96,19267
2010-02-18 00:00:00,lost Jodie Meeks to PHI,738,20006
2010-02-18 00:00:00,added Primož Brezec to MIL,-354,19652
2010-02-18 00:00:00,added Royal Ivey to MIL,-297,19355
2010-02-18 00:00:00,added Darington Hobson to MIL,0,19355
2010-02-18 00:00:00,lost Joe Alexander to CHI,240,19596
2010-02-18 00:00:00,lost Hakim Warrick to CHI,1012,20608
2010-02-18 00:00:00,lost Kevin Séraphin to CHI,0,20608
2010-02-18 00:00:00,added John Salmons to MIL,2846,23455
2010-02-18 00:00:00,added Larry Sanders to MIL,0,23455
2010-02-18 00:00:00,added Isaiah Thomas to MIL,0,23455
2010-02-18 00:00:00,added Robert Sacre to MIL,0,23455
2010-06-22 00:00:00,lost Charlie Bell to GSW,855,24310
2010-06-22 00:00:00,lost Dan Gadzuric to GSW,2019,26329
2010-06-22 00:00:00,added Corey Maggette to MIL,-1120,25209
2010-06-22 00:00:00,added Jerome Jordan to MIL,0,25209
2010-06-23 00:00:00,lost Robert Sacre to NJN,0,25209
2010-06-23 00:00:00,added Chris Douglas-Roberts to MIL,-1237,23971
2010-06-24 00:00:00,added Larry Sanders to MIL,-4674,19296
2010-06-24 00:00:00,added Darington Hobson to MIL,-507,18789
2010-06-24 00:00:00,added Jerome Jordan to MIL,0,18789
2010-06-24 00:00:00,added Tiny Gallon to MIL,0,18789
2010-06-24 00:00:00,lost Jerome Jordan to NYK,21,18811
2010-07-08 00:00:00,added Drew Gooden to MIL,-402,18408
2010-07-19 00:00:00,added Keyon Dooling to MIL,-2108,16300
2010-07-21 00:00:00,lost Darnell Jackson to SAC,1701,18001
2010-07-21 00:00:00,lost Isaiah Thomas to SAC,-10376,7625
2010-07-21 00:00:00,added Jon Brockman to MIL,-4193,3431
2010-08-19 00:00:00,added Earl Boykins to MIL,2068,5500
2010-09-29 00:00:00,added Brian Skinner to MIL,0,5500
2010-12-02 00:00:00,added Brian Skinner to MIL,-25,5474
2011-01-25 00:00:00,added Garrett Temple to MIL,-531,4943
2011-03-01 00:00:00,added Earl Barron to MIL,0,4943
2011-06-23 00:00:00,added Jimmer Fredette to MIL,0,4943
2011-06-23 00:00:00,added Jon Leuer to MIL,-166,4776
2011-06-23 00:00:00,lost Jimmer Fredette to SAC,4467,9244
2011-06-23 00:00:00,lost John Salmons to SAC,11013,20257
2011-06-23 00:00:00,lost Corey Maggette to CHA,3435,23693
2011-06-23 00:00:00,added Tobias Harris to MIL,-1592,22100
2011-06-23 00:00:00,added Stephen Jackson to MIL,-2776,19324
2011-06-23 00:00:00,added Shaun Livingston to MIL,-1419,17904
2011-06-23 00:00:00,added Beno Udrih to MIL,-3274,14629
2011-12-09 00:00:00,lost Keyon Dooling to BOS,2846,17476
2011-12-09 00:00:00,added Albert Miralles to MIL,0,17476
2011-12-10 00:00:00,added Mike Dunleavy to MIL,2800,20276
2011-12-10 00:00:00,added Ron Howard to MIL,0,20276
2012-03-13 00:00:00,lost Andrew Bogut to GSW,-13300,6976
2012-03-13 00:00:00,lost Stephen Jackson to GSW,0,6976
2012-03-13 00:00:00,added Kwame Brown to MIL,0,6976
2012-03-13 00:00:00,added Monta Ellis to MIL,411,7387
2012-03-13 00:00:00,added Ekpe Udoh to MIL,-6413,973
2012-06-27 00:00:00,lost Jon Brockman to HOU,0,973
2012-06-27 00:00:00,lost Jon Leuer to HOU,0,973
2012-06-27 00:00:00,lost Shaun Livingston to HOU,0,973
2012-06-27 00:00:00,lost Jeremy Lamb to HOU,0,973
2012-06-27 00:00:00,added Samuel Dalembert to MIL,-459,514
2012-06-27 00:00:00,added John Henson to MIL,0,514
2012-06-27 00:00:00,added Nemanja Dangubić to MIL,0,514
2012-06-28 00:00:00,added John Henson to MIL,-4382,-3867
2012-06-28 00:00:00,added Doron Lamb to MIL,-2492,-6359
2012-08-09 00:00:00,added Joel Przybilla to MIL,-482,-6842
2012-09-25 00:00:00,added Marquis Daniels to MIL,-3146,-9988
2012-10-01 00:00:00,added Eddie Gill to MIL,0,-9988
2012-10-01 00:00:00,added Orien Greene to MIL,0,-9988
2012-10-01 00:00:00,added Alando Tucker to MIL,0,-9988
2013-02-21 00:00:00,lost Tobias Harris to ORL,-855,-10844
2013-02-21 00:00:00,lost Doron Lamb to ORL,4889,-5954
2013-02-21 00:00:00,lost Beno Udrih to ORL,959,-4994
2013-02-21 00:00:00,added Gustavo Ayón to MIL,-81,-5076
2013-02-21 00:00:00,added J.J. Redick to MIL,-1608,-6684
2013-02-21 00:00:00,added Ish Smith to MIL,-165,-6850
2013-06-27 00:00:00,added Giannis Antetokounmpo to MIL,0,-6850
2013-06-27 00:00:00,added Ricky Ledo to MIL,0,-6850
2013-06-27 00:00:00,lost Ricky Ledo to PHI,0,-6850
2013-06-27 00:00:00,lost Nemanja Dangubić to PHI,0,-6850
2013-06-27 00:00:00,added Nate Wolters to MIL,0,-6850
2013-07-10 00:00:00,lost J.J. Redick to LAC,-10302,-17152
2013-07-10 00:00:00,added Marcus Paige to MIL,0,-17152
2013-07-10 00:00:00,added Lamar Patterson to MIL,0,-17152
2013-07-11 00:00:00,lost Szymon Szewczyk to OKC,0,-17152
2013-07-11 00:00:00,added Luke Ridnour to MIL,-3357,-20509
2013-07-11 00:00:00,added Johnny O'Bryant to MIL,0,-20509
2013-07-12 00:00:00,lost Luc Mbah a Moute to SAC,-98,-20607
2013-07-12 00:00:00,lost Vanja Marinkovic to SAC,0,-20607
2013-07-12 00:00:00,added Malcolm Brogdon to MIL,0,-20607
2013-07-12 00:00:00,added Admiral Schofield to MIL,0,-20607
2013-07-13 00:00:00,added O.J. Mayo to MIL,-9954,-30562
2013-07-17 00:00:00,added Carlos Delfino to MIL,0,-30562
2013-07-17 00:00:00,added Zaza Pachulia to MIL,-1693,-32255
2013-07-26 00:00:00,added Miroslav Raduljica to MIL,-1674,-33929
2013-07-30 00:00:00,added Gary Neal to MIL,-2549,-36478
2013-07-30 00:00:00,added Giannis Antetokounmpo to MIL,1185,-35292
2013-07-31 00:00:00,lost Brandon Jennings to DET,-4143,-39436
2013-07-31 00:00:00,added Brandon Knight to MIL,3020,-36416
2013-07-31 00:00:00,added Viacheslav Kravtsov to MIL,0,-36416
2013-07-31 00:00:00,added Khris Middleton to MIL,-1853,-38269
2013-07-31 00:00:00,added Nate Wolters to MIL,-3009,-41278
2013-08-29 00:00:00,lost Viacheslav Kravtsov to PHO,407,-40871
2013-08-29 00:00:00,lost Ish Smith to PHO,1408,-39463
2013-08-29 00:00:00,added Caron Butler to MIL,-2380,-41844
2014-02-20 00:00:00,lost Gary Neal to CHA,811,-41033
2014-02-20 00:00:00,lost Luke Ridnour to CHA,1587,-39445
2014-02-20 00:00:00,added Jeff Adrien to MIL,-846,-40291
2014-02-20 00:00:00,added Ramon Sessions to MIL,-90,-40382
2014-03-04 00:00:00,added Tony Mitchell to MIL,106,-40276
2014-03-14 00:00:00,added Chris Wright to MIL,0,-40276
2014-03-26 00:00:00,added D.J. Stephens to MIL,25,-40251
2014-04-14 00:00:00,added Chris Wright to MIL,-25,-40276
2014-06-26 00:00:00,added Jabari Parker to MIL,0,-40276
2014-06-26 00:00:00,added Damien Inglis to MIL,0,-40276
2014-06-26 00:00:00,added Johnny O'Bryant to MIL,0,-40276
2014-06-26 00:00:00,added Lamar Patterson to MIL,0,-40276
2014-06-27 00:00:00,lost Lamar Patterson to ATL,2470,-37805
2014-06-27 00:00:00,added Pat Connaughton to MIL,2845,-34960
2014-06-30 00:00:00,lost Pat Connaughton to BRK,0,-34960
2014-06-30 00:00:00,lost Admiral Schofield to BRK,0,-34960
2014-06-30 00:00:00,added Jason Kidd to MIL,0,-34960
2014-07-08 00:00:00,added Jabari Parker to MIL,-4569,-39530
2014-07-30 00:00:00,added Johnny O'Bryant to MIL,-8552,-48082
2014-07-31 00:00:00,added Jerryd Bayless to MIL,-4809,-52892
2014-08-26 00:00:00,lost Carlos Delfino to LAC,0,-52892
2014-08-26 00:00:00,lost Miroslav Raduljica to LAC,0,-52892
2014-08-26 00:00:00,lost Marcus Paige to LAC,0,-52892
2014-08-26 00:00:00,added Jared Dudley to MIL,1030,-51862
2014-08-26 00:00:00,added OG Anunoby to MIL,0,-51862
2014-08-26 00:00:00,added Damien Inglis to MIL,-873,-52735
2014-09-27 00:00:00,added Elijah Millsap to MIL,0,-52735
2014-09-27 00:00:00,added Michael Eric to MIL,0,-52735
2015-01-09 00:00:00,added Kenyon Martin to MIL,0,-52735
2015-01-27 00:00:00,added Jorge Gutiérrez to MIL,0,-52735
2015-01-29 00:00:00,added Kenyon Martin to MIL,-228,-52964
2015-02-19 00:00:00,lost Brandon Knight to PHO,5320,-47644
2015-02-19 00:00:00,lost Kendall Marshall to PHO,0,-47644
2015-02-19 00:00:00,added Michael Carter-Williams to MIL,-699,-48343
2015-02-19 00:00:00,added Tyler Ennis to MIL,-4506,-52850
2015-02-19 00:00:00,added Miles Plumlee to MIL,-1286,-54136
2015-03-06 00:00:00,added Chris Johnson to MIL,-12,-54149
2015-04-07 00:00:00,added Jorge Gutiérrez to MIL,-445,-54594
2015-06-11 00:00:00,lost Ersan İlyasova to DET,-717,-55311
2015-06-11 00:00:00,added Caron Butler to MIL,0,-55311
2015-06-11 00:00:00,added Shawne Williams to MIL,0,-55311
2015-06-25 00:00:00,added Rashad Vaughn to MIL,0,-55311
2015-06-25 00:00:00,added Norman Powell to MIL,0,-55311
2015-06-25 00:00:00,lost Norman Powell to TOR,-104,-55415
2015-06-25 00:00:00,lost OG Anunoby to TOR,-1883,-57299
2015-06-25 00:00:00,added Greivis Vásquez to MIL,-2852,-60151
2015-07-09 00:00:00,added Khris Middleton to MIL,17972,-42179
2015-07-09 00:00:00,added Greg Monroe to MIL,7383,-34795
2015-07-09 00:00:00,lost Jared Dudley to WAS,209,-34585
2015-07-09 00:00:00,added Elijah Hughes to MIL,0,-34585
2015-07-09 00:00:00,lost Zaza Pachulia to DAL,400,-34185
2015-07-17 00:00:00,added Rashad Vaughn to MIL,-7579,-41764
2015-07-29 00:00:00,added Chris Copeland to MIL,-998,-42762
2015-08-17 00:00:00,added Marcus Landry to MIL,0,-42762
2015-09-14 00:00:00,added Jon Horford to MIL,0,-42762
2015-09-14 00:00:00,added Josh Powell to MIL,0,-42762
2015-09-14 00:00:00,added Charlie Westbrook to MIL,0,-42762
2016-02-21 00:00:00,added Steve Novak to MIL,-71,-42834
2016-03-16 00:00:00,added Jared Cunningham to MIL,-374,-43208
2016-06-23 00:00:00,added Thon Maker to MIL,0,-43208
2016-06-23 00:00:00,added Malcolm Brogdon to MIL,0,-43208
2016-06-23 00:00:00,added Patrick McCaw to MIL,0,-43208
2016-06-23 00:00:00,lost Patrick McCaw to GSW,6517,-36691
2016-07-07 00:00:00,lost Albert Miralles to CLE,0,-36691
2016-07-07 00:00:00,added Matthew Dellavedova to MIL,-11871,-48562
2016-07-08 00:00:00,added Mirza Teletović to MIL,-4241,-52804
2016-07-29 00:00:00,added Malcolm Brogdon to MIL,1514,-51290
2016-07-30 00:00:00,added Thon Maker to MIL,-5457,-56747
2016-08-02 00:00:00,added Miles Plumlee to MIL,-1674,-58421
2016-08-22 00:00:00,added Jason Terry to MIL,-2856,-61277
2016-08-29 00:00:00,added Steve Novak to MIL,-246,-61524
2016-09-06 00:00:00,added Orlando Johnson to MIL,0,-61524
2016-09-08 00:00:00,added J.J. O'Brien to MIL,0,-61524
2016-09-12 00:00:00,added Xavier Henry to MIL,0,-61524
2016-09-20 00:00:00,added Giannis Antetokounmpo to MIL,144430,82906
2016-09-22 00:00:00,lost Tyler Ennis to HOU,1568,84474
2016-09-22 00:00:00,added Michael Beasley to MIL,-748,83726
2016-09-22 00:00:00,added Jaleel Roberts to MIL,0,83726
2016-09-23 00:00:00,added Jabari Brown to MIL,0,83726
2016-10-17 00:00:00,lost Michael Carter-Williams to CHI,2707,86433
2016-10-17 00:00:00,added Tony Snell to MIL,-9605,76827
2017-02-02 00:00:00,lost Miles Plumlee to CHO,765,77592
2017-02-02 00:00:00,added Spencer Hawes to MIL,478,78071
2017-02-02 00:00:00,added Roy Hibbert to MIL,0,78071
2017-02-23 00:00:00,lost Roy Hibbert to DEN,5,78077
2017-02-23 00:00:00,added Jordan Bone to MIL,0,78077
2017-02-25 00:00:00,added Axel Toupane to MIL,-295,77781
2017-03-04 00:00:00,added Terrence Jones to MIL,-63,77717
2017-04-02 00:00:00,added Gary Payton II to MIL,-1205,76512
