date,Transaction,single_value_bpm,value_bpm,single_value_vorp,value_vorp,transaction_type,player_name
2012-06-28 00:00:00,added Andrew Nicholson to ORL,-12675.8,-12675,-1.3,-1.3,draft,Andrew Nicholson
2012-06-28 00:00:00,added Kyle O'Quinn to ORL,-1624.4,-14300,1.0,-0.3,draft,Kyle O'Quinn
2012-07-11 00:00:00,lost Ryan Anderson to NOH,-5006.0,-19306,-2.5,-2.8,trade,Ryan Anderson
2012-07-11 00:00:00,added Gustavo Ayón to ORL,-1142.0,-20448,0.0,-2.8,trade,Gustavo Ayón
2012-08-10 00:00:00,lost Jason Richardson to PHI,1008.8,-19439,-0.5,-3.3,multitrade,Jason Richardson
2012-08-10 00:00:00,lost Earl Clark to LAL,954.1,-18485,-0.4,-3.7,multitrade,Earl Clark
2012-08-10 00:00:00,lost Chris Duhon to LAL,2378.0,-16107,0.2,-3.5,multitrade,Chris Duhon
2012-08-10 00:00:00,lost Dwight Howard to LAL,-1700.2,-17807,-2.9,-6.4,multitrade,Dwight Howard
2012-08-10 00:00:00,added Arron Afflalo to ORL,-10883.5,-28691,1.1102230246251563e-16,-6.4,multitrade,Arron Afflalo
2012-08-10 00:00:00,added Al Harrington to ORL,-535.5,-29226,-0.1,-6.499999999999999,multitrade,Al Harrington
2012-08-10 00:00:00,added Romero Osby to ORL,0.0,-29226,0.0,-6.499999999999999,multitrade,Romero Osby
2012-08-10 00:00:00,added Dario Šarić to ORL,0.0,-29226,0.0,-6.499999999999999,multitrade,Dario Šarić
2012-08-10 00:00:00,added Christian Eyenga to ORL,0.0,-29226,0.0,-6.499999999999999,multitrade,Christian Eyenga
2012-08-10 00:00:00,added Josh McRoberts to ORL,-1301.5,-30528,0.0,-6.499999999999999,multitrade,Josh McRoberts
2012-08-10 00:00:00,added Wesley Iwundu to ORL,-10809.4,-41337,-1.2,-7.699999999999999,multitrade,Wesley Iwundu
2012-08-10 00:00:00,added Maurice Harkless to ORL,-5772.6,-47110,0.9000000000000001,-6.799999999999999,multitrade,Maurice Harkless
2012-08-10 00:00:00,added Nikola Vučević to ORL,46428.0,-682,21.2,14.4,multitrade,Nikola Vučević
2012-08-10 00:00:00,added Landry Shamet to ORL,0.0,-682,0.0,14.4,multitrade,Landry Shamet
2012-09-06 00:00:00,added E'Twaun Moore to ORL,-6278.2,-6960,0.1,14.5,signing,E'Twaun Moore
2012-09-29 00:00:00,added Armon Johnson to ORL,0.0,-6960,0.0,14.5,signing,Armon Johnson
2012-09-29 00:00:00,added DeQuan Jones to ORL,-3613.5,-10573,-0.5,14.0,signing,DeQuan Jones
2013-02-21 00:00:00,lost Josh McRoberts to CHA,-3998.2,-14571,-2.5,11.5,trade,Josh McRoberts
2013-02-21 00:00:00,added Hakim Warrick to ORL,0.0,-14571,0.0,11.5,trade,Hakim Warrick
2013-02-21 00:00:00,lost Gustavo Ayón to MIL,81.5,-14490,-0.1,11.4,trade,Gustavo Ayón
2013-02-21 00:00:00,lost J.J. Redick to MIL,1608.0,-12882,-0.0,11.4,trade,J.J. Redick
2013-02-21 00:00:00,lost Ish Smith to MIL,165.6,-12716,-0.0,11.4,trade,Ish Smith
2013-02-21 00:00:00,added Tobias Harris to ORL,-110.5,-12827,2.6,14.0,trade,Tobias Harris
2013-02-21 00:00:00,added Doron Lamb to ORL,-4889.9,-17717,-0.8,13.2,trade,Doron Lamb
2013-02-21 00:00:00,added Beno Udrih to ORL,-959.4,-18676,0.1,13.3,trade,Beno Udrih
2013-06-27 00:00:00,added Victor Oladipo to ORL,-466.7000000000003,-19143,3.7,17.0,draft,Victor Oladipo
2013-06-27 00:00:00,added Romero Osby to ORL,0.0,-19143,0.0,17.0,draft,Romero Osby
2013-07-18 00:00:00,added Jason Maxiell to ORL,-2049.6,-21192,-0.3,16.7,signing,Jason Maxiell
2013-07-25 00:00:00,added Ronnie Price to ORL,-1621.1,-22814,-0.2,16.5,signing,Ronnie Price
2014-02-25 00:00:00,added Adonis Thomas to ORL,-153.60000000000002,-22967,0.0,16.5,signing,Adonis Thomas
2014-02-25 00:00:00,added Dewayne Dedmon to ORL,0.0,-22967,0.0,16.5,signing,Dewayne Dedmon
2014-03-17 00:00:00,added Dewayne Dedmon to ORL,-4481.2,-27448,-0.2,16.3,signing,Dewayne Dedmon
2014-06-26 00:00:00,added Aaron Gordon to ORL,0.0,-27448,0.0,16.3,draft,Aaron Gordon
2014-06-26 00:00:00,added Dario Šarić to ORL,0.0,-27448,0.0,16.3,draft,Dario Šarić
2014-06-26 00:00:00,lost Dario Šarić to PHI,3754.9,-23693,-1.4,14.9,trade,Dario Šarić
2014-06-26 00:00:00,lost Willy Hernangómez to PHI,-0.0,-23693,-0.0,14.9,trade,Willy Hernangómez
2014-06-26 00:00:00,lost Landry Shamet to PHI,2105.2,-21588,-0.0,14.9,trade,Landry Shamet
2014-06-26 00:00:00,added Elfrid Payton to ORL,0.0,-21588,0.0,14.9,trade,Elfrid Payton
2014-06-27 00:00:00,lost Arron Afflalo to DEN,3325.0,-18263,-0.1,14.8,trade,Arron Afflalo
2014-06-27 00:00:00,added Evan Fournier to ORL,-3759.6,-22023,1.1999999999999993,16.0,trade,Evan Fournier
2014-06-27 00:00:00,added Devyn Marble to ORL,0.0,-22023,0.0,16.0,trade,Devyn Marble
2014-07-02 00:00:00,added Elfrid Payton to ORL,-2248.499999999999,-24271,3.6,19.6,signing,Elfrid Payton
2014-07-02 00:00:00,added Aaron Gordon to ORL,7.199999999999648,-24264,6.1,25.700000000000003,signing,Aaron Gordon
2014-07-11 00:00:00,added Ben Gordon to ORL,-3318.0,-27582,-0.4,25.300000000000004,signing,Ben Gordon
2014-07-14 00:00:00,added Channing Frye to ORL,-2277.2,-29859,0.7,26.000000000000004,signing,Channing Frye
2014-07-14 00:00:00,lost Milovan Raković to CHI,-0.0,-29859,-0.0,26.000000000000004,trade,Milovan Raković
2014-07-14 00:00:00,added Anthony Randolph to ORL,0.0,-29859,0.0,26.000000000000004,trade,Anthony Randolph
2014-07-24 00:00:00,added Devyn Marble to ORL,-2542.2,-32402,-0.4,25.600000000000005,signing,Devyn Marble
2014-09-29 00:00:00,added Kadeem Batts to ORL,0.0,-32402,0.0,25.600000000000005,signing,Kadeem Batts
2014-09-29 00:00:00,added Drew Crawford to ORL,0.0,-32402,0.0,25.600000000000005,signing,Drew Crawford
2014-09-29 00:00:00,added Seth Curry to ORL,0.0,-32402,0.0,25.600000000000005,signing,Seth Curry
2014-09-29 00:00:00,added Peyton Siva to ORL,0.0,-32402,0.0,25.600000000000005,signing,Peyton Siva
2015-06-25 00:00:00,added Mario Hezonja to ORL,0.0,-32402,0.0,25.600000000000005,draft,Mario Hezonja
2015-06-25 00:00:00,added Tyler Harvey to ORL,0.0,-32402,0.0,25.600000000000005,draft,Tyler Harvey
2015-06-25 00:00:00,lost Luke Ridnour to MEM,-0.0,-32402,-0.0,25.600000000000005,trade,Luke Ridnour
2015-06-25 00:00:00,added Jānis Timma to ORL,0.0,-32402,0.0,25.600000000000005,trade,Jānis Timma
2015-07-09 00:00:00,added C.J. Watson to ORL,-5611.200000000001,-38013,-0.6000000000000001,25.000000000000004,signing,C.J. Watson
2015-07-09 00:00:00,lost Kyle O'Quinn to NYK,-6940.4,-44953,-3.5,21.500000000000004,trade,Kyle O'Quinn
2015-07-09 00:00:00,lost Ignas Brazdeikis to NYK,505.7,-44447,0.1,21.600000000000005,trade,Ignas Brazdeikis
2015-07-09 00:00:00,added Carsen Edwards to ORL,0.0,-44447,0.0,21.600000000000005,trade,Carsen Edwards
2015-07-10 00:00:00,added Mario Hezonja to ORL,-10008.8,-54456,-0.5000000000000001,21.100000000000005,signing,Mario Hezonja
2015-07-14 00:00:00,added Tobias Harris to ORL,966.0,-53490,1.0,22.100000000000005,signing,Tobias Harris
2015-07-14 00:00:00,added Jason Smith to ORL,-2598.2000000000003,-56088,-0.1,22.000000000000004,signing,Jason Smith
2015-07-14 00:00:00,lost Maurice Harkless to POR,-697.7999999999996,-56786,-3.4000000000000004,18.6,trade,Maurice Harkless
2015-07-27 00:00:00,added Shabazz Napier to ORL,-1800.0,-58586,-0.2,18.4,trade,Shabazz Napier
2015-08-04 00:00:00,added Melvin Ejim to ORL,0.0,-58586,0.0,18.4,signing,Melvin Ejim
2015-09-24 00:00:00,added Keith Appling to ORL,0.0,-58586,0.0,18.4,signing,Keith Appling
2015-09-24 00:00:00,added Nnanna Egwu to ORL,0.0,-58586,0.0,18.4,signing,Nnanna Egwu
2015-09-24 00:00:00,added Jordan Sibert to ORL,0.0,-58586,0.0,18.4,signing,Jordan Sibert
2015-09-24 00:00:00,added Greg Stiemsma to ORL,0.0,-58586,0.0,18.4,signing,Greg Stiemsma
2016-01-12 00:00:00,added Joe Harris to ORL,0.0,-58586,0.0,18.4,trade,Joe Harris
2016-01-18 00:00:00,added Keith Appling to ORL,-407.7,-58994,-0.1,18.3,signing,Keith Appling
2016-02-16 00:00:00,lost Tobias Harris to DET,-9563.6,-68558,-6.1,12.2,trade,Tobias Harris
2016-02-16 00:00:00,added Ersan İlyasova to ORL,-1072.8,-69630,0.0,12.2,trade,Ersan İlyasova
2016-02-16 00:00:00,added Brandon Jennings to ORL,-361.6,-69992,0.1,12.3,trade,Brandon Jennings
2016-02-18 00:00:00,lost Channing Frye to CLE,-487.0,-70479,-1.6,10.7,multitrade,Channing Frye
2016-02-18 00:00:00,added Jared Cunningham to ORL,0.0,-70479,0.0,10.7,multitrade,Jared Cunningham
2016-02-18 00:00:00,added Vernon Carey Jr. to ORL,0.0,-70479,0.0,10.7,multitrade,Vernon Carey Jr.
2016-06-23 00:00:00,lost Ersan İlyasova to OKC,167.4,-70312,-0.0,10.7,trade,Ersan İlyasova
2016-06-23 00:00:00,lost Victor Oladipo to OKC,1111.0,-69201,-0.8,9.9,trade,Victor Oladipo
2016-06-23 00:00:00,lost Domantas Sabonis to OKC,7344.0,-61857,1.0,10.9,trade,Domantas Sabonis
2016-06-23 00:00:00,added Serge Ibaka to ORL,1197.0,-60660,1.2,12.1,trade,Serge Ibaka
2016-06-23 00:00:00,added Domantas Sabonis to ORL,0.0,-60660,0.0,12.1,draft,Domantas Sabonis
2016-06-23 00:00:00,added Stephen Zimmerman to ORL,0.0,-60660,0.0,12.1,draft,Stephen Zimmerman
2016-06-23 00:00:00,added Jake Layman to ORL,0.0,-60660,0.0,12.1,draft,Jake Layman
2016-06-23 00:00:00,lost Jake Layman to POR,2945.1000000000004,-57714,-0.0999999999999999,12.0,trade,Jake Layman
2016-06-23 00:00:00,added Jaylen Hands to ORL,0.0,-57714,0.0,12.0,trade,Jaylen Hands
2016-06-29 00:00:00,lost Jaylen Hands to DET,-0.0,-57714,-0.0,12.0,trade,Jaylen Hands
2016-06-29 00:00:00,added Jodie Meeks to ORL,-1328.4,-59043,0.1,12.1,trade,Jodie Meeks
2016-07-07 00:00:00,lost Shabazz Napier to POR,-869.7,-59913,-1.2,10.9,trade,Shabazz Napier
2016-07-07 00:00:00,added Jeff Green to ORL,-5522.400000000001,-65435,-0.6,10.3,signing,Jeff Green
2016-07-07 00:00:00,added Bismack Biyombo to ORL,-9325.6,-74761,-0.8,9.5,signing,Bismack Biyombo
2016-07-07 00:00:00,added Evan Fournier to ORL,-6719.700000000001,-81480,3.1000000000000005,12.6,signing,Evan Fournier
2016-07-07 00:00:00,added D.J. Augustin to ORL,-6103.5,-87584,2.0,14.6,signing,D.J. Augustin
2016-07-07 00:00:00,added Stephen Zimmerman to ORL,-896.4000000000001,-88480,-0.2,14.400000000000002,signing,Stephen Zimmerman
2016-07-15 00:00:00,lost Devyn Marble to LAC,-0.0,-88480,-0.0,14.400000000000002,trade,Devyn Marble
2016-07-15 00:00:00,lost Vernon Carey Jr. to LAC,-0.0,-88480,-0.0,14.400000000000002,trade,Vernon Carey Jr.
2016-07-15 00:00:00,added C.J. Wilcox to ORL,-874.8,-89355,-0.2,14.200000000000005,trade,C.J. Wilcox
2016-09-08 00:00:00,added Cliff Alexander to ORL,0.0,-89355,0.0,14.200000000000005,signing,Cliff Alexander
2016-09-08 00:00:00,added Branden Dawson to ORL,0.0,-89355,0.0,14.200000000000005,signing,Branden Dawson
2016-09-08 00:00:00,added Nick Johnson to ORL,0.0,-89355,0.0,14.200000000000005,signing,Nick Johnson
2016-09-08 00:00:00,added Kevin Murphy to ORL,0.0,-89355,0.0,14.200000000000005,signing,Kevin Murphy
2016-09-08 00:00:00,added Arinze Onuaku to ORL,-179.20000000000002,-89534,0.0,14.200000000000005,signing,Arinze Onuaku
2016-09-08 00:00:00,added Damjan Rudež to ORL,-1413.0,-90947,-0.2,14.000000000000004,signing,Damjan Rudež
2016-10-21 00:00:00,added Ramon Galloway to ORL,0.0,-90947,0.0,14.000000000000004,signing,Ramon Galloway
2017-01-22 00:00:00,added Anthony Brown to ORL,-51.2,-90998,0.0,14.000000000000004,signing,Anthony Brown
2017-02-14 00:00:00,lost Serge Ibaka to TOR,726.8,-90272,-3.1,10.900000000000004,trade,Serge Ibaka
2017-02-14 00:00:00,added Terrence Ross to ORL,-13907.7,-104179,1.1,12.000000000000004,trade,Terrence Ross
2017-02-14 00:00:00,added Anžejs Pasečņiks to ORL,0.0,-104179,0.0,12.000000000000004,trade,Anžejs Pasečņiks
2017-04-03 00:00:00,added Patricio Garino to ORL,-769.6999999999999,-104949,-0.2,11.800000000000004,signing,Patricio Garino
2017-04-03 00:00:00,added Marcus Georges-Hunt to ORL,-216.0,-105165,0.0,11.800000000000004,signing,Marcus Georges-Hunt
