date,Transaction,single_value,value
2017-06-22,added D.J. Wilson to MIL,0.0,0
2017-06-22,added Sindarius Thornwell to MIL,0.0,0
2017-06-23,lost Sindarius Thornwell to LAC,4245.5,4245
2017-07-06,added Sterling Brown to MIL,0.0,4245
2017-07-06,added D.J. Wilson to MIL,-4069.9,175
2017-07-06,added Bronson Koenig to MIL,0.0,175
2017-07-07,added JeQuan Lewis to MIL,0.0,175
2017-07-07,added Sterling Brown to MIL,-5490.6,-5315
2017-07-08,added Jalen Moore to MIL,0.0,-5315
2017-07-31,added Tony Snell to MIL,-5634.7,-10949
2017-09-06,added James Young to MIL,0.0,-10949
2017-09-18,added Jason Terry to MIL,-1628.0,-12577
2017-09-19,added Brandon Rush to MIL,0.0,-12577
2017-09-21,added Kendall Marshall to MIL,0.0,-12577
2017-09-24,added Gerald Green to MIL,0.0,-12577
2017-09-24,added Joel Anthony to MIL,0.0,-12577
2017-10-05,added Xavier Munford to MIL,0.0,-12577
2017-10-17,added Gary Payton II to MIL,-561.8,-13139
2017-10-20,added Joel Bolomboy to MIL,-190.0,-13329
2017-11-07,lost Greg Monroe to PHO,-976.5,-14306
2017-11-07,lost Desmond Bane to PHO,-0.0,-14306
2017-11-07,added Eric Bledsoe to MIL,6269.200000000001,-8036
2017-12-18,added Sean Kilpatrick to MIL,-533.0,-8569
2018-01-07,added Xavier Munford to MIL,-237.3,-8807
2018-01-15,added Marshall Plumlee to MIL,-234.0,-9041
2018-02-05,lost Rashad Vaughn to BRK,21.2,-9019
2018-02-05,lost Hamidou Diallo to BRK,-0.0,-9019
2018-02-05,added Tyler Zeller to MIL,-852.6,-9872
2018-03-04,added Shabazz Muhammad to MIL,702.0,-9170
2018-03-11,added Brandon Jennings to MIL,0.0,-9170
2018-04-01,added Brandon Jennings to MIL,-697.0,-9867
2018-06-21,added Donte DiVincenzo to MIL,0.0,-9867
2018-07-10,added Donte DiVincenzo to MIL,-440.9000000000001,-10308
2018-07-16,added Ersan İlyasova to MIL,-2436.9,-12745
2018-07-17,added Brook Lopez to MIL,5108.400000000005,-7636
2018-07-23,added Travis Trice to MIL,0.0,-7636
2018-07-24,added Trevon Duval to MIL,146.39999999999998,-7490
2018-07-26,added Jaylen Morris to MIL,-11.6,-7502
2018-07-31,added Brandon McCoy to MIL,0.0,-7502
2018-08-01,added Pat Connaughton to MIL,2259.0,-5243
2018-08-07,added Jordan Barnett to MIL,0.0,-5243
2018-09-17,added Robert Johnson to MIL,0.0,-5243
2018-09-17,added James Young to MIL,0.0,-5243
2018-09-19,added Ike Nwamu to MIL,0.0,-5243
2018-09-21,added Christian Wood to MIL,-80.60000000000001,-5323
2018-09-21,added Tim Frazier to MIL,0.0,-5323
2018-09-21,added Shabazz Muhammad to MIL,0.0,-5323
2018-10-15,added Jodie Meeks to MIL,0.0,-5323
2018-12-07,lost Matthew Dellavedova to CLE,8920.3,3596
2018-12-07,lost John Henson to CLE,-453.2000000000001,3143
2018-12-07,lost Sandro Mamukelashvili to CLE,-0.0,3143
2018-12-07,lost MarJon Beauchamp to CLE,-0.0,3143
2018-12-07,added George Hill to MIL,-1149.6,1993
2018-12-07,added Greg Brown III to MIL,0.0,1993
2018-12-07,added Jason Smith to MIL,-276.0,1717
2019-01-15,added Bonzie Colson to MIL,-343.0,1374
2019-02-07,lost Jason Smith to NOP,176.0,1550
2019-02-07,lost Jordan Bone to NOP,-0.0,1550
2019-02-07,lost Elijah Hughes to NOP,-0.0,1550
2019-02-07,lost Sam Merrill to NOP,-0.0,1550
2019-02-07,lost Greg Brown III to NOP,-0.0,1550
2019-02-07,lost Thon Maker to DET,2268.7,3819
2019-02-07,added Nikola Mirotić to MIL,640.0,4459
2019-02-25,added Isaiah Canaan to MIL,-124.0,4335
2019-03-03,added Pau Gasol to MIL,-141.0,4194
2019-03-04,added Eric Bledsoe to MIL,10006.0,14200
2019-03-19,added Tim Frazier to MIL,-759.6,13440
2019-06-20,added Kevin Porter Jr. to MIL,44.5,13485
2019-06-20,lost Kevin Porter Jr. to DET,-0.0,13485
2019-06-20,lost Tony Snell to DET,2953.8,16439
2019-06-20,added Jon Leuer to MIL,0.0,16439
2019-07-06,added Malcolm Brogdon to MIL,0.0,16439
2019-07-06,lost Malcolm Brogdon to IND,-9825.6,6613
2019-07-06,added R.J. Hampton to MIL,0.0,6613
2019-07-06,added Max Christie to MIL,0.0,6613
2019-07-06,added Brook Lopez to MIL,8229.9,14843
2019-07-08,added George Hill to MIL,545.5,15389
2019-07-11,added Khris Middleton to MIL,14613.4,30002
2019-07-12,added Robin Lopez to MIL,-2490.8,27511
2019-07-12,added Wesley Matthews to MIL,-2943.0,24568
2019-07-16,added Thanasis Antetokounmpo to MIL,-2341.2999999999997,22227
2019-07-25,added Kyle Korver to MIL,96.0,22323
2019-07-26,added Dragan Bender to MIL,-109.2,22214
2019-07-26,added Cameron Reynolds to MIL,0.0,22214
2019-07-26,added Frank Mason III to MIL,0.0,22214
2019-08-20,added Jaylen Adams to MIL,0.0,22214
2020-02-10,added Marvin Williams to MIL,288.90000000000003,22503
2020-11-18,added R.J. Hampton to MIL,0.0,22503
2020-11-18,added Jordan Nwora to MIL,0.0,22503
2020-11-18,added Ilkan Karaman to MIL,0.0,22503
2020-11-18,lost Max Christie to ORL,-0.0,22503
2020-11-18,added Jordan Nwora to MIL,0.0,22503
2020-11-23,added Pat Connaughton to MIL,-3405.4000000000005,19097
2020-11-23,added Jordan Nwora to MIL,-5159.9,13937
2020-11-23,added Mamadi Diakite to MIL,-338.4,13599
2020-11-23,lost George Hill to OKC,-369.0,13230
2020-11-23,lost Eric Bledsoe to NOP,4222.0,17452
2020-11-23,lost Yves Missi to NOP,5828.0,23280
2020-11-23,lost R.J. Hampton to DEN,1234.9,24515
2020-11-23,added Jrue Holiday to MIL,20316.7,44831
2020-11-23,added Sam Merrill to MIL,0.0,44831
2020-11-24,added Bryn Forbes to MIL,-1760.2,43071
2020-11-24,added Bobby Portis to MIL,2058.0,45129
2020-11-24,added Jaylen Adams to MIL,-356.40000000000003,44773
2020-11-25,added Torrey Craig to MIL,-120.6,44652
2020-11-25,added D.J. Augustin to MIL,-1568.6,43084
2020-11-30,added Sam Merrill to MIL,-233.0,42851
2020-11-30,added Nik Stauskas to MIL,0.0,42851
2021-03-14,added Axel Toupane to MIL,-183.0,42668
2021-03-18,lost Torrey Craig to PHO,1305.4,43973
2021-03-19,lost D.J. Augustin to HOU,3025.0,46998
2021-03-19,lost D.J. Wilson to HOU,885.6,47884
2021-03-19,lost Josh Christopher to HOU,8048.799999999999,55932
2021-03-19,lost Kobe Brown to HOU,-0.0,55932
2021-03-19,added Rodions Kurucs to MIL,74.80000000000001,56007
2021-03-19,added P.J. Tucker to MIL,-1151.3,54856
2021-03-19,added Isaiah Todd to MIL,0.0,54856
2021-03-19,added MarJon Beauchamp to MIL,0.0,54856
2021-04-01,added Jeff Teague to MIL,-467.6,54388
2021-04-21,added Justin Jackson to MIL,-264.0,54124
2021-05-13,added Elijah Bryant to MIL,0.0,54124
2021-07-29,added Isaiah Todd to MIL,0.0,54124
2021-07-30,lost Isaiah Todd to IND,-0.0,54124
2021-07-30,added Georgios Kalaitzakis to MIL,0.0,54124
2021-07-30,added Sandro Mamukelashvili to MIL,0.0,54124
2021-07-30,added Cam Christie to MIL,0.0,54124
2021-08-03,added Sandro Mamukelashvili to MIL,-903.3,53221
2021-08-06,added Semi Ojeleye to MIL,-2032.8,51188
2021-08-06,added Rodney Hood to MIL,-2033.5,49155
2021-08-06,added George Hill to MIL,-3140.4,46014
2021-08-06,added Bobby Portis to MIL,405.5999999999999,46420
2021-08-07,lost Sam Merrill to MEM,324.79999999999995,46745
2021-08-07,added Grayson Allen to MIL,919.2,47664
2021-08-07,lost Cam Christie to MEM,-0.0,47664
2021-08-10,added Georgios Kalaitzakis to MIL,-379.2000000000001,47285
2021-08-12,added Thanasis Antetokounmpo to MIL,-3221.1000000000004,44064
2021-09-07,added Tremont Waters to MIL,0.0,44064
2021-09-14,added Justin Robinson to MIL,-1306.8,42757
2021-09-23,added Javin DeLaurier to MIL,0.0,42757
2021-09-28,added Johnny O'Bryant to MIL,0.0,42757
2021-09-29,added Elijah Bryant to MIL,0.0,42757
2021-10-11,added Jemerrio Jones to MIL,0.0,42757
2021-10-12,added Rayjon Tucker to MIL,0.0,42757
2021-10-13,added Jalen Lecque to MIL,0.0,42757
2021-10-16,added Wenyen Gabriel to MIL,0.0,42757
2021-11-29,added Javonte Smart to MIL,-1296.0,41461
2021-11-30,added DeMarcus Cousins to MIL,172.2,41633
2021-12-03,added Wesley Matthews to MIL,-3306.6000000000004,38326
2021-12-23,added Javin DeLaurier to MIL,21.0,38347
2022-01-03,added Luke Kornet to MIL,-74.1,38273
2022-01-07,added Jeff Dowtin to MIL,-67.80000000000001,38206
2022-01-07,added Langston Galloway to MIL,-445.9,37760
2022-01-13,added Lindell Wigginton to MIL,-995.0000000000002,36765
2022-02-05,added Greg Monroe to MIL,-315.0,36450
2022-02-10,lost Donte DiVincenzo to SAC,399.0,36849
2022-02-10,lost Rodney Hood to LAC,307.2,37156
2022-02-10,lost Semi Ojeleye to LAC,303.8,37460
2022-02-10,added Isaiah Wong to MIL,0.0,37460
2022-02-10,added Serge Ibaka to MIL,-813.5999999999999,36646
2022-02-10,added Tyler Smith to MIL,0.0,36646
2022-02-16,added DeAndre' Bembry to MIL,-300.3,36346
2022-02-24,added Jevon Carter to MIL,423.5999999999999,36769
2022-04-06,added Luca Vildoza to MIL,0.0,36769
2022-04-08,added Rayjon Tucker to MIL,193.2,36962
2022-06-23,added MarJon Beauchamp to MIL,0.0,36962
2022-06-24,added Hugo Besson to MIL,0.0,36962
2022-07-01,added AJ Green to MIL,-310.5,36652
2022-07-06,added Joe Ingles to MIL,-730.8,35921
2022-07-06,added Jevon Carter to MIL,-1086.0,34835
2022-07-06,added Bobby Portis to MIL,-217.80000000000015,34617
2022-07-06,added Wesley Matthews to MIL,-2214.0,32403
2022-07-07,added MarJon Beauchamp to MIL,-6115.599999999999,26288
2022-07-19,added Serge Ibaka to MIL,-832.5,25455
2022-09-16,added Rob Edwards to MIL,0.0,25455
2022-09-16,added Alex AntetoKounmpo to MIL,0.0,25455
2022-09-17,added Iverson Molinar to MIL,0.0,25455
2022-09-18,added Ibou Badji to MIL,0.0,25455
2022-09-20,added Marques Bolden to MIL,0.0,25455
2022-09-26,added Jordan Nwora to MIL,-1432.8,24022
2022-10-14,added Jontay Porter to MIL,0.0,24022
2022-10-15,added Elijah Hughes to MIL,0.0,24022
2023-02-09,lost George Hill to IND,99.6,24122
2023-02-09,lost Serge Ibaka to IND,-0.0,24122
2023-02-09,lost Jordan Nwora to IND,1795.8,25918
2023-02-09,lost Isaiah Wong to IND,76.0,25994
2023-02-09,lost Quinten Post to IND,-0.0,25994
2023-02-09,added Jae Crowder to MIL,408.0,26402
2023-02-22,added Meyers Leonard to MIL,0.0,26402
2023-03-04,added Goran Dragic to MIL,-431.6,25970
2023-03-07,added Lindell Wigginton to MIL,-774.0999999999999,25196
2023-03-14,added Meyers Leonard to MIL,-570.0,24626
2023-06-22,added Chris Livingston to MIL,0.0,24626
2023-06-22,added Andre Jackson to MIL,0.0,24626
2023-07-05,added Omari Moore to MIL,0.0,24626
2023-07-06,added Robin Lopez to MIL,-396.5,24230
2023-07-06,added Malik Beasley to MIL,-4206.6,20023
2023-07-06,added Brook Lopez to MIL,4576.4,24599
2023-07-06,added Khris Middleton to MIL,2810.5,27410
2023-07-07,added Andre Jackson Jr. to MIL,-5025.6,22384
2023-07-07,added A.J. Green to MIL,-4877.4,17507
2023-07-08,added Chris Livingston to MIL,-1295.1,16212
2023-07-08,added Jae Crowder to MIL,-3005.6,13206
2023-07-28,added Thanasis Antetokounmpo to MIL,-992.0,12214
2023-08-29,added TyTy Washington Jr. to MIL,-459.19999999999993,11755
2023-09-27,lost Jrue Holiday to POR,-0.0,11755
2023-09-27,lost Grayson Allen to PHO,-3126.2000000000003,8629
2023-09-27,added Damian Lillard to MIL,13578.6,22207
2023-10-01,added Cameron Payne to MIL,-1053.0,21154
2023-10-21,added Marques Bolden to MIL,-16.5,21138
2024-02-08,lost Cameron Payne to PHI,421.4,21559
2024-02-08,added Patrick Beverley to MIL,-217.2,21342
2024-02-08,lost Robin Lopez to SAC,-0.0,21342
2024-02-08,added Dimitrios Agravanis to MIL,0.0,21342
2024-02-18,added Danilo Gallinari to MIL,-806.0,20536
2024-02-20,added Ryan Rollins to MIL,-392.2,20144
2024-03-02,added Jaylin Galloway to MIL,0.0,20144
2024-06-26,added AJ Johnson to MIL,0.0,20144
2024-06-26,added Tyler Smith to MIL,0.0,20144
2024-06-26,added AJ Johnson to MIL,0.0,20144
2024-06-26,added Tyler Smith to MIL,0.0,20144
2024-07-05,added Tyler Smith to MIL,-193.2,19951
2024-07-05,added A.J. Johnson to MIL,-224.4,19726
2024-07-06,added Delon Wright to MIL,-1053.0,18673
2024-07-09,added Taurean Prince to MIL,-3445.9,15227
2024-07-09,added Stanley Umude to MIL,-624.0,14603
2024-07-20,added Gary Trent Jr. to MIL,-2635.5,11968
2024-08-10,added Anžejs Pasečņiks to MIL,0.0,11968
2024-10-19,added Liam Robbins to MIL,-604.1999999999999,11364
2025-02-06,lost MarJon Beauchamp to LAC,-66.3,11297
2025-02-06,added Kevin Porter Jr. to MIL,44.5,11342
2025-02-06,lost A.J. Johnson to WAS,2758.8,14101
2025-02-06,lost Khris Middleton to WAS,618.0,14719
2025-02-06,lost Hugo Besson to NYK,-0.0,14719
2025-02-06,lost Delon Wright to NYK,-233.8,14485
2025-02-06,added Jericho Sims to MIL,-441.0,14044
2025-02-06,added Kyle Kuzma to MIL,-4625.7,9418
2025-02-27,added Pete Nance to MIL,-172.9,9245
2025-03-04,added Jamaree Bouyea to MIL,-22.4,9223
