,date,Transaction,value,Running Score
1,2018-10-16,added Jamal Crawford to PHO,-4722,-4722
2,2018-12-07,added Jawun Evans to PHO,-588,-5311
3,2018-12-10,added Eric Moreland to PHO,-30,-5342
4,2018-12-17,lost Trevor Ariza to WAS,2051,-3291
5,2018-12-17,added Kelly Oubre Jr. to PHO,-472,-3763
6,2018-12-17,added Austin Rivers to PHO,0,-3763
7,2019-01-07,added Quincy Acy to PHO,-996,-4759
8,2019-01-27,added Emanuel Terry to PHO,46,-4713
9,2019-02-06,lost Ryan Anderson to MIA,286,-4427
10,2019-02-06,added Wayne Ellington to PHO,0,-4427
11,2019-02-06,added Tyler Johnson to PHO,-2260,-6687
12,2019-02-21,added Ray Spalding to PHO,0,-6687
13,2019-03-03,added Ray Spalding to PHO,-749,-7437
14,2019-03-22,added Jimmer Fredette to PHO,-734,-8171
15,2019-06-20,added Jarrett Culver to PHO,0,-8171
16,2019-06-20,added KZ Okpala to PHO,0,-8171
17,2019-07-06,lost KZ Okpala to MIA,3794,-4377
18,2019-07-06,lost T.J. Warren to IND,-1778,-6155
19,2019-07-06,lost Jarrett Culver to MIN,8818,2662
20,2019-07-06,added Cameron Johnson to PHO,0,2662
21,2019-07-06,added Dario Šarić to PHO,-652,2009
22,2019-07-06,lost Desmond Bane to BOS,0,2009
23,2019-07-06,added Aron Baynes to PHO,-934,1075
24,2019-07-06,added Ty Jerome to PHO,0,1075
25,2019-07-06,added Cameron Johnson to PHO,6390,7465
26,2019-07-06,added Ty Jerome to PHO,-1213,6252
27,2019-07-06,added Jalen Lecque to PHO,-304,5948
28,2019-07-07,lost Josh Jackson to MEM,-38,5910
29,2019-07-07,lost De'Anthony Melton to MEM,-5318,591
30,2019-07-07,lost Robert Woodard to MEM,0,591
31,2019-07-07,added Jevon Carter to PHO,567,1158
32,2019-07-07,added Kyle Korver to PHO,0,1158
33,2019-07-08,added Ricky Rubio to PHO,2016,3174
34,2019-07-16,added Kelly Oubre Jr. to PHO,-966,2208
35,2019-07-17,added Frank Kaminsky to PHO,541,2749
36,2019-07-18,added Jared Harper to PHO,-125,2623
37,2019-07-22,added Cheick Diallo to PHO,-622,2001
38,2019-09-25,added Norense Odiase to PHO,0,2001
39,2019-10-20,added Aaron Epps to PHO,0,2001
40,2019-10-20,added Troy Williams to PHO,0,2001
41,2020-01-15,added Tariq Owens to PHO,-87,1914
42,2020-02-12,added Jonah Bolden to PHO,-227,1686
43,2020-06-30,added Cameron Payne to PHO,3344,5031
44,2020-11-16,lost Ty Jerome to OKC,2393,7425
45,2020-11-16,lost Jalen Lecque to OKC,0,7425
46,2020-11-16,lost Kelly Oubre Jr. to OKC,0,7425
47,2020-11-16,lost Ricky Rubio to OKC,0,7425
48,2020-11-16,lost Peyton Watson to OKC,0,7425
49,2020-11-16,added Abdel Nader to PHO,0,7425
50,2020-11-16,added Chris Paul to PHO,10115,17540
51,2020-11-18,added Jalen Smith to PHO,0,17540
52,2020-11-23,added Jevon Carter to PHO,358,17899
53,2020-11-23,added Ty-Shon Alexander to PHO,-305,17593
54,2020-11-24,added Jalen Smith to PHO,-1830,15763
55,2020-11-28,added Jae Crowder to PHO,3887,19650
56,2020-11-28,added Langston Galloway to PHO,-394,19256
57,2020-11-28,added Damian Jones to PHO,-554,18702
58,2020-11-28,added E'Twaun Moore to PHO,-1128,17573
59,2020-11-28,added Dario Saric to PHO,-2808,14765
60,2021-03-18,added Torrey Craig to PHO,481,15247
61,2021-07-29,added Day'Ron Sharpe to PHO,0,15247
62,2021-08-06,lost Jevon Carter to BRK,2428,17676
63,2021-08-06,lost Day'Ron Sharpe to BRK,2364,20040
64,2021-08-06,added Landry Shamet to PHO,-2854,17186
65,2021-08-06,added Chris Paul to PHO,17595,34781
66,2021-08-06,added Cameron Payne to PHO,-1161,33620
67,2021-08-06,added Abdel Nader to PHO,-710,32909
68,2021-08-09,added Frank Kaminsky to PHO,886,33796
69,2021-08-10,added Elfrid Payton to PHO,-1921,31875
70,2021-08-16,added JaVale McGee to PHO,937,32812
71,2021-09-07,added Chandler Hutchison to PHO,-187,32625
72,2021-09-22,added Chasson Randle to PHO,0,32625
73,2021-10-21,added Ishmail Wainright to PHO,-718,31907
74,2021-12-27,added Emanuel Terry to PHO,-329,31578
75,2021-12-30,added M.J. Walker to PHO,-76,31501
76,2021-12-31,added Paris Bass to PHO,-86,31414
77,2022-01-01,added Bismack Biyombo to PHO,0,31414
78,2022-01-04,added Justin Jackson to PHO,-119,31295
79,2022-01-11,added Bismack Biyombo to PHO,-657,30638
80,2022-02-10,lost Jalen Smith to IND,2251,32889
81,2022-02-10,lost Hugo Besson to IND,0,32889
82,2022-02-10,added Torrey Craig to PHO,-1787,31102
83,2022-02-10,added Aaron Holiday to PHO,-286,30816
84,2022-03-11,added Gabriel Lundberg to PHO,-211,30604
85,2022-07-01,added Damion Lee to PHO,-2560,28044
86,2022-07-02,added Josh Okogie to PHO,-270,27774
87,2022-07-03,added Bismack Biyombo to PHO,-786,26988
88,2022-07-06,added Jock Landale to PHO,-1076,25911
89,2022-07-15,added Deandre Ayton to PHO,1831,27742
90,2022-08-03,added Duane Washington Jr. to PHO,-1812,25930
91,2022-08-04,added Ishmail Wainright to PHO,-1098,24832
92,2022-09-20,added Frank Jackson to PHO,0,24832
93,2022-09-24,added Timothé Luwawu-Cabarrot to PHO,0,24832
94,2022-10-11,added Adonis Arms to PHO,0,24832
95,2022-10-12,added Saben Lee to PHO,0,24832
96,2023-01-11,added Saben Lee to PHO,0,24832
97,2023-02-01,added Saben Lee to PHO,-653,24178
98,2023-02-09,lost Dario Saric to OKC,54,24233
99,2023-02-09,added Darius Bazley to PHO,-24,24209
100,2023-02-09,lost future 2nd round pick to OKC,0,24209
101,2023-02-09,lost Jae Crowder to MIL,-408,23801
102,2023-02-09,lost Mikal Bridges to BRK,-3045,20755
103,2023-02-09,lost Cameron Johnson to BRK,-1540,19215
104,2023-02-09,lost Noah Clowney to BRK,0,19215
105,2023-02-09,lost future 1st round pick to BRK,0,19215
106,2023-02-09,lost future 1st round pick to BRK,0,19215
107,2023-02-09,lost future 1st round pick to BRK,0,19215
108,2023-02-09,lost future 1st round pick to BRK,0,19215
109,2023-02-09,added Kevin Durant to PHO,2152,21367
110,2023-02-09,added T.J. Warren to PHO,-374,20992
111,2023-02-14,added Terrence Ross to PHO,193,21185
112,2023-06-22,added Toumani Camara to PHO,0,21185
113,2023-06-23,lost Chris Paul to WAS,0,21185
114,2023-06-23,lost Landry Shamet to WAS,0,21185
115,2023-06-23,lost future 1st round pick to WAS,0,21185
116,2023-06-23,lost future 2nd round pick to WAS,0,21185
117,2023-06-23,lost future 2nd round pick to WAS,0,21185
118,2023-06-23,lost future 1st round pick to WAS,0,21185
119,2023-06-23,lost future 2nd round pick to WAS,0,21185
120,2023-06-23,lost future 2nd round pick to WAS,0,21185
121,2023-06-23,lost future 1st round pick to WAS,0,21185
122,2023-06-23,lost future 1st round pick to WAS,0,21185
123,2023-06-23,lost future 2nd round pick to WAS,0,21185
124,2023-06-23,lost future 2nd round pick to IND,0,21185
125,2023-06-23,added Bradley Beal to PHO,0,21185
126,2023-06-23,added Jordan Goodwin to PHO,0,21185
127,2023-06-23,added Isaiah Todd to PHO,0,21185
128,2023-07-02,added Chimezie Metu to PHO,0,21185
129,2023-07-02,added Yuta Watanabe to PHO,0,21185
130,2023-07-02,added Keita Bates-Diop to PHO,0,21185
131,2023-07-02,added Drew Eubanks to PHO,0,21185
132,2023-07-03,added Toumani Camara to PHO,0,21185
133,2023-07-06,added Eric Gordon to PHO,0,21185
134,2023-07-07,added Damion Lee to PHO,0,21185
135,2023-07-11,lost Isaiah Todd to MEM,0,21185
136,2023-07-11,added future 2nd round pick to PHO,0,21185
137,2023-07-11,added future 2nd round pick to PHO,0,21185
138,2023-07-11,lost future 1st round pick to MEM,0,21185
139,2023-07-11,lost future 1st round pick to MEM,0,21185
140,2023-07-11,added Josh Okogie to PHO,0,21185
141,2023-07-13,added Saben Lee to PHO,0,21185
142,2023-07-17,lost Cameron Payne to SAS,0,21185
143,2023-07-17,added future 2nd round pick to PHO,0,21185
144,2023-07-17,lost future 2nd round pick to SAS,0,21185
145,2023-07-18,added Bol Bol to PHO,0,21185
146,2023-08-08,added Udoka Azubuike to PHO,0,21185
147,2023-09-27,lost Deandre Ayton to POR,0,21185
148,2023-09-27,lost Toumani Camara to POR,0,21185
149,2023-09-27,added Grayson Allen to PHO,0,21185
150,2023-09-27,added Keon Johnson to PHO,0,21185
151,2023-09-27,added Nassir Little to PHO,0,21185
152,2023-09-27,added Jusuf Nurkic to PHO,0,21185
