date,Transaction,single_value,value
2009-06-24,lost Randy Foye to WAS,2000.4,2000
2009-06-24,lost Mike Miller to WAS,-2346.5,-346
2009-06-24,added Oleksiy Pecherov to MIN,-1877.4,-2223
2009-06-24,added Darius Songaila to MIN,0.0,-2223
2009-06-24,added Etan Thomas to MIN,0.0,-2223
2009-06-24,added Ricky Rubio to MIN,0.0,-2223
2009-06-25,added Ricky Rubio to MIN,9397.200000000004,7173
2009-06-25,added Jonny Flynn to MIN,-12976.0,-5802
2009-06-25,added Ty Lawson to MIN,0.0,-5802
2009-06-25,added Wayne Ellington to MIN,-11701.9,-17504
2009-06-25,added Nick Calathes to MIN,0.0,-17504
2009-06-25,added Henk Norel to MIN,0.0,-17504
2009-06-25,lost Ty Lawson to DEN,-28662.5,-46166
2009-06-25,added Luke Babbitt to MIN,0.0,-46166
2009-06-25,lost Nick Calathes to DAL,-0.0,-46166
2009-06-25,added Magnum Rolle to MIN,0.0,-46166
2009-07-20,lost Mark Madsen to LAC,-0.0,-46166
2009-07-20,lost Craig Smith to LAC,1630.2,-44536
2009-07-20,lost Sebastian Telfair to LAC,2502.6,-42033
2009-07-20,added Quentin Richardson to MIN,0.0,-42033
2009-07-27,lost Etan Thomas to OKC,1605.0,-40428
2009-07-27,lost Dexter Pittman to OKC,-0.0,-40428
2009-07-27,lost Magnum Rolle to OKC,-0.0,-40428
2009-07-27,added Chucky Atkins to MIN,0.0,-40428
2009-07-27,added Damien Wilkins to MIN,-2060.5,-42489
2009-08-11,added Ryan Hollins to MIN,-5625.799999999999,-48115
2009-08-13,lost Quentin Richardson to MIA,-2706.6,-50821
2009-08-13,added Mark Blount to MIN,0.0,-50821
2009-09-09,lost Bobby Brown to NOH,1574.4,-49247
2009-09-09,lost Darius Songaila to NOH,5217.0,-44030
2009-09-09,added Antonio Daniels to MIN,0.0,-44030
2009-09-14,added Ramon Sessions to MIN,-5196.0,-49226
2009-09-17,added Sasha Pavlović to MIN,-5437.400000000001,-54663
2009-09-28,added Jason Hart to MIN,19.0,-54644
2009-09-28,added Alonzo Gee to MIN,0.0,-54644
2009-09-28,added Devin Green to MIN,0.0,-54644
2009-10-20,added Nathan Jawai to MIN,-1565.6,-56210
2009-12-29,lost Jason Hart to PHO,-0.0,-56210
2009-12-29,added Alando Tucker to MIN,-237.5,-56447
2009-12-29,added Hamady N'Diaye to MIN,0.0,-56447
2010-02-17,lost Brian Cardinal to NYK,-0.0,-56447
2010-02-17,added Darko Miličić to MIN,-7248.000000000001,-63695
2010-03-23,added Brian Cardinal to MIN,-1174.8000000000002,-64870
2010-04-13,added Greg Stiemsma to MIN,0.0,-64870
2010-06-24,added Wesley Johnson to MIN,-6602.2,-71472
2010-06-24,added Luke Babbitt to MIN,0.0,-71472
2010-06-24,added Trevor Booker to MIN,0.0,-71472
2010-06-24,added Paulão Prestes to MIN,0.0,-71472
2010-06-24,added Hamady N'Diaye to MIN,0.0,-71472
2010-06-24,lost Luke Babbitt to POR,4466.7,-67006
2010-06-24,lost Ryan Gomes to POR,-0.0,-67006
2010-06-24,added Martell Webster to MIN,-3246.2,-70252
2010-06-24,lost Trevor Booker to WAS,3007.8,-67244
2010-06-24,lost Hamady N'Diaye to WAS,567.3,-66677
2010-06-24,added Nemanja Bjelica to MIN,-2519.4,-69196
2010-06-24,added Lazar Hayward to MIN,-1274.0,-70470
2010-07-12,lost Bojan Bogdanović to MIA,-0.0,-70470
2010-07-12,lost Markel Brown to MIA,-0.0,-70470
2010-07-12,added Michael Beasley to MIN,-6532.5,-77003
2010-07-13,lost Al Jefferson to UTA,-15628.7,-92631
2010-07-13,added Kosta Koufos to MIN,-1982.4,-94614
2010-07-13,added Donatas Motiejūnas to MIN,0.0,-94614
2010-07-13,added Terrence Jones to MIN,0.0,-94614
2010-07-21,added Luke Ridnour to MIN,-2854.2,-97468
2010-07-26,lost Ryan Hollins to CLE,7652.799999999999,-89815
2010-07-26,lost Ramon Sessions to CLE,-36.29999999999996,-89851
2010-07-26,lost Jeff Withey to CLE,-0.0,-89851
2010-07-26,added Sebastian Telfair to MIN,-2488.5,-92340
2010-07-26,added Delonte West to MIN,0.0,-92340
2010-08-09,added Anthony Tolliver to MIN,-4882.8,-97223
2010-09-24,added Maurice Ager to MIN,-20.3,-97243
2010-09-24,added Jason Hart to MIN,0.0,-97243
2010-11-12,added Sundiata Gaines to MIN,-539.5,-97783
2011-02-22,lost Corey Brewer to NYK,-0.0,-97783
2011-02-22,lost Kosta Koufos to DEN,-1401.2000000000005,-99184
2011-02-22,added Richaun Holmes to MIN,0.0,-99184
2011-02-22,added Eddy Curry to MIN,0.0,-99184
2011-02-22,added Anthony Randolph to MIN,-876.6,-100060
2011-06-23,added Derrick Williams to MIN,-6532.2,-106593
2011-06-23,added Donatas Motiejūnas to MIN,0.0,-106593
2011-06-23,lost Jonny Flynn to HOU,796.5,-105796
2011-06-23,lost Donatas Motiejūnas to HOU,8980.6,-96815
2011-06-23,lost Will Barton to HOU,-0.0,-96815
2011-06-23,added Brad Miller to MIN,-146.0,-96961
2011-06-23,added Nikola Mirotić to MIN,0.0,-96961
2011-06-23,added Chandler Parsons to MIN,0.0,-96961
2011-06-23,added Andre Roberson to MIN,0.0,-96961
2011-06-23,lost Nikola Mirotić to CHI,-10309.7,-107271
2011-06-23,added Norris Cole to MIN,0.0,-107271
2011-06-23,added Malcolm Lee to MIN,-1299.1,-108570
2011-06-23,lost Norris Cole to MIA,25416.4,-83154
2011-06-23,added Bojan Bogdanović to MIN,0.0,-83154
2011-06-23,lost Bojan Bogdanović to NJN,14407.5,-68746
2011-06-23,added Lorenzo Brown to MIN,-1372.5,-70119
2011-06-23,lost Chandler Parsons to HOU,-11690.3,-81809
2011-06-27,lost Richaun Holmes to POR,-0.0,-81809
2011-06-27,added Tanguy Ngombo to MIN,0.0,-81809
2011-12-13,lost Lazar Hayward to OKC,1198.5,-80611
2011-12-13,added Robert Vaden to MIN,0.0,-80611
2011-12-13,added Robbie Hummel to MIN,0.0,-80611
2011-12-13,added Bojan Dubljević to MIN,0.0,-80611
2011-12-14,added J.J. Barea to MIN,-6031.5,-86642
2011-12-15,added Bonzi Wells to MIN,0.0,-86642
2012-06-26,lost Terrence Jones to HOU,-3759.7,-90402
2012-06-26,added Chase Budinger to MIN,-4903.5,-95305
2012-06-26,added Lior Eliyahu to MIN,0.0,-95305
2012-06-28,added Robbie Hummel to MIN,-4352.2,-99658
2012-07-13,lost Brad Miller to NOH,-0.0,-99658
2012-07-13,lost Lorenzo Brown to NOH,-0.0,-99658
2012-07-13,lost Rade Zagorac to NOH,-0.0,-99658
2012-07-24,lost Wayne Ellington to MEM,405.6,-99252
2012-07-24,added Dante Cunningham to MIN,-4122.0,-103374
2012-07-25,added Alexey Shved to MIN,-4389.6,-107764
2012-07-27,added Andrei Kirilenko to MIN,7119.0,-100645
2012-07-27,lost Wesley Johnson to PHO,3144.9,-97500
2012-07-27,lost Semi Ojeleye to PHO,-0.0,-97500
2012-07-27,added Lorenzo Brown to MIN,-1372.5,-98872
2012-07-27,added Johnny O'Bryant to MIN,0.0,-98872
2012-07-31,added Brandon Roy to MIN,-512.4,-99385
2012-08-02,added Greg Stiemsma to MIN,-3385.2,-102770
2012-09-24,added Lou Amundson to MIN,-1271.9,-104042
2012-09-28,added Will Conroy to MIN,-498.0,-104540
2012-09-28,added Jermaine Taylor to MIN,0.0,-104540
2012-09-28,added Mike Harris to MIN,0.0,-104540
2012-09-28,added Chris Johnson to MIN,0.0,-104540
2012-11-15,added Josh Howard to MIN,-786.5999999999999,-105326
2012-12-31,added Lazar Hayward to MIN,-58.9,-105385
2013-01-18,added Mickaël Gelabale to MIN,-128.8,-105514
2013-01-19,added Chris Johnson to MIN,454.4,-105060
