date,Transaction,single_value,value
2009-06-24 00:00:00,lost Randy Foye to WAS,2000,2000
2009-06-24 00:00:00,lost Mike Miller to WAS,-2346,-346
2009-06-24 00:00:00,added Oleksiy Pecherov to MIN,-1877,-2223
2009-06-24 00:00:00,added Darius Songaila to MIN,0,-2223
2009-06-24 00:00:00,added Etan Thomas to MIN,0,-2223
2009-06-24 00:00:00,added Ricky Rubio to MIN,0,-2223
2009-06-25 00:00:00,added Ricky Rubio to MIN,9397,7173
2009-06-25 00:00:00,added Jonny Flynn to MIN,-12976,-5802
2009-06-25 00:00:00,added Ty Lawson to MIN,0,-5802
2009-06-25 00:00:00,added Wayne Ellington to MIN,-11701,-17504
2009-06-25 00:00:00,added Nick Calathes to MIN,0,-17504
2009-06-25 00:00:00,added Henk Norel to MIN,0,-17504
2009-06-25 00:00:00,lost Ty Lawson to DEN,-28662,-46166
2009-06-25 00:00:00,added Luke Babbitt to MIN,0,-46166
2009-06-25 00:00:00,lost Nick Calathes to DAL,0,-46166
2009-07-20 00:00:00,lost Mark Madsen to LAC,0,-46166
2009-07-20 00:00:00,lost Craig Smith to LAC,1630,-44536
2009-07-20 00:00:00,lost Sebastian Telfair to LAC,2502,-42033
2009-07-20 00:00:00,added Quentin Richardson to MIN,0,-42033
2009-07-27 00:00:00,lost Etan Thomas to OKC,1605,-40428
2009-07-27 00:00:00,lost Dexter Pittman to OKC,0,-40428
2009-07-27 00:00:00,added Chucky Atkins to MIN,0,-40428
2009-07-27 00:00:00,added Damien Wilkins to MIN,-2060,-42489
2009-08-11 00:00:00,added Ryan Hollins to MIN,-5625,-48115
2009-08-13 00:00:00,lost Quentin Richardson to MIA,-2706,-50821
2009-08-13 00:00:00,added Mark Blount to MIN,0,-50821
2009-09-09 00:00:00,lost Bobby Brown to NOH,1574,-49247
2009-09-09 00:00:00,lost Darius Songaila to NOH,5217,-44030
2009-09-09 00:00:00,added Antonio Daniels to MIN,0,-44030
2009-09-14 00:00:00,added Ramon Sessions to MIN,-5196,-49226
2009-09-17 00:00:00,added Sasha Pavlović to MIN,-5437,-54663
2009-09-28 00:00:00,added Jason Hart to MIN,19,-54644
2009-09-28 00:00:00,added Alonzo Gee to MIN,0,-54644
2009-09-28 00:00:00,added Devin Green to MIN,0,-54644
2009-10-20 00:00:00,added Nathan Jawai to MIN,-1565,-56210
2009-12-29 00:00:00,lost Jason Hart to PHO,0,-56210
2009-12-29 00:00:00,added Alando Tucker to MIN,-237,-56447
2009-12-29 00:00:00,added Hamady N'Diaye to MIN,0,-56447
2010-02-17 00:00:00,lost Brian Cardinal to NYK,0,-56447
2010-02-17 00:00:00,added Darko Miličić to MIN,-7248,-63695
2010-03-23 00:00:00,added Brian Cardinal to MIN,-1174,-64870
2010-04-13 00:00:00,added Greg Stiemsma to MIN,0,-64870
2010-06-24 00:00:00,added Wesley Johnson to MIN,-6602,-71472
2010-06-24 00:00:00,added Luke Babbitt to MIN,0,-71472
2010-06-24 00:00:00,added Trevor Booker to MIN,0,-71472
2010-06-24 00:00:00,added Paulão Prestes to MIN,0,-71472
2010-06-24 00:00:00,added Hamady N'Diaye to MIN,0,-71472
2010-06-24 00:00:00,lost Luke Babbitt to POR,4466,-67006
2010-06-24 00:00:00,lost Ryan Gomes to POR,0,-67006
2010-06-24 00:00:00,added Martell Webster to MIN,-3246,-70252
2010-06-24 00:00:00,lost Trevor Booker to WAS,3007,-67244
2010-06-24 00:00:00,lost Hamady N'Diaye to WAS,567,-66677
2010-06-24 00:00:00,added Nemanja Bjelica to MIN,-2519,-69196
2010-06-24 00:00:00,added Lazar Hayward to MIN,-1274,-70470
2010-07-12 00:00:00,lost Bojan Bogdanović to MIA,0,-70470
2010-07-12 00:00:00,lost Markel Brown to MIA,0,-70470
2010-07-12 00:00:00,added Michael Beasley to MIN,-6532,-77003
2010-07-13 00:00:00,lost Al Jefferson to UTA,-15628,-92631
2010-07-13 00:00:00,added Kosta Koufos to MIN,-1982,-94614
2010-07-13 00:00:00,added Donatas Motiejūnas to MIN,0,-94614
2010-07-13 00:00:00,added Terrence Jones to MIN,0,-94614
2010-07-21 00:00:00,added Luke Ridnour to MIN,-2854,-97468
2010-07-26 00:00:00,lost Ryan Hollins to CLE,7652,-89815
2010-07-26 00:00:00,lost Ramon Sessions to CLE,-36,-89851
2010-07-26 00:00:00,lost Jeff Withey to CLE,0,-89851
2010-07-26 00:00:00,added Sebastian Telfair to MIN,-2488,-92340
2010-07-26 00:00:00,added Delonte West to MIN,0,-92340
2010-08-09 00:00:00,added Anthony Tolliver to MIN,-4882,-97223
2010-09-24 00:00:00,added Maurice Ager to MIN,-20,-97243
2010-09-24 00:00:00,added Jason Hart to MIN,0,-97243
2010-11-12 00:00:00,added Sundiata Gaines to MIN,-539,-97783
2011-02-22 00:00:00,lost Corey Brewer to NYK,0,-97783
2011-02-22 00:00:00,lost Kosta Koufos to DEN,-1401,-99184
2011-02-22 00:00:00,added Richaun Holmes to MIN,0,-99184
2011-02-22 00:00:00,added Eddy Curry to MIN,0,-99184
2011-02-22 00:00:00,added Anthony Randolph to MIN,-876,-100060
2011-06-23 00:00:00,added Derrick Williams to MIN,-6532,-106593
2011-06-23 00:00:00,added Donatas Motiejūnas to MIN,0,-106593
2011-06-23 00:00:00,lost Jonny Flynn to HOU,796,-105796
2011-06-23 00:00:00,lost Donatas Motiejūnas to HOU,8980,-96815
2011-06-23 00:00:00,lost Will Barton to HOU,0,-96815
2011-06-23 00:00:00,added Brad Miller to MIN,-146,-96961
2011-06-23 00:00:00,added Nikola Mirotić to MIN,0,-96961
2011-06-23 00:00:00,added Chandler Parsons to MIN,0,-96961
2011-06-23 00:00:00,added Andre Roberson to MIN,0,-96961
2011-06-23 00:00:00,lost Nikola Mirotić to CHI,-10309,-107271
2011-06-23 00:00:00,added Norris Cole to MIN,0,-107271
2011-06-23 00:00:00,added Malcolm Lee to MIN,-1299,-108570
2011-06-23 00:00:00,lost Norris Cole to MIA,25416,-83154
2011-06-23 00:00:00,added Bojan Bogdanović to MIN,0,-83154
2011-06-23 00:00:00,lost Bojan Bogdanović to NJN,14407,-68746
2011-06-23 00:00:00,added Lorenzo Brown to MIN,-1372,-70119
2011-06-23 00:00:00,lost Chandler Parsons to HOU,-11690,-81809
2011-06-27 00:00:00,lost Richaun Holmes to POR,0,-81809
2011-12-13 00:00:00,lost Lazar Hayward to OKC,1198,-80611
2011-12-13 00:00:00,added Robert Vaden to MIN,0,-80611
2011-12-13 00:00:00,added Robbie Hummel to MIN,0,-80611
2011-12-13 00:00:00,added Bojan Dubljević to MIN,0,-80611
2011-12-14 00:00:00,added J.J. Barea to MIN,-6031,-86642
2011-12-15 00:00:00,added Bonzi Wells to MIN,0,-86642
2012-06-26 00:00:00,lost Terrence Jones to HOU,-3759,-90402
2012-06-26 00:00:00,added Chase Budinger to MIN,-4903,-95305
2012-06-26 00:00:00,added Lior Eliyahu to MIN,0,-95305
2012-06-28 00:00:00,added Robbie Hummel to MIN,-4352,-99658
2012-07-13 00:00:00,lost Brad Miller to NOH,0,-99658
2012-07-13 00:00:00,lost Lorenzo Brown to NOH,0,-99658
2012-07-13 00:00:00,lost Rade Zagorac to NOH,0,-99658
2012-07-24 00:00:00,lost Wayne Ellington to MEM,405,-99252
2012-07-24 00:00:00,added Dante Cunningham to MIN,-4122,-103374
2012-07-25 00:00:00,added Alexey Shved to MIN,-4389,-107764
2012-07-27 00:00:00,added Andrei Kirilenko to MIN,7119,-100645
2012-07-27 00:00:00,lost Wesley Johnson to PHO,3144,-97500
2012-07-27 00:00:00,lost Semi Ojeleye to PHO,0,-97500
2012-07-27 00:00:00,added Lorenzo Brown to MIN,-1372,-98872
2012-07-27 00:00:00,added Johnny O'Bryant to MIN,0,-98872
2012-07-31 00:00:00,added Brandon Roy to MIN,-512,-99385
2012-08-02 00:00:00,added Greg Stiemsma to MIN,-3385,-102770
2012-09-24 00:00:00,added Lou Amundson to MIN,-1271,-104042
2012-09-28 00:00:00,added Will Conroy to MIN,-498,-104540
2012-09-28 00:00:00,added Jermaine Taylor to MIN,0,-104540
2012-09-28 00:00:00,added Mike Harris to MIN,0,-104540
2012-09-28 00:00:00,added Chris Johnson to MIN,0,-104540
2012-11-15 00:00:00,added Josh Howard to MIN,-786,-105326
2012-12-31 00:00:00,added Lazar Hayward to MIN,-58,-105385
2013-01-18 00:00:00,added Mickaël Gelabale to MIN,-128,-105514
2013-01-19 00:00:00,added Chris Johnson to MIN,454,-105060
