date,Transaction,single_value_bpm,value_bpm,single_value_vorp,value_vorp,transaction_type,player_name
1989-06-15 00:00:00,added Gary Leonard to MIN,0.0,0,0.0,0.0,trade,Gary Leonard
1989-06-27 00:00:00,added Pooh Richardson to MIN,13720.0,13720,7.800000000000001,7.800000000000001,draft,Pooh Richardson
1989-06-27 00:00:00,added Gary Leonard to MIN,-1066.8,12653,-0.2,7.6,draft,Gary Leonard
1989-06-27 00:00:00,added Doug West to MIN,-46313.7,-33660,-3.8,3.8000000000000007,draft,Doug West
1989-07-23 00:00:00,added Sam Mitchell to MIN,-48147.100000000006,-81807,-2.8,1.0000000000000009,signing,Sam Mitchell
1989-08-03 00:00:00,added Sidney Lowe to MIN,-4708.8,-86516,-0.3,0.7000000000000008,signing,Sidney Lowe
1989-08-16 00:00:00,added Tod Murphy to MIN,-5712.0,-92228,0.6000000000000001,1.300000000000001,signing,Tod Murphy
1989-08-30 00:00:00,added Jim Farmer to MIN,0.0,-92228,0.0,1.300000000000001,signing,Jim Farmer
1989-09-12 00:00:00,added Donald Royal to MIN,-1268.2,-93496,0.1,1.400000000000001,signing,Donald Royal
1989-09-13 00:00:00,added Tony Campbell to MIN,-2558.6,-96055,3.6,5.000000000000001,signing,Tony Campbell
1989-10-03 00:00:00,added Jim Thomas to MIN,0.0,-96055,0.0,5.000000000000001,signing,Jim Thomas
1989-10-20 00:00:00,added Adrian Branch to MIN,-182.0,-96237,0.0,5.000000000000001,signing,Adrian Branch
1989-10-27 00:00:00,lost Rick Mahorn to PHI,6007.200000000001,-90230,-0.8,4.200000000000001,trade,Rick Mahorn
1989-10-27 00:00:00,added Gerald Glass to MIN,0.0,-90230,0.0,4.200000000000001,trade,Gerald Glass
1989-10-27 00:00:00,added Alvaro Teheran to MIN,0.0,-90230,0.0,4.200000000000001,trade,Alvaro Teheran
1989-10-27 00:00:00,added Duane Cooper to MIN,0.0,-90230,0.0,4.200000000000001,trade,Duane Cooper
1990-01-04 00:00:00,lost Brad Lohaus to MIL,472.2999999999997,-89757,-3.2,1.0000000000000009,trade,Brad Lohaus
1990-01-04 00:00:00,lost Duane Cooper to MIL,-0.0,-89757,-0.0,1.0000000000000009,trade,Duane Cooper
1990-01-04 00:00:00,added Randy Breuer to MIN,-5761.8,-95519,0.6,1.600000000000001,trade,Randy Breuer
1990-01-04 00:00:00,added Chris Smith to MIN,-9013.3,-104532,-0.3,1.300000000000001,trade,Chris Smith
1990-02-22 00:00:00,lost Steve Johnson to SEA,871.2,-103661,0.1,1.400000000000001,trade,Steve Johnson
1990-02-22 00:00:00,added Brad Sellers to MIN,-3368.6,-107030,-0.5,0.900000000000001,trade,Brad Sellers
1990-06-25 00:00:00,lost Brian Oliver to PHI,6170.5,-100859,1.0,1.900000000000001,trade,Brian Oliver
1990-06-25 00:00:00,added Scott Brooks to MIN,3454.4,-97405,1.9,3.8000000000000007,trade,Scott Brooks
1990-06-27 00:00:00,added Felton Spencer to MIN,-19472.1,-116877,-2.5,1.3000000000000007,draft,Felton Spencer
1990-06-27 00:00:00,added Gerald Glass to MIN,-5813.4,-122690,-0.1,1.2000000000000006,draft,Gerald Glass
1990-07-20 00:00:00,added Tim Legler to MIN,0.0,-122690,0.0,1.2000000000000006,signing,Tim Legler
1990-08-20 00:00:00,added Leon Wood to MIN,0.0,-122690,0.0,1.2000000000000006,signing,Leon Wood
1990-10-02 00:00:00,added Richard Coffey to MIN,-2240.0,-124930,-0.4,0.8000000000000006,signing,Richard Coffey
1990-10-03 00:00:00,added Jim Thomas to MIN,-103.6,-125034,0.0,0.8000000000000006,signing,Jim Thomas
1990-11-10 00:00:00,lost Alvaro Teheran to PHI,-0.0,-125034,-0.0,0.8000000000000006,trade,Alvaro Teheran
1990-11-10 00:00:00,added Bob Thornton to MIN,-1243.0,-126277,-0.3,0.5000000000000007,trade,Bob Thornton
1992-06-24 00:00:00,,0.0,-126277,0.0,0.5000000000000007,,
1992-06-24 00:00:00,added Don MacLean to DET,0.0,-126277,0.0,0.5000000000000007,draft,Don MacLean
1992-06-24 00:00:00,lost William Bedford to LAC,-0.0,-126277,-0.0,0.5000000000000007,trade,William Bedford
1992-06-24 00:00:00,lost Don MacLean to LAC,-0.0,-126277,-0.0,0.5000000000000007,trade,Don MacLean
1992-06-24 00:00:00,added Olden Polynice to DET,-3797.7,-130075,0.4,0.9000000000000007,trade,Olden Polynice
1992-06-24 00:00:00,added Russ Millard to DET,0.0,-130075,0.0,0.9000000000000007,trade,Russ Millard
1992-06-24 00:00:00,added Eddie Elisma to DET,0.0,-130075,0.0,0.9000000000000007,trade,Eddie Elisma
1992-09-08 00:00:00,lost John Salley to MIA,2479.8,-127595,-2.0,-1.0999999999999992,trade,John Salley
1992-09-08 00:00:00,added Isaiah Morris to DET,0.0,-127595,0.0,-1.0999999999999992,trade,Isaiah Morris
1992-09-08 00:00:00,added Lindsey Hunter to DET,0.0,-127595,0.0,-1.0999999999999992,trade,Lindsey Hunter
1992-09-15 00:00:00,added Isaiah Morris to DET,-581.4,-128176,-0.1,-1.1999999999999993,signing,Isaiah Morris
1992-10-01 00:00:00,added Terry Mills to DET,-720.3999999999993,-128897,6.3,5.1000000000000005,signing,Terry Mills
1992-10-07 00:00:00,added Earl Cureton to DET,0.0,-128897,0.0,5.1000000000000005,signing,Earl Cureton
1992-10-09 00:00:00,added Jimmy Oliver to DET,0.0,-128897,0.0,5.1000000000000005,signing,Jimmy Oliver
1992-11-15 00:00:00,lost Lance Blanks to MIN,2375.4,-126521,0.3,5.4,trade,Lance Blanks
1992-11-15 00:00:00,lost Brad Sellers to MIN,2238.6,-124283,0.3,5.7,trade,Brad Sellers
1992-11-15 00:00:00,added Gerald Glass to DET,-466.2,-124749,0.3,6.0,trade,Gerald Glass
1992-11-15 00:00:00,added Mark Randall to DET,-912.0,-125661,-0.1,5.9,trade,Mark Randall
1992-11-25 00:00:00,added Danny Young to DET,-418.0,-126079,0.3,6.2,signing,Danny Young
1992-12-30 00:00:00,added Jeff Ruland to DET,-544.5,-126623,-0.1,6.1000000000000005,signing,Jeff Ruland
1993-01-18 00:00:00,added Melvin Newbern to DET,0.0,-126623,0.0,6.1000000000000005,signing,Melvin Newbern
1993-02-14 00:00:00,added Melvin Newbern to DET,-746.4,-127370,0.0,6.1000000000000005,signing,Melvin Newbern
1993-02-25 00:00:00,lost Orlando Woolridge to MIL,241.8,-127128,-0.0,6.1000000000000005,trade,Orlando Woolridge
1993-02-25 00:00:00,added Alvin Robertson to DET,1035.1,-126093,0.7,6.800000000000001,trade,Alvin Robertson
1993-06-30 00:00:00,added Lindsey Hunter to DET,-4733.200000000001,-130826,8.1,14.9,draft,Lindsey Hunter
1993-06-30 00:00:00,added Allan Houston to DET,-4340.999999999999,-135167,2.2,17.1,draft,Allan Houston
1993-09-08 00:00:00,added Greg Anderson to DET,-2598.4,-137765,0.2,17.3,signing,Greg Anderson
1993-10-01 00:00:00,lost Isaiah Morris to SAS,-0.0,-137765,-0.0,17.3,trade,Isaiah Morris
1993-10-01 00:00:00,lost Dennis Rodman to SAS,-5811.4,-143577,-3.8,13.5,trade,Dennis Rodman
1993-10-01 00:00:00,lost Antonio Lang to SAS,-0.0,-143577,-0.0,13.5,trade,Antonio Lang
1993-10-01 00:00:00,lost John Wallace to SAS,-0.0,-143577,-0.0,13.5,trade,John Wallace
1993-10-01 00:00:00,added Sean Elliott to DET,-5781.599999999999,-149358,-0.2,13.3,trade,Sean Elliott
1993-10-01 00:00:00,added David Wood to DET,-2836.8,-152195,-0.1,13.2,trade,David Wood
1993-10-01 00:00:00,added Jerome Williams to DET,4450.0,-147745,4.0,17.200000000000003,trade,Jerome Williams
1993-11-01 00:00:00,added Tracy Moore to DET,168.0,-147577,0.0,17.200000000000003,signing,Tracy Moore
1993-11-01 00:00:00,added Dan O'Sullivan to DET,-436.8,-148014,-0.1,17.1,signing,Dan O'Sullivan
1993-11-19 00:00:00,lost Alvin Robertson to DEN,-0.0,-148014,-0.0,17.1,trade,Alvin Robertson
1993-11-19 00:00:00,added Marcus Liberty to DET,-2000.2,-150014,-0.4,16.700000000000003,trade,Marcus Liberty
1993-11-19 00:00:00,added Mark Macon to DET,-3158.5,-153173,-0.1,16.6,trade,Mark Macon
1993-12-17 00:00:00,added Tod Murphy to DET,-142.5,-153315,0.0,16.6,signing,Tod Murphy
1994-01-17 00:00:00,added Ben Coleman to DET,-531.3000000000001,-153846,-0.1,16.5,signing,Ben Coleman
1994-01-21 00:00:00,added Charles Jones to DET,0.0,-153846,0.0,16.5,signing,Charles Jones
1994-02-10 00:00:00,added Charles Jones to DET,-2631.0,-156477,-0.2,16.3,signing,Charles Jones
1994-02-20 00:00:00,lost Olden Polynice to SAC,19772.9,-136705,-0.2,16.1,trade,Olden Polynice
1994-02-20 00:00:00,added Pete Chilcutt to DET,-1798.6,-138503,-0.3,15.8,trade,Pete Chilcutt
1994-02-20 00:00:00,added Jevon Crudup to DET,0.0,-138503,0.0,15.8,trade,Jevon Crudup
1994-02-20 00:00:00,added Cal Bowdler to DET,0.0,-138503,0.0,15.8,trade,Cal Bowdler
1994-06-29 00:00:00,added Grant Hill to DET,88764.0,-49739,30.9,46.7,draft,Grant Hill
1994-06-29 00:00:00,added Jevon Crudup to DET,0.0,-49739,0.0,46.7,draft,Jevon Crudup
1994-07-19 00:00:00,lost Sean Elliott to SAS,-6855.0,-56594,-7.500000000000001,39.2,trade,Sean Elliott
1994-07-19 00:00:00,added Bill Curley to DET,-3094.0,-59688,-0.5,38.7,trade,Bill Curley
1994-07-19 00:00:00,added Charles O'Bannon to DET,-821.4000000000001,-60510,0.0,38.7,trade,Charles O'Bannon
1994-07-25 00:00:00,lost Jamie Feick to PHI,-0.0,-60510,-0.0,38.7,trade,Jamie Feick
1994-07-25 00:00:00,added Eric Leckner to DET,-4419.4,-64929,-0.7,38.0,trade,Eric Leckner
1994-07-27 00:00:00,added Rafael Addison to DET,-5860.799999999999,-70790,-0.6,37.4,signing,Rafael Addison
1994-08-01 00:00:00,lost Russ Millard to PHO,-0.0,-70790,-0.0,37.4,trade,Russ Millard
1994-08-01 00:00:00,added Mark West to DET,-9599.9,-80390,-1.3,36.1,trade,Mark West
1994-09-06 00:00:00,added Oliver Miller to DET,155.8,-80234,0.8,36.9,signing,Oliver Miller
1994-10-06 00:00:00,added Ivano Newbill to DET,-1853.6,-82087,-0.3,36.6,signing,Ivano Newbill
1994-10-10 00:00:00,added Johnny Dawkins to DET,-2223.0,-84310,0.0,36.6,signing,Johnny Dawkins
1994-12-12 00:00:00,added Walter Bond to DET,-418.2,-84729,-0.1,36.5,signing,Walter Bond
1994-12-30 00:00:00,added Mike Peplowski to DET,0.0,-84729,0.0,36.5,signing,Mike Peplowski
1994-12-30 00:00:00,added Negele Knight to DET,-2992.5,-87721,-0.4,36.1,signing,Negele Knight
1995-01-10 00:00:00,added Mike Peplowski to DET,-109.2,-87830,0.0,36.1,signing,Mike Peplowski
