date,Transaction,single_value_bpm,value_bpm,single_value_vorp,value_vorp,transaction_type,player_name
2020-11-18 00:00:00,added Tyrese Haliburton to SAC,0.0,0,0.0,0.0,draft,Tyrese Haliburton
2020-11-18 00:00:00,added Xavier Tillman Sr. to SAC,0.0,0,0.0,0.0,draft,Xavier Tillman Sr.
2020-11-18 00:00:00,added Jahmi'us Ramsey to SAC,0.0,0,0.0,0.0,draft,Jahmi'us Ramsey
2020-11-18 00:00:00,added Kenyon Martin Jr. to SAC,0.0,0,0.0,0.0,draft,Kenyon Martin Jr.
2020-11-19 00:00:00,lost Xavier Tillman Sr. to MEM,-1325.6999999999998,-1325,-2.3000000000000003,-2.3000000000000003,trade,Xavier Tillman Sr.
2020-11-19 00:00:00,added Robert Woodard to SAC,0.0,-1325,0.0,-2.3000000000000003,trade,Robert Woodard
2020-11-19 00:00:00,added Isaiah Mobley to SAC,0.0,-1325,0.0,-2.3000000000000003,trade,Isaiah Mobley
2020-11-25 00:00:00,lost Kenyon Martin Jr. to HOU,5514.0,4188,-1.1,-3.4000000000000004,trade,Kenyon Martin Jr.
2020-11-25 00:00:00,added Luka Garza to SAC,0.0,4188,0.0,-3.4000000000000004,trade,Luka Garza
2020-11-26 00:00:00,added Tyrese Haliburton to SAC,7012.599999999999,11200,3.5,0.0999999999999996,signing,Tyrese Haliburton
2020-11-27 00:00:00,added Hassan Whiteside to SAC,-1201.2,9999,0.0,0.0999999999999996,signing,Hassan Whiteside
2020-11-27 00:00:00,added Chimezie Metu to SAC,0.0,9999,0.0,0.0999999999999996,signing,Chimezie Metu
2020-11-28 00:00:00,added DaQuan Jeffries to SAC,-1229.6,8770,-0.2,-0.1000000000000003,signing,DaQuan Jeffries
2020-11-30 00:00:00,added Frank Kaminsky to SAC,0.0,8770,0.0,-0.1000000000000003,signing,Frank Kaminsky
2020-11-30 00:00:00,added Robert Woodard to SAC,-675.3,8094,-0.1,-0.2000000000000003,signing,Robert Woodard
2020-12-02 00:00:00,added Glenn Robinson to SAC,-1476.0,6618,-0.2,-0.4000000000000003,signing,Glenn Robinson
2020-12-03 00:00:00,added Jahmi'us Ramsey to SAC,-1347.6,5271,-0.3,-0.7000000000000004,signing,Jahmi'us Ramsey
2020-12-24 00:00:00,added Chimezie Metu to SAC,-3744.2,1526,0.3,-0.4000000000000004,signing,Chimezie Metu
2021-02-25 00:00:00,added Norvel Pelle to SAC,12.8,1539,0.0,-0.4000000000000004,signing,Norvel Pelle
2021-03-22 00:00:00,added Mfiondu Kabengele to SAC,0.0,1539,0.0,-0.4000000000000004,trade,Mfiondu Kabengele
2021-03-25 00:00:00,lost Nemanja Bjelica to MIA,202.8,1742,-0.0,-0.4000000000000004,trade,Nemanja Bjelica
2021-03-25 00:00:00,added Maurice Harkless to SAC,-2462.4,-719,-0.3,-0.7000000000000004,trade,Maurice Harkless
2021-03-25 00:00:00,added Chris Silva to SAC,-185.4,-905,0.0,-0.7000000000000004,trade,Chris Silva
2021-03-25 00:00:00,lost Dalano Banton to TOR,2297.1,1391,0.1,-0.6000000000000004,trade,Dalano Banton
2021-03-25 00:00:00,lost Cory Joseph to DET,4748.7,6140,-0.6000000000000001,-1.2000000000000006,trade,Cory Joseph
2021-03-25 00:00:00,lost Luka Garza to DET,972.5,7113,0.1,-1.1000000000000003,trade,Luka Garza
2021-03-25 00:00:00,added Delon Wright to SAC,835.1999999999999,7948,0.6,-0.5000000000000006,trade,Delon Wright
2021-04-07 00:00:00,added Damian Jones to SAC,0.0,7948,0.0,-0.5000000000000006,signing,Damian Jones
2021-04-27 00:00:00,added Damian Jones to SAC,100.49999999999996,8048,0.7,0.1999999999999994,signing,Damian Jones
2021-04-30 00:00:00,added Louis King to SAC,-61.89999999999992,7986,0.0,0.1999999999999994,signing,Louis King
2021-07-29 00:00:00,added Davion Mitchell to SAC,0.0,7986,0.0,0.1999999999999994,draft,Davion Mitchell
2021-07-29 00:00:00,added Neemias Queta to SAC,0.0,7986,0.0,0.1999999999999994,draft,Neemias Queta
2021-08-05 00:00:00,added Davion Mitchell to SAC,-15683.8,-7696,-1.6,-1.4000000000000008,signing,Davion Mitchell
2021-08-06 00:00:00,added Terence Davis to SAC,-1743.9,-9440,0.3,-1.1000000000000008,signing,Terence Davis
2021-08-06 00:00:00,added Richaun Holmes to SAC,-1546.1999999999998,-10987,0.3,-0.8000000000000007,signing,Richaun Holmes
2021-08-07 00:00:00,lost Delon Wright to ATL,-3194.4,-14181,-1.6,-2.400000000000001,multitrade,Delon Wright
2021-08-07 00:00:00,added Tristan Thompson to SAC,-1683.5,-15864,-0.2,-2.600000000000001,multitrade,Tristan Thompson
2021-08-07 00:00:00,added Maurice Harkless to SAC,-2847.9,-18712,-0.3,-2.900000000000001,signing,Maurice Harkless
2021-08-08 00:00:00,added Neemias Queta to SAC,-612.0,-19324,-0.1,-3.000000000000001,signing,Neemias Queta
2021-08-13 00:00:00,added Alex Len to SAC,-2441.9999999999995,-21766,-0.2,-3.200000000000001,signing,Alex Len
2021-09-08 00:00:00,added Emanuel Terry to SAC,0.0,-21766,0.0,-3.200000000000001,signing,Emanuel Terry
2021-09-23 00:00:00,added Matt Coleman to SAC,0.0,-21766,0.0,-3.200000000000001,signing,Matt Coleman
2021-09-25 00:00:00,added D.J. Steward to SAC,0.0,-21766,0.0,-3.200000000000001,signing,D.J. Steward
2021-10-12 00:00:00,added Ade Murkey to SAC,0.0,-21766,0.0,-3.200000000000001,signing,Ade Murkey
2021-10-12 00:00:00,added Damien Jefferson to SAC,0.0,-21766,0.0,-3.200000000000001,signing,Damien Jefferson
2021-12-17 00:00:00,added Justin Robinson to SAC,-393.0,-22159,-0.1,-3.300000000000001,signing,Justin Robinson
2021-12-22 00:00:00,added Ade Murkey to SAC,-9.7,-22169,0.0,-3.300000000000001,signing,Ade Murkey
2021-12-22 00:00:00,added Emmanuel Mudiay to SAC,-13.2,-22182,0.0,-3.300000000000001,signing,Emmanuel Mudiay
2022-02-08 00:00:00,lost Tyrese Haliburton to IND,-45295.1,-67477,-15.2,-18.5,trade,Tyrese Haliburton
2022-02-08 00:00:00,lost Buddy Hield to IND,-3965.5,-71443,-3.3,-21.8,trade,Buddy Hield
2022-02-08 00:00:00,lost Tristan Thompson to IND,448.8,-70994,0.1,-21.7,trade,Tristan Thompson
2022-02-08 00:00:00,added Justin Holiday to SAC,-2179.4,-73173,-0.2,-21.9,trade,Justin Holiday
2022-02-08 00:00:00,added Jeremy Lamb to SAC,-483.0,-73656,0.0,-21.9,trade,Jeremy Lamb
2022-02-08 00:00:00,added Domantas Sabonis to SAC,47890.0,-25766,16.200000000000003,-5.699999999999996,trade,Domantas Sabonis
2022-02-08 00:00:00,added Jordan Walsh to SAC,0.0,-25766,0.0,-5.699999999999996,trade,Jordan Walsh
2022-02-10 00:00:00,lost Tyler Smith to MIL,193.2,-25573,-0.0,-5.699999999999996,multitrade,Tyler Smith
2022-02-10 00:00:00,lost Vanja Marinkovic to LAC,-0.0,-25573,-0.0,-5.699999999999996,multitrade,Vanja Marinkovic
2022-02-10 00:00:00,lost Marvin Bagley III to DET,1758.6,-23815,-0.6,-6.299999999999995,multitrade,Marvin Bagley III
2022-02-10 00:00:00,added Josh Jackson to SAC,-1131.6,-24946,-0.2,-6.499999999999996,multitrade,Josh Jackson
2022-02-10 00:00:00,added Trey Lyles to SAC,-1794.0,-26740,0.4000000000000001,-6.099999999999995,multitrade,Trey Lyles
2022-02-10 00:00:00,added David Michineau to SAC,0.0,-26740,0.0,-6.099999999999995,multitrade,David Michineau
2022-02-10 00:00:00,added Donte DiVincenzo to SAC,-399.0,-27139,0.2,-5.899999999999995,multitrade,Donte DiVincenzo
2022-06-23 00:00:00,added Keegan Murray to SAC,0.0,-27139,0.0,-5.899999999999995,draft,Keegan Murray
2022-06-23 00:00:00,added Jaden Hardy to SAC,0.0,-27139,0.0,-5.899999999999995,draft,Jaden Hardy
2022-06-23 00:00:00,lost Isaiah Mobley to CLE,592.8,-26546,0.1,-5.799999999999995,trade,Isaiah Mobley
2022-06-23 00:00:00,added Sasha Vezenkov to SAC,0.0,-26546,0.0,-5.799999999999995,trade,Sasha Vezenkov
2022-06-23 00:00:00,lost Jaden Hardy to DAL,9666.9,-16879,1.1,-4.699999999999996,trade,Jaden Hardy
2022-06-23 00:00:00,added Anton Watson to SAC,0.0,-16879,0.0,-4.699999999999996,trade,Anton Watson
2022-07-02 00:00:00,added Keegan Murray to SAC,-8103.6,-24983,1.8,-2.899999999999996,signing,Keegan Murray
2022-07-02 00:00:00,added Neemias Queta to SAC,-98.6,-25082,0.0,-2.899999999999996,signing,Neemias Queta
2022-07-02 00:00:00,added Keon Ellis to SAC,92.29999999999929,-24989,0.0999999999999996,-2.7999999999999963,signing,Keon Ellis
2022-07-06 00:00:00,lost Maurice Harkless to ATL,-0.0,-24989,-0.0,-2.7999999999999963,trade,Maurice Harkless
2022-07-06 00:00:00,lost Justin Holiday to ATL,1520.7,-23469,0.2,-2.599999999999996,trade,Justin Holiday
2022-07-06 00:00:00,added Kevin Huerter to SAC,-1114.3,-24583,2.1,-0.499999999999996,trade,Kevin Huerter
2022-07-06 00:00:00,added Malik Monk to SAC,1638.9,-22944,2.2,1.7000000000000042,signing,Malik Monk
2022-07-18 00:00:00,added Chima Moneke to SAC,-165.6,-23110,0.0,1.7000000000000042,signing,Chima Moneke
2022-07-29 00:00:00,added Matthew Dellavedova to SAC,-1107.6,-24217,-0.2,1.5000000000000042,signing,Matthew Dellavedova
2022-08-12 00:00:00,added Sam Merrill to SAC,0.0,-24217,0.0,1.5000000000000042,signing,Sam Merrill
2022-09-08 00:00:00,added DJ Steward to SAC,0.0,-24217,0.0,1.5000000000000042,signing,DJ Steward
2022-09-14 00:00:00,added KZ Okpala to SAC,-793.6,-25011,-0.1,1.400000000000004,signing,KZ Okpala
2022-09-20 00:00:00,added Quinn Cook to SAC,0.0,-25011,0.0,1.400000000000004,signing,Quinn Cook
2022-09-20 00:00:00,added Kent Bazemore to SAC,0.0,-25011,0.0,1.400000000000004,signing,Kent Bazemore
2022-10-13 00:00:00,added Jordan Ford to SAC,0.0,-25011,0.0,1.400000000000004,signing,Jordan Ford
2022-10-13 00:00:00,added Wesley Iwundu to SAC,0.0,-25011,0.0,1.400000000000004,signing,Wesley Iwundu
2022-10-14 00:00:00,added Alex O'Connell to SAC,0.0,-25011,0.0,1.400000000000004,signing,Alex O'Connell
2022-10-14 00:00:00,added Jeriah Horne to SAC,0.0,-25011,0.0,1.400000000000004,signing,Jeriah Horne
2023-01-09 00:00:00,added PJ Dozier to SAC,0.0,-25011,0.0,1.400000000000004,signing,PJ Dozier
2023-01-30 00:00:00,added Deonte Burton to SAC,-145.2,-25156,0.0,1.400000000000004,signing,Deonte Burton
2023-02-07 00:00:00,lost David Michineau to BRK,-0.0,-25156,-0.0,1.400000000000004,trade,David Michineau
2023-02-07 00:00:00,added Kessler Edwards to SAC,-1177.5,-26334,0.0,1.400000000000004,trade,Kessler Edwards
2023-02-25 00:00:00,added PJ Dozier to SAC,-616.1999999999999,-26950,-0.1,1.300000000000004,signing,PJ Dozier
2023-06-22 00:00:00,added Olivier-Maxence Prosper to SAC,0.0,-26950,0.0,1.300000000000004,draft,Olivier-Maxence Prosper
2023-06-22 00:00:00,added Jordan Walsh to SAC,0.0,-26950,0.0,1.300000000000004,draft,Jordan Walsh
2023-06-22 00:00:00,added Jalen Slawson to SAC,0.0,-26950,0.0,1.300000000000004,draft,Jalen Slawson
2023-06-28 00:00:00,lost Jordan Walsh to BOS,1949.4,-25000,0.2,1.500000000000004,trade,Jordan Walsh
2023-06-28 00:00:00,lost Anton Watson to BOS,-0.0,-25000,-0.0,1.500000000000004,trade,Anton Watson
2023-06-28 00:00:00,added Colby Jones to SAC,0.0,-25000,0.0,1.500000000000004,trade,Colby Jones
2023-07-02 00:00:00,added Jalen Slawson to SAC,-236.8,-25237,0.0,1.500000000000004,signing,Jalen Slawson
2023-07-02 00:00:00,added Colby Jones to SAC,-1311.0,-26548,-0.1,1.400000000000004,signing,Colby Jones
2023-07-02 00:00:00,added Keon Ellis to SAC,4947.6,-21601,2.7,4.100000000000004,signing,Keon Ellis
2023-07-06 00:00:00,added Chris Duarte to SAC,-2444.6,-24045,-0.2,3.900000000000004,trade,Chris Duarte
2023-07-06 00:00:00,lost Richaun Holmes to DAL,711.0,-23334,0.1,4.000000000000004,trade,Richaun Holmes
2023-07-06 00:00:00,lost Olivier-Maxence Prosper to DAL,2200.8,-21133,0.1,4.100000000000003,trade,Olivier-Maxence Prosper
2023-07-07 00:00:00,added Trey Lyles to SAC,-2309.8,-23443,0.7,4.800000000000003,signing,Trey Lyles
2023-07-09 00:00:00,added Alex Len to SAC,88.8,-23354,0.2,5.000000000000004,signing,Alex Len
2023-07-13 00:00:00,added Sasha Vezenkov to SAC,-459.9,-23814,0.1,5.100000000000003,signing,Sasha Vezenkov
2023-07-21 00:00:00,added Nerlens Noel to SAC,0.0,-23814,0.0,5.100000000000003,signing,Nerlens Noel
2023-08-08 00:00:00,added Neemias Queta to SAC,0.0,-23814,0.0,5.100000000000003,signing,Neemias Queta
2023-09-02 00:00:00,added JaVale McGee to SAC,-440.7,-24255,0.1,5.200000000000003,signing,JaVale McGee
2023-09-14 00:00:00,added Jordan Ford to SAC,48.400000000000006,-24207,0.0,5.200000000000003,signing,Jordan Ford
2023-11-01 00:00:00,lost Dimitrios Agravanis to LAC,-0.0,-24207,-0.0,5.200000000000003,trade,Dimitrios Agravanis
2023-11-01 00:00:00,added Filip Petrusev to SAC,-65.10000000000001,-24272,0.0,5.200000000000003,trade,Filip Petrusev
2023-12-15 00:00:00,added Juan Toscano-Anderson to SAC,0.0,-24272,0.0,5.200000000000003,signing,Juan Toscano-Anderson
2024-01-09 00:00:00,added Juan Toscano-Anderson to SAC,-498.2000000000001,-24770,-0.1,5.100000000000003,signing,Juan Toscano-Anderson
2024-02-08 00:00:00,lost Dimitrios Agravanis to MIL,-0.0,-24770,-0.0,5.100000000000003,trade,Dimitrios Agravanis
2024-02-08 00:00:00,added Robin Lopez to SAC,0.0,-24770,0.0,5.100000000000003,trade,Robin Lopez
2024-02-09 00:00:00,added Mason Jones to SAC,-23.5,-24793,0.1,5.200000000000003,signing,Mason Jones
2024-06-26 00:00:00,added Devin Carter to SAC,0.0,-24793,0.0,5.200000000000003,draft,Devin Carter
2024-06-26 00:00:00,added Jamal Shead to SAC,0.0,-24793,0.0,5.200000000000003,draft,Jamal Shead
2024-06-26 00:00:00,added Devin Carter to SAC,0.0,-24793,0.0,5.200000000000003,draft,Devin Carter
2024-06-26 00:00:00,added Jamal Shead to SAC,0.0,-24793,0.0,5.200000000000003,draft,Jamal Shead
2024-06-28 00:00:00,lost Davion Mitchell to TOR,4644.0,-20149,0.6,5.8000000000000025,trade,Davion Mitchell
2024-06-28 00:00:00,lost Jamal Shead to TOR,5308.599999999999,-14841,0.6,6.400000000000002,trade,Jamal Shead
2024-06-28 00:00:00,lost Sasha Vezenkov to TOR,-0.0,-14841,-0.0,6.400000000000002,trade,Sasha Vezenkov
2024-06-28 00:00:00,added Jalen McDaniels to SAC,0.0,-14841,0.0,6.400000000000002,trade,Jalen McDaniels
2024-06-28 00:00:00,lost future 2nd round pick to TOR,4804.122751165062,-10037,0.4914597019452627,6.891459701945265,trade,future 2nd round pick
2024-07-02 00:00:00,added Isaiah Crawford to SAC,-193.2,-10230,0.0,6.891459701945265,signing,Isaiah Crawford
2024-07-03 00:00:00,added Isaac Jones to SAC,-503.2,-10733,0.0,6.891459701945265,signing,Isaac Jones
2024-07-06 00:00:00,added Malik Monk to SAC,-1643.2,-12376,0.6,7.491459701945264,signing,Malik Monk
2024-07-08 00:00:00,lost Harrison Barnes to SAS,-218.1,-12594,-1.1,6.391459701945264,multitrade,Harrison Barnes
2024-07-08 00:00:00,lost future 1st round pick to SAS,-1729.649868182676,-14324,-6.080084337083584,0.3113753648616804,multitrade,future 1st round pick
2024-07-08 00:00:00,lost Chris Duarte to CHI,-88.8,-14413,-0.1,0.2113753648616803,multitrade,Chris Duarte
2024-07-08 00:00:00,lost future 2nd round pick to CHI,4804.122751165062,-9609,0.4914597019452627,0.7028350668069431,multitrade,future 2nd round pick
2024-07-08 00:00:00,lost future 2nd round pick to CHI,4804.122751165062,-4805,0.4914597019452627,1.1942947687522056,multitrade,future 2nd round pick
2024-07-08 00:00:00,added DeMar DeRozan to SAC,270.0,-4535,1.4,2.594294768752205,multitrade,DeMar DeRozan
2024-07-09 00:00:00,added Jordan McLaughlin to SAC,-665.0,-5200,-0.1,2.494294768752205,signing,Jordan McLaughlin
2024-07-09 00:00:00,added Devin Carter to SAC,-1253.0,-6453,-0.1,2.3942947687522054,signing,Devin Carter
2024-07-09 00:00:00,added Alex Len to SAC,77.39999999999999,-6375,0.2,2.594294768752205,signing,Alex Len
2024-08-07 00:00:00,added Orlando Robinson to SAC,-165.29999999999998,-6540,0.0,2.594294768752205,signing,Orlando Robinson
2024-10-15 00:00:00,lost Jalen McDaniels to SAS,-0.0,-6540,-0.0,2.594294768752205,trade,Jalen McDaniels
2024-10-15 00:00:00,added future 2nd round pick to SAC,-4804.122751165062,-11345,-0.4914597019452627,2.102835066806943,trade,future 2nd round pick
2024-10-15 00:00:00,lost future 2nd round pick to SAS,4804.122751165062,-6540,0.4914597019452627,2.594294768752205,trade,future 2nd round pick
2024-11-27 00:00:00,added Jae Crowder to SAC,-442.9,-6983,-0.1,2.494294768752205,signing,Jae Crowder
2025-02-03 00:00:00,lost De'Aaron Fox to SAS,1156.0,-5827,-0.0,2.494294768752205,multitrade,De'Aaron Fox
2025-02-03 00:00:00,lost Jordan McLaughlin to SAS,-624.0,-6451,-0.2,2.2942947687522053,multitrade,Jordan McLaughlin
2025-02-03 00:00:00,lost Kevin Huerter to CHI,1319.4,-5132,-0.0,2.2942947687522053,multitrade,Kevin Huerter
2025-02-03 00:00:00,added Zach LaVine to SAC,-661.8,-5794,0.4,2.694294768752205,multitrade,Zach LaVine
2025-02-03 00:00:00,added future 2nd round pick to SAC,-4804.122751165062,-10598,-0.4914597019452627,2.2028350668069425,multitrade,future 2nd round pick
2025-02-03 00:00:00,added Sidy Cissoko to SAC,0.0,-10598,0.0,2.2028350668069425,multitrade,Sidy Cissoko
2025-02-03 00:00:00,added future 1st round pick to SAC,1729.649868182676,-8868,6.080084337083584,8.282919403890526,multitrade,future 1st round pick
2025-02-03 00:00:00,added future 2nd round pick to SAC,-4804.122751165062,-13672,-0.4914597019452627,7.791459701945263,multitrade,future 2nd round pick
2025-02-03 00:00:00,added future 1st round pick to SAC,1729.649868182676,-11943,6.080084337083584,13.871544039028848,multitrade,future 1st round pick
2025-02-03 00:00:00,added future 2nd round pick to SAC,-4804.122751165062,-16747,-0.4914597019452627,13.380084337083584,multitrade,future 2nd round pick
2025-02-03 00:00:00,added future 1st round pick to SAC,1729.649868182676,-15017,6.080084337083584,19.460168674167168,multitrade,future 1st round pick
2025-02-05 00:00:00,lost Sidy Cissoko to WAS,-0.0,-15017,-0.0,19.460168674167168,trade,Sidy Cissoko
2025-02-05 00:00:00,added Jonas Valanciunas to SAC,204.0,-14813,0.3,19.76016867416717,trade,Jonas Valanciunas
2025-02-05 00:00:00,lost future 2nd round pick to WAS,4804.122751165062,-10009,0.4914597019452627,20.251628376112432,trade,future 2nd round pick
2025-02-05 00:00:00,lost future 2nd round pick to WAS,4804.122751165062,-5205,0.4914597019452627,20.743088078057696,trade,future 2nd round pick
2025-02-06 00:00:00,lost Colby Jones to WAS,466.5,-4738,-0.0,20.743088078057696,multitrade,Colby Jones
2025-02-06 00:00:00,lost Alex Len to WAS,-0.0,-4738,-0.0,20.743088078057696,multitrade,Alex Len
2025-02-06 00:00:00,added Jake LaRavia to SAC,-1027.6,-5766,-0.1,20.64308807805769,multitrade,Jake LaRavia
2025-02-08 00:00:00,added Daishen Nix to SAC,0.0,-5766,0.0,20.64308807805769,signing,Daishen Nix
2025-02-12 00:00:00,added Markelle Fultz to SAC,-928.8,-6695,-0.1,20.543088078057693,signing,Markelle Fultz
2025-03-03 00:00:00,added Skal Labissiere to SAC,24.0,-6671,0.0,20.543088078057693,signing,Skal Labissiere
2025-03-18 00:00:00,added Terry Taylor to SAC,19.200000000000003,-6652,0.0,20.543088078057693,signing,Terry Taylor
2025-04-09 00:00:00,added Terence Davis to SAC,0.0,-6652,0.0,20.543088078057693,signing,Terence Davis
