date,Transaction,single_value,value
2007-06-14,lost Juwan Howard to MIN,0,0
2007-06-14,added Mike James to HOU,-1557,-1557
2007-06-14,added Justin Reed to HOU,0,-1557
2007-06-28,added Brad Newley to HOU,0,-1557
2007-06-28,added Aaron Brooks to HOU,-3640,-5197
2007-06-28,added Brad Newley to HOU,0,-5197
2007-06-28,lost Sasha Kaun to SEA,0,-5197
2007-06-28,added Carl Landry to HOU,4781,-415
2007-07-12,lost Vassilis Spanoulis to SAS,0,-415
2007-07-12,lost Nando De Colo to SAS,1073,658
2007-07-12,added Jackie Butler to HOU,0,658
2007-07-12,added Luis Scola to HOU,-4449,-3790
2007-07-13,added Mike Harris to HOU,0,-3790
2007-07-20,added Steve Francis to HOU,-398,-4188
2008-02-21,lost Kirk Snyder to MIN,1428,-2760
2008-02-21,lost Paulão Prestes to MIN,0,-2760
2008-02-21,added Gerald Green to HOU,163,-2597
2008-02-21,lost Mike James to NOH,1596,-1000
2008-02-21,lost Bonzi Wells to NOH,175,-825
2008-02-21,added Sergei Lishouk to HOU,0,-825
2008-02-21,added Bobby Jackson to HOU,348,-476
2008-02-21,added Maarty Leunen to HOU,0,-476
2008-02-26,added Bobby Jones to HOU,-98,-574
2008-03-07,added Justin Williams to HOU,-191,-766
2008-03-08,added Mike Harris to HOU,47,-718
2008-03-21,added Loren Woods to HOU,18,-699
2008-06-26,added Nicolas Batum to HOU,0,-699
2008-06-26,added Maarty Leunen to HOU,0,-699
2008-06-26,lost Nicolas Batum to POR,-35775,-36475
2008-06-26,added Donté Greene to HOU,0,-36475
2008-06-26,added Sam Young to HOU,0,-36475
2008-06-26,added Joey Dorsey to HOU,-2867,-39342
2008-07-10,added Brent Barry to HOU,85,-39256
2008-08-06,lost Steve Novak to LAC,1803,-37452
2008-08-14,lost Donté Greene to SAC,11882,-25570
2008-08-14,lost Bobby Jackson to SAC,2671,-22899
2008-08-14,lost Omri Casspi to SAC,5122,-17777
2008-08-14,added Metta World Peace to HOU,4658,-13118
2008-08-14,added Patrick Ewing to HOU,0,-13118
2008-08-14,added Sean Singletary to HOU,0,-13118
2008-08-25,lost Sean Singletary to PHO,463,-12654
2008-08-25,added D.J. Strawberry to HOU,0,-12654
2008-08-29,lost Patrick Ewing to NYK,0,-12654
2008-09-29,added Von Wafer to HOU,245,-12409
2008-12-23,lost Steve Francis to MEM,0,-12409
2008-12-23,lost Sam Young to MEM,5946,-6463
2009-02-19,lost Rafer Alston to ORL,-1712,-8175
2009-02-19,added Kyle Lowry to HOU,13671,5496
2009-02-19,added Brian Cook to HOU,-712,4783
2009-03-03,added James White to HOU,26,4810
2009-06-25,added Jermaine Taylor to HOU,-1320,3490
2009-06-25,lost Kim English to DET,1709,5199
2009-06-25,added Chase Budinger to HOU,1954,7153
2009-06-25,added Sergio Llull to HOU,0,7153
2009-07-08,added Trevor Ariza to HOU,9749,16902
2009-08-12,added David Andersen to HOU,-2316,14586
2009-09-03,added Pops Mensah-Bonsu to HOU,11,14597
2009-09-22,lost James White to DEN,0,14597
2009-09-22,added Axel Hervelle to HOU,0,14597
2009-09-30,added Will Conroy to HOU,0,14597
2009-09-30,added Garrett Temple to HOU,0,14597
2009-12-23,added Mike Harris to HOU,0,14597
2010-01-28,added Will Conroy to HOU,0,14597
2010-02-08,added Garrett Temple to HOU,-649,13948
2010-02-18,lost Joey Dorsey to SAC,332,14281
2010-02-18,lost Carl Landry to SAC,6837,21119
2010-02-18,lost Tracy McGrady to NYK,1442,22561
2010-02-18,added Jordan Hill to HOU,-6498,16063
2010-02-18,added Jared Jeffries to HOU,-1752,14310
2010-02-18,added Royce White to HOU,0,14310
2010-02-18,added Hilton Armstrong to HOU,-504,13806
2010-02-18,added Kevin Martin to HOU,9204,23011
2010-03-02,added Will Conroy to HOU,-486,22525
2010-03-24,added Mike Harris to HOU,-721,21803
2010-06-24,added Patrick Patterson to HOU,-3796,18007
2010-07-20,added Brad Miller to HOU,2842,20849
2010-07-28,lost David Andersen to TOR,75,20924
2010-08-11,lost Trevor Ariza to NOH,-715,20209
2010-08-11,added Courtney Lee to HOU,-1895,18314
2010-08-23,added Ish Smith to HOU,-1250,17063
2010-09-24,added Antonio Anderson to HOU,0,17063
2010-12-15,lost Shane Larkin to NJN,3502,20565
2010-12-15,lost Sergei Lishouk to LAL,0,20565
2010-12-15,added Terrence Williams to HOU,-1561,19004
2010-12-15,lost Jermaine Taylor to SAC,1583,20587
2011-02-24,lost Aaron Brooks to PHO,520,21108
2011-02-24,added Goran Dragić to HOU,4727,25835
2011-02-24,added Nikola Mirotić to HOU,0,25835
2011-02-24,lost Shane Battier to MEM,55,25891
2011-02-24,lost Ish Smith to MEM,960,26851
2011-02-24,added DeMarre Carroll to HOU,-118,26732
2011-02-24,added Hasheem Thabeet to HOU,-15,26717
2011-02-24,added Andre Roberson to HOU,0,26717
2011-03-23,added Mike Harris to HOU,-38,26679
2011-04-11,added Marcus Cousin to HOU,0,26679
2011-06-23,added Marcus Morris to HOU,-2556,24122
2011-06-23,added Nikola Mirotić to HOU,0,24122
2011-06-23,added Chandler Parsons to HOU,11690,35812
2011-06-23,lost Brad Miller to MIN,146,35958
2011-06-23,lost Nikola Mirotić to MIN,0,35958
2011-06-23,lost Chandler Parsons to MIN,0,35958
2011-06-23,lost Andre Roberson to MIN,0,35958
2011-06-23,added Jonny Flynn to HOU,-796,35162
2011-06-23,added Donatas Motiejūnas to HOU,-8980,26181
2011-06-23,added Will Barton to HOU,0,26181
2011-06-23,added Chandler Parsons to HOU,11690,37872
2011-12-12,added Jeremy Lin to HOU,0,37872
2011-12-20,added Jeff Adrien to HOU,-270,37601
2011-12-24,added Samuel Dalembert to HOU,144,37745
2012-02-08,added Greg Smith to HOU,-971,36774
2012-03-15,lost Jordan Hill to LAL,5802,42576
2012-03-15,added Derek Fisher to HOU,0,42576
2012-03-15,added Mitch McGary to HOU,0,42576
2012-03-15,lost Jonny Flynn to POR,1180,43757
2012-03-15,lost Hasheem Thabeet to POR,603,44360
2012-03-15,lost Will Barton to POR,5605,49965
2012-03-15,added Marcus Camby to HOU,1603,51568
2012-03-18,added Courtney Fortson to HOU,-235,51333
2012-03-26,added Earl Boykins to HOU,-444,50889
2012-04-12,added Diamon Simpson to HOU,0,50889
2012-06-26,lost Chase Budinger to MIN,4903,55793
2012-06-26,lost Lior Eliyahu to MIN,0,55793
2012-06-26,added Terrence Jones to HOU,0,55793
2012-06-27,lost Samuel Dalembert to MIL,459,56252
2012-06-27,lost John Henson to MIL,4382,60634
2012-06-27,lost Nemanja Dangubić to MIL,0,60634
2012-06-27,added Jon Brockman to HOU,0,60634
2012-06-27,added Jon Leuer to HOU,0,60634
2012-06-27,added Shaun Livingston to HOU,0,60634
2012-06-27,added Jeremy Lamb to HOU,0,60634
2012-06-28,added Jeremy Lamb to HOU,0,60634
2012-06-28,added Royce White to HOU,0,60634
2012-06-28,added Terrence Jones to HOU,3915,64549
2012-06-29,added Furkan Aldemir to HOU,0,64549
2012-07-11,lost Kyle Lowry to TOR,-84192,-19643
2012-07-11,added Gary Forbes to HOU,0,-19643
2012-07-11,added Steven Adams to HOU,0,-19643
2012-07-11,lost Marcus Camby to NYK,900,-18743
2012-07-11,added Toney Douglas to HOU,-1369,-20112
2012-07-11,added Josh Harrellson to HOU,0,-20112
2012-07-11,added Jerome Jordan to HOU,0,-20112
2012-07-11,added Nick Johnson to HOU,0,-20112
2012-07-11,added Montrezl Harrell to HOU,0,-20112
2012-07-17,added Jeremy Lin to HOU,381,-19731
2012-07-20,lost Courtney Lee to BOS,164,-19567
2012-07-20,added JaJuan Johnson to HOU,0,-19567
2012-07-20,added E'Twaun Moore to HOU,0,-19567
2012-07-20,added Sean Williams to HOU,0,-19567
2012-07-20,added Álex Abrines to HOU,0,-19567
2012-07-20,added Jon Diebler to HOU,0,-19567
2012-07-24,added Ömer Aşık to HOU,-5394,-24961
2012-08-20,added Carlos Delfino to HOU,2364,-22597
2012-09-18,added Scott Machado to HOU,-184,-22782
2012-10-27,lost Jeremy Lamb to OKC,-372,-23154
2012-10-27,lost Kevin Martin to OKC,-2136,-25290
2012-10-27,lost Steven Adams to OKC,-5532,-30823
2012-10-27,lost Álex Abrines to OKC,5329,-25494
2012-10-27,lost Mitch McGary to OKC,1447,-24047
2012-10-27,added Cole Aldrich to HOU,-1065,-25112
2012-10-27,added Daequan Cook to HOU,-264,-25376
2012-10-27,added James Harden to HOU,79125,53748
2012-10-27,added Lazar Hayward to HOU,0,53748
2013-01-02,added James Anderson to HOU,368,54117
2013-01-07,added Patrick Beverley to HOU,3932,58049
2013-02-20,lost Cole Aldrich to SAC,87,58137
2013-02-20,lost Toney Douglas to SAC,-676,57460
2013-02-20,lost Patrick Patterson to SAC,1744,59205
2013-02-20,added Francisco García to HOU,-374,58831
2013-02-20,added Tyler Honeycutt to HOU,0,58831
2013-02-20,added Thomas Robinson to HOU,-1037,57793
2013-02-21,lost Marcus Morris to PHO,523,58317
2013-02-21,added Isaiah Canaan to HOU,0,58317
2013-02-25,added Tim Ohlbrecht to HOU,-206,58110
2013-03-05,added Aaron Brooks to HOU,-152,57958
2013-06-27,added Isaiah Canaan to HOU,0,57958
2013-07-10,lost Thomas Robinson to POR,4083,62042
2013-07-10,added Kostas Papanikolaou to HOU,0,62042
2013-07-10,added Marko Todorović to HOU,0,62042
2013-07-10,added Richaun Holmes to HOU,0,62042
2013-07-10,added Dillon Brooks to HOU,0,62042
2013-07-13,added Dwight Howard to HOU,4051,66094
2013-07-13,lost Furkan Aldemir to PHI,1944,68038
2013-07-13,lost Royce White to PHI,0,68038
2013-07-13,added Robert Covington to HOU,23,68062
2013-07-15,added Isaiah Canaan to HOU,-1223,66838
2013-07-16,added Omri Casspi to HOU,-384,66453
2013-07-19,added Reggie Williams to HOU,0,66453
2013-07-19,added Aaron Brooks to HOU,-286,66167
2013-07-29,added Marcus Camby to HOU,0,66167
2013-08-28,added Ronnie Brewer to HOU,-363,65804
2014-02-20,lost Aaron Brooks to DEN,1261,67065
2014-02-20,added Jordan Hamilton to HOU,-349,66716
2014-04-10,added Dexter Pittman to HOU,0,66716
2014-04-16,added Josh Powell to HOU,-216,66500
2014-06-26,added Clint Capela to HOU,0,66500
2014-06-26,added Nick Johnson to HOU,0,66500
2014-06-26,added Alessandro Gentile to HOU,0,66500
2014-07-14,added Troy Daniels to HOU,-691,65808
2014-07-15,lost Ömer Aşık to NOP,9485,75294
2014-07-15,lost Omri Casspi to NOP,127,75421
2014-07-15,added Alonzo Gee to HOU,0,75421
2014-07-15,added Scotty Hopson to HOU,0,75421
2014-07-15,added Sam Dekker to HOU,0,75421
2014-07-15,added Trevor Ariza to HOU,8434,83856
2014-07-15,lost Jeremy Lin to LAL,762,84618
2014-07-15,lost Larry Nance Jr. to LAL,-1179,83439
2014-07-15,added Sergei Lishouk to HOU,0,83439
2014-07-18,added Ish Smith to HOU,0,83439
2014-07-19,added Jeff Adrien to HOU,0,83439
2014-07-19,added Joey Dorsey to HOU,-2647,80792
2014-07-25,added Clint Capela to HOU,7702,88494
2014-07-25,added Nick Johnson to HOU,-1703,86791
2014-08-27,added Tarik Black to HOU,-1532,85259
2014-09-17,lost Alonzo Gee to SAC,0,85259
2014-09-17,lost Scotty Hopson to SAC,0,85259
2014-09-17,added Jason Terry to HOU,820,86079
2014-09-17,added Rakeem Christmas to HOU,0,86079
2014-09-17,added Chinanu Onuaku to HOU,0,86079
2014-09-23,added Kostas Papanikolaou to HOU,-1590,84489
2014-09-26,added Akil Mitchell to HOU,0,84489
2014-10-23,added Geron Johnson to HOU,0,84489
2014-12-19,lost Sergei Lishouk to PHI,0,84489
2014-12-19,lost J.P. Tokoto to PHI,0,84489
2014-12-19,lost Troy Daniels to MIN,893,85382
2014-12-19,lost Rakeem Christmas to MIN,0,85382
2014-12-19,added Corey Brewer to HOU,-1547,83835
2014-12-19,added Alexey Shved to HOU,-395,83439
2014-12-26,added Josh Smith to HOU,280,83720
2015-02-19,lost Alexey Shved to NYK,-1861,81859
2015-02-19,lost Ognjen Jaramaz to NYK,0,81859
2015-02-19,lost Kyle Guy to NYK,0,81859
2015-02-19,added Pablo Prigioni to HOU,-80,81779
2015-02-19,lost Isaiah Canaan to PHI,5344,87123
2015-02-19,lost Richaun Holmes to PHI,-960,86162
2015-02-19,added K.J. McDaniels to HOU,-303,85859
2015-06-25,added Sam Dekker to HOU,0,85859
2015-06-25,added Montrezl Harrell to HOU,0,85859
2015-07-09,added Patrick Beverley to HOU,2672,88531
2015-07-14,added Corey Brewer to HOU,-7978,80552
2015-07-20,lost Joey Dorsey to DEN,0,80552
2015-07-20,lost Nick Johnson to DEN,0,80552
2015-07-20,lost Kostas Papanikolaou to DEN,1323,81875
2015-07-20,lost Pablo Prigioni to DEN,0,81875
2015-07-20,lost Juan Hernangómez to DEN,4686,86562
2015-07-20,added Ty Lawson to HOU,-4821,81740
2015-07-20,added Isaiah Hartenstein to HOU,0,81740
2015-07-20,added Sam Dekker to HOU,-270,81470
2015-07-20,added K.J. McDaniels to HOU,-1531,79938
2015-07-25,added Marcus Thornton to HOU,-708,79230
2015-08-24,added Jason Terry to HOU,-2012,77218
2015-09-02,added Remi Yusuf to HOU,0,77218
2015-09-03,added Will Cummings to HOU,0,77218
2015-09-03,added Denzel Livingston to HOU,0,77218
2015-09-09,added Chris Walker to HOU,0,77218
2015-09-17,added Montrezl Harrell to HOU,836,78054
2015-09-17,added Joshua Smith to HOU,0,78054
2015-09-25,added Jeremy Tyler to HOU,0,78054
2015-11-01,added Chuck Hayes to HOU,-194,77860
2016-01-22,lost Maarty Leunen to LAC,0,77860
2016-01-22,added Sergei Lishouk to HOU,0,77860
2016-01-22,added Josh Smith to HOU,-2483,75376
2016-03-04,added Michael Beasley to HOU,326,75703
2016-03-09,added Andrew Goudelock to HOU,-180,75523
2016-06-23,added Chinanu Onuaku to HOU,0,75523
2016-06-23,added Zhou Qi to HOU,0,75523
2016-07-09,added James Harden to HOU,107717,183240
2016-07-09,added Ryan Anderson to HOU,-713,182527
2016-07-09,added Eric Gordon to HOU,-2176,180351
2016-07-20,added Chinanu Onuaku to HOU,-401,179950
2016-07-20,added Nenê to HOU,958,180908
2016-07-29,added Pablo Prigioni to HOU,0,180908
2016-09-22,lost Michael Beasley to MIL,748,181656
2016-09-22,added Tyler Ennis to HOU,-1568,180088
2016-09-23,added Isaiah Taylor to HOU,0,180088
2016-09-23,added Gary Payton II to HOU,0,180088
2016-09-23,added Kyle Wiltjer to HOU,-237,179850
2016-09-23,added Bobby Brown to HOU,0,179850
2016-09-29,added P.J. Hairston to HOU,0,179850
2016-10-22,added Le'Bryan Nash to HOU,0,179850
2016-12-16,added Bobby Brown to HOU,-442,179408
2017-02-23,lost Tyler Ennis to LAL,1747,181156
2017-02-23,lost Brad Newley to LAL,0,181156
2017-02-23,added Marcelo Huertas to HOU,0,181156
2017-02-23,lost K.J. McDaniels to BRK,556,181712
2017-02-23,lost Corey Brewer to LAL,2509,184222
2017-02-23,lost Tony Bradley to LAL,0,184222
2017-02-23,added Lou Williams to HOU,-295,183926
2017-02-27,added Isaiah Taylor to HOU,-405,183521
2017-03-10,added Troy Williams to HOU,0,183521
2017-03-20,added Troy Williams to HOU,-264,183257
2017-06-22,added Isaiah Hartenstein to HOU,0,183257
2017-06-22,added Dillon Brooks to HOU,0,183257
2017-06-22,lost Dillon Brooks to MEM,37754,221011
2017-06-22,added De'Anthony Melton to HOU,0,221011
2017-06-28,added Darrun Hilliard to HOU,0,221011
2017-06-28,added Ryan Kelly to HOU,0,221011
2017-06-28,added Tim Quarterman to HOU,0,221011
2017-06-28,added DeAndre Liggins to HOU,0,221011
2017-06-28,lost Patrick Beverley to LAC,-5625,215386
2017-06-28,lost Sam Dekker to LAC,2560,217947
2017-06-28,lost Montrezl Harrell to LAC,-16460,201486
2017-06-28,lost Darrun Hilliard to LAC,0,201486
2017-06-28,lost DeAndre Liggins to LAC,0,201486
2017-06-28,lost Lou Williams to LAC,-10267,191219
2017-06-28,lost Kyle Wiltjer to LAC,0,191219
2017-06-28,lost Omari Spellman to LAC,0,191219
2017-06-28,added Chris Paul to HOU,13113,204333
2017-06-28,added Shawn Long to HOU,0,204333
2017-06-29,added Jarrod Uthoff to HOU,0,204333
2017-07-06,added Nenê to HOU,-1959,202374
2017-07-06,added P.J. Tucker to HOU,-13289,189085
2017-07-06,added Zhou Qi to HOU,-1200,187884
2017-07-08,added Cameron Oliver to HOU,-174,187710
2017-07-17,added Tarik Black to HOU,-1393,186317
2017-07-19,added Luc Mbah a Moute to HOU,-497,185819
2017-07-25,added Troy Williams to HOU,-266,185552
2017-08-21,added Demetrius Jackson to HOU,0,185552
2017-09-22,added Chris Johnson to HOU,0,185552
2017-09-25,added Bobby Brown to HOU,0,185552
2017-09-27,added George de Paula to HOU,0,185552
2017-10-13,added Danuel House to HOU,0,185552
2017-10-24,added Briante Weber to HOU,177,185729
2017-10-24,added Isaiah Canaan to HOU,-67,185662
2017-12-28,added Gerald Green to HOU,278,185940
2018-01-06,added Demetrius Jackson to HOU,-535,185405
2018-01-15,added R.J. Hunter to HOU,-148,185256
2018-01-15,added Markel Brown to HOU,-334,184921
2018-02-09,added Bobby Brown to HOU,-828,184093
2018-02-12,added Brandan Wright to HOU,-18,184075
2018-02-14,added Joe Johnson to HOU,-1666,182409
2018-03-24,added Le'Bryan Nash to HOU,0,182409
2018-03-30,added Tim Quarterman to HOU,-126,182283
2018-04-11,added Aaron Jackson to HOU,-311,181971
2018-06-21,added De'Anthony Melton to HOU,0,181971
2018-06-22,added Vince Edwards to HOU,0,181971
2018-07-06,added Michael Carter-Williams to HOU,-232,181739
2018-07-06,added Gary Clark to HOU,0,181739
2018-07-06,added Vince Edwards to HOU,0,181739
2018-07-07,added Chris Paul to HOU,7242,188982
2018-07-09,added Gerald Green to HOU,-2504,186478
2018-07-13,added James Ennis to HOU,-854,185623
2018-07-25,added Isaiah Hartenstein to HOU,-782,184841
2018-07-27,added Clint Capela to HOU,8537,193379
2018-08-02,lost Chinanu Onuaku to DAL,0,193379
2018-08-02,added Maarty Leunen to HOU,0,193379
2018-08-10,added Rob Gray to HOU,0,193379
2018-08-13,added Carmelo Anthony to HOU,-793,192585
2018-08-31,lost Ryan Anderson to PHO,1751,194337
2018-08-31,lost De'Anthony Melton to PHO,2656,196993
2018-08-31,added Marquese Chriss to HOU,-1164,195829
2018-08-31,added Brandon Knight to HOU,-1463,194365
2018-10-01,added Alessandro Gentile to HOU,0,194365
2018-10-12,added Tim Bond to HOU,0,194365
2018-10-15,added Vince Edwards to HOU,-102,194263
2018-10-15,added Gary Clark to HOU,-575,193687
2018-11-26,added Danuel House to HOU,0,193687
2018-12-06,added Danuel House to HOU,-489,193198
2018-12-24,added Austin Rivers to HOU,-5111,188087
2019-01-07,lost Michael Carter-Williams to CHI,0,188087
2019-01-16,added James Nunnally to HOU,-494,187593
2019-01-21,added Kenneth Faried to HOU,-244,187349
2019-01-22,lost Carmelo Anthony to CHI,0,187349
2019-01-22,lost Jon Diebler to CHI,0,187349
2019-01-22,added Tadija Dragićević to HOU,0,187349
2019-02-07,lost Kenyon Martin Jr. to SAC,0,187349
2019-02-07,lost Marquese Chriss to CLE,2607,189956
2019-02-07,lost Brandon Knight to CLE,4100,194056
2019-02-07,lost Dylan Windler to CLE,1585,195641
2019-02-07,lost Andrew Nembhard to CLE,0,195641
2019-02-07,added Wade Baldwin to HOU,0,195641
2019-02-07,added Nik Stauskas to HOU,0,195641
2019-02-07,added Sandro Mamukelashvili to HOU,0,195641
2019-02-07,added Iman Shumpert to HOU,-1413,194228
2019-02-07,lost James Ennis to PHI,2203,196432
2019-02-07,added future 2nd round pick to HOU,0,196432
2019-02-07,lost Wade Baldwin to IND,0,196432
2019-02-07,lost Maarty Leunen to IND,0,196432
2019-02-07,lost Nik Stauskas to IND,0,196432
2019-02-07,lost Sandro Mamukelashvili to IND,0,196432
2019-02-22,added Chris Chiozza to HOU,0,196432
2019-02-22,added Terrence Jones to HOU,-155,196276
2019-03-23,added Chris Chiozza to HOU,-42,196233
2019-04-07,added Michael Frazier to HOU,0,196233
2019-07-16,lost Chris Paul to OKC,-9715,186518
2019-07-16,added Russell Westbrook to HOU,3073,189591
2019-07-16,added Danuel House to HOU,-5905,183686
2019-07-16,added Austin Rivers to HOU,-3985,179700
2019-07-18,added Tyson Chandler to HOU,-328,179372
2019-07-22,added Gerald Green to HOU,0,179372
2019-07-23,added Ben McLemore to HOU,-3226,176146
2019-07-25,added Anthony Bennett to HOU,0,176146
2019-09-04,added Shamorie Ponds to HOU,0,176146
2019-09-04,added William McDowell-White to HOU,0,176146
2019-09-04,added Eric Gordon to HOU,-12358,163788
2019-09-06,added Nenê to HOU,0,163788
2019-09-23,added Thabo Sefolosha to HOU,-523,163265
2019-09-27,added Ryan Anderson to HOU,-39,163225
2019-09-27,added Jaron Blossomgame to HOU,0,163225
2019-10-20,added Michael Frazier to HOU,-1595,161630
2019-10-21,added Chris Clemons to HOU,-291,161339
2019-10-21,added Ronshad Shabazz to HOU,0,161339
2019-12-27,added William Howard to HOU,-254,161085
2020-02-05,lost Gerald Green to DEN,0,161085
2020-02-05,lost Zeke Nnaji to DEN,4904,165989
2020-02-05,lost Clint Capela to ATL,-13014,152974
2020-02-05,lost Nene to ATL,0,152974
2020-02-05,added Jordan Bell to HOU,0,152974
2020-02-05,added Robert Covington to HOU,145,153119
2020-02-06,lost Jordan Bell to MEM,33,153153
2020-02-06,added Bruno Caboclo to HOU,-356,152796
2020-02-18,added Jeff Green to HOU,0,152796
2020-02-20,added DeMarre Carroll to HOU,-170,152626
2020-02-28,added Jeff Green to HOU,1058,153684
2020-06-23,added David Nwaba to HOU,-908,152775
2020-11-18,,0,152775
2020-11-18,added Tyrese Maxey to PHI,0,152775
2020-11-18,added Théo Maledon to PHI,0,152775
2020-11-18,added Tyler Bey to PHI,0,152775
2020-11-18,added Isaiah Joe to PHI,0,152775
2020-11-18,added Paul Reed to PHI,0,152775
2020-11-18,lost Tyler Bey to DAL,674,153450
2020-11-18,lost Josh Richardson to DAL,3043,156493
2020-11-18,added Seth Curry to PHI,-2057,154435
2020-11-19,added Dakota Mathias to PHI,-319,154116
2020-11-21,added Dwight Howard to PHI,-1794,152322
2020-11-23,lost Zhaire Smith to DET,0,152322
2020-11-23,added Tony Bradley to PHI,947,153269
2020-11-27,added Justin Anderson to PHI,0,153269
2020-11-27,added Isaiah Joe to PHI,-3950,149318
2020-11-27,added Paul Reed to PHI,0,149318
2020-11-27,added Ryan Broekhoff to PHI,0,149318
2020-11-27,added Derrick Walton Jr. to PHI,0,149318
2020-12-02,added Tyrese Maxey to PHI,1397,150715
2020-12-08,lost Al Horford to OKC,-2658,148057
2020-12-08,lost Théo Maledon to OKC,12885,160942
2020-12-08,lost Vasilije Micić to OKC,0,160942
2020-12-08,added Terrance Ferguson to PHI,-700,160241
2020-12-08,added Danny Green to PHI,3674,163916
2020-12-08,added Vincent Poirier to PHI,-577,163339
2021-01-22,added Rayjon Tucker to PHI,-231,163107
2021-03-25,lost Tony Bradley to OKC,79,163187
2021-03-25,lost Terrance Ferguson to NYK,0,163187
2021-03-25,lost Vincent Poirier to NYK,0,163187
2021-03-25,lost Emir Preldžić to NYK,0,163187
2021-03-25,lost Jericho Sims to NYK,1349,164536
2021-03-25,added Ignas Brazdeikis to PHI,-171,164365
2021-03-25,added George Hill to PHI,-1181,163183
2021-03-26,added Mason Jones to PHI,129,163313
2021-03-26,added Paul Reed to PHI,381,163695
2021-04-12,added Anthony Tolliver to PHI,-693,163002
2021-05-02,added Anthony Tolliver to PHI,0,163002
2021-05-11,added Gary Clark to PHI,0,163002
2021-07-29,added Jaden Springer to PHI,0,163002
2021-07-29,added Filip Petrušev to PHI,0,163002
2021-07-29,added Charles Bassey to PHI,0,163002
2021-08-03,added Rayjon Tucker to PHI,0,163002
2021-08-04,added Andre Drummond to PHI,1172,164174
2021-08-04,added Jaden Springer to PHI,129,164304
2021-08-06,added Georges Niang to PHI,-5415,158888
2021-08-07,added Danny Green to PHI,-676,158212
2021-08-08,added Aaron Henry to PHI,-280,157931
2021-08-09,added Furkan Korkmaz to PHI,-5936,151995
2021-08-30,added Grant Riller to PHI,0,151995
2021-09-24,added Charles Bassey to PHI,285,152280
2021-09-27,added Shaquille Harrison to PHI,0,152280
2021-10-12,added Braxton Key to PHI,0,152280
2021-10-12,added Jared Brownridge to PHI,0,152280
2021-12-19,added Myles Powell to PHI,-660,151620
2021-12-22,added Tyler Johnson to PHI,-76,151544
2022-01-03,added Charlie Brown to PHI,0,151544
2022-01-05,added Braxton Key to PHI,-37,151507
2022-01-11,added Charlie Brown to PHI,-810,150697
2022-02-10,lost Seth Curry to BRK,2144,152841
2022-02-10,lost Andre Drummond to BRK,-642,152199
2022-02-10,lost Ben Simmons to BRK,-442,151757
2022-02-10,lost Brice Sensabaugh to BRK,0,151757
2022-02-10,added James Harden to PHI,3009,154767
2022-02-10,added Paul Millsap to PHI,-477,154290
2022-02-10,lost future 1st round pick to BRK,0,154290
2022-02-24,added Willie Cauley-Stein to PHI,7,154297
2022-03-03,added DeAndre Jordan to PHI,-620,153677
2022-06-23,added David Roddy to PHI,0,153677
2022-06-24,lost Danny Green to MEM,378,154055
2022-06-24,lost David Roddy to MEM,4906,158961
2022-06-24,added De'Anthony Melton to PHI,1935,160896
2022-07-01,added Trevelin Queen to PHI,0,160896
2022-07-02,added Julian Champagnie to PHI,-94,160802
2022-07-06,added P.J. Tucker to PHI,-5760,155042
2022-07-06,added Danuel House to PHI,-2421,152621
2022-07-27,added James Harden to PHI,11529,164150
2022-09-13,added Montrezl Harrell to PHI,-885,163265
2022-10-08,added Mac McClung to PHI,0,163265
2022-10-10,added Patrick McCaw to PHI,0,163265
2022-10-10,added Skylar Mays to PHI,0,163265
2022-10-10,added Justin Smith to PHI,0,163265
2022-10-12,added Aminu Mohammed to PHI,0,163265
2022-10-15,added Sekou Doumbouya to PHI,0,163265
2022-10-16,added Michael Foster Jr. to PHI,-9,163255
2022-11-23,added Saben Lee to PHI,-43,163212
2022-12-26,added Louis King to PHI,66,163279
2023-02-09,lost Matisse Thybulle to POR,730,164010
2023-02-09,lost Colby Jones to CHO,0,164010
2023-02-09,added Jalen McDaniels to PHI,-1089,162920
2023-02-09,added future 2nd round pick to PHI,0,162920
2023-02-09,added future 2nd round pick to PHI,0,162920
2023-02-14,added Mac McClung to PHI,20,162941
2023-02-14,added Dewayne Dedmon to PHI,-53,162888
2023-07-01,added Ricky Council IV to PHI,0,162888
2023-07-01,added Terquavion Smith to PHI,0,162888
2023-07-09,added Mo Bamba to PHI,0,162888
2023-07-09,added Pat Beverley to PHI,0,162888
2023-07-10,added Paul Reed to PHI,0,162888
2023-07-16,added Azuolas Tubelis to PHI,0,162888
2023-07-16,added Filip Petrusev to PHI,0,162888
2023-07-17,added Montrezl Harrell to PHI,0,162888
2023-09-13,added Danny Green to PHI,0,162888
2023-09-26,added Kelly Oubre Jr. to PHI,0,162888
2023-10-21,added Javonte Smart to PHI,0,162888
2023-10-25,added Ricky Council IV to PHI,0,162888
2023-11-01,lost James Harden to LAC,0,162888
2023-11-01,lost Filip Petrusev to LAC,0,162888
2023-11-01,lost P.J. Tucker to LAC,0,162888
2023-11-01,added Nicolas Batum to PHI,0,162888
2023-11-01,added Robert Covington to PHI,0,162888
2023-11-01,added KJ Martin to PHI,0,162888
2023-11-01,added Marcus Morris to PHI,0,162888
2023-11-01,added future 2nd round pick to PHI,0,162888
2023-11-01,added future 1st round pick to PHI,0,162888
2023-11-01,added future 1st round pick to PHI,0,162888
2023-11-01,added future 2nd round pick to PHI,0,162888
2023-11-01,added future 2nd round pick to PHI,0,162888
