date,Transaction,single_value_bpm,value_bpm,single_value_vorp,value_vorp
2004-06-24 00:00:00,added Andris Biedriņš to GSW,-3820.099999999999,-3820,4.6,4.6
2004-07-16 00:00:00,added Derek Fisher to GSW,-1408.6,-5228,2.1,6.699999999999999
2004-07-20 00:00:00,lost Nick Van Exel to POR,1619.0,-3609,-0.4,6.299999999999999
2004-07-20 00:00:00,added Dale Davis to GSW,-1788.7,-5398,-0.2,6.099999999999999
2004-07-20 00:00:00,added Dan Dickau to GSW,0.0,-5398,0.0,6.099999999999999
2004-08-24 00:00:00,lost Erick Dampier to DAL,2088.8,-3309,-4.9,1.1999999999999984
2004-08-24 00:00:00,lost Dan Dickau to DAL,251.2,-3058,0.1,1.2999999999999985
2004-08-24 00:00:00,lost Evan Eschmeyer to DAL,-0.0,-3058,-0.0,1.2999999999999985
2004-08-24 00:00:00,lost Steve Logan to DAL,-0.0,-3058,-0.0,1.2999999999999985
2004-08-24 00:00:00,added Luis Flores to GSW,-445.3,-3503,-0.1,1.1999999999999984
2004-08-24 00:00:00,added Christian Laettner to GSW,0.0,-3503,0.0,1.1999999999999984
2004-08-24 00:00:00,added Eduardo Nájera to GSW,-2074.0,-5577,-0.2,0.9999999999999984
2004-08-24 00:00:00,added Mladen Sekularac to GSW,0.0,-5577,0.0,0.9999999999999984
2004-08-24 00:00:00,added Petteri Koponen to GSW,0.0,-5577,0.0,0.9999999999999984
2004-10-04 00:00:00,added Ansu Sesay to GSW,12.8,-5564,0.1,1.0999999999999983
2004-10-04 00:00:00,added Brandon Armstrong to GSW,0.0,-5564,0.0,1.0999999999999983
2005-01-03 00:00:00,lost Aaron Gray to PHO,-0.0,-5564,-0.0,1.0999999999999983
2005-01-03 00:00:00,lost DeJuan Blair to PHO,-0.0,-5564,-0.0,1.0999999999999983
2005-01-03 00:00:00,added Žarko Čabarkapa to GSW,-2908.5,-8473,-0.2,0.8999999999999986
2005-02-14 00:00:00,lost Clifford Robinson to NJN,9192.3,718,0.5,1.3999999999999986
2005-02-14 00:00:00,added Chris Taft to GSW,0.0,718,0.0,1.3999999999999986
2005-02-14 00:00:00,added Stéphane Lasme to GSW,0.0,718,0.0,1.3999999999999986
2005-02-24 00:00:00,lost Speedy Claxton to NOH,146.0,864,-0.1,1.2999999999999985
2005-02-24 00:00:00,lost Dale Davis to NOH,-0.0,864,-0.0,1.2999999999999985
2005-02-24 00:00:00,added Baron Davis to GSW,27985.0,28849,11.3,12.6
2005-02-24 00:00:00,lost Luis Flores to DEN,-82.0,28767,-0.0,12.6
2005-02-24 00:00:00,lost Eduardo Nájera to DEN,3381.3,32149,-1.8,10.8
2005-02-24 00:00:00,lost Petteri Koponen to DEN,-0.0,32149,-0.0,10.8
2005-02-24 00:00:00,added Nikoloz Tskitishvili to GSW,-483.6,31665,-0.1,10.7
2005-02-24 00:00:00,added Rodney White to GSW,-1182.6,30483,-0.2,10.5
2005-06-28 00:00:00,added Ike Diogu to GSW,-2423.6000000000004,28059,0.1,10.6
2005-06-28 00:00:00,added Monta Ellis to GSW,-2832.3999999999987,25227,6.800000000000001,17.4
2005-06-28 00:00:00,added Chris Taft to GSW,-100.8,25126,0.0,17.4
2005-09-29 00:00:00,added Aaron Miles to GSW,-590.0,24536,-0.1,17.299999999999997
2006-01-02 00:00:00,added Dijon Thompson to GSW,0.0,24536,0.0,17.299999999999997
2006-03-17 00:00:00,added Will Bynum to GSW,0.0,24536,0.0,17.299999999999997
2006-04-17 00:00:00,added Will Bynum to GSW,-810.0,23726,-0.1,17.199999999999996
2006-06-28 00:00:00,added Patrick O'Bryant to GSW,-933.5,22792,-0.1,17.099999999999994
2006-06-28 00:00:00,added Kosta Perović to GSW,-224.2,22568,0.0,17.099999999999994
2006-07-12 00:00:00,lost Derek Fisher to UTA,3659.2,26227,-0.2,16.899999999999995
2006-07-12 00:00:00,added Devin Brown to GSW,0.0,26227,0.0,16.899999999999995
2006-07-12 00:00:00,added Keith McLeod to GSW,-682.2,25545,0.0,16.899999999999995
2006-07-12 00:00:00,added Andre Owens to GSW,0.0,25545,0.0,16.899999999999995
2006-09-22 00:00:00,added Dajuan Wagner to GSW,29.4,25574,0.0,16.899999999999995
2006-10-02 00:00:00,added Anthony Roberson to GSW,-522.0999999999999,25052,0.0,16.899999999999995
2006-10-20 00:00:00,added Matt Barnes to GSW,1061.9,26114,2.0,18.899999999999995
2007-01-02 00:00:00,added Kelenna Azubuike to GSW,-2690.1000000000004,23424,1.8,20.7
2007-01-16 00:00:00,lost Ike Diogu to IND,3450.8,26875,0.4,21.099999999999994
2007-01-16 00:00:00,lost Mike Dunleavy to IND,-5723.299999999999,21152,-5.5,15.599999999999994
2007-01-16 00:00:00,lost Keith McLeod to IND,1728.9,22881,0.3,15.899999999999997
2007-01-16 00:00:00,lost Troy Murphy to IND,-17385.7,5495,-8.5,7.399999999999995
2007-01-16 00:00:00,added Al Harrington to GSW,-350.29999999999995,5145,1.7999999999999998,9.199999999999996
2007-01-16 00:00:00,added Stephen Jackson to GSW,-2050.6,3094,2.9,12.099999999999996
2007-01-16 00:00:00,added Šarūnas Jasikevičius to GSW,-1112.4,1982,-0.1,11.999999999999996
2007-01-16 00:00:00,added Josh Powell to GSW,-1184.9,797,-0.2,11.799999999999995
2007-01-17 00:00:00,added Renaldo Major to GSW,-359.1,438,-0.1,11.699999999999998
2007-06-28 00:00:00,added Marco Belinelli to GSW,-3137.2,-2699,-0.3,11.399999999999997
2007-06-28 00:00:00,added Jermareo Davidson to GSW,-577.2,-3276,-0.1,11.299999999999995
2007-06-28 00:00:00,added Stéphane Lasme to GSW,0.0,-3276,0.0,11.299999999999995
2007-06-28 00:00:00,lost Jermareo Davidson to CHA,1674.4,-1601,0.3,11.599999999999998
2007-06-28 00:00:00,lost Jason Richardson to CHA,-10085.3,-11687,-4.4,7.1999999999999975
2007-06-28 00:00:00,added Brandan Wright to GSW,-374.1,-12061,0.6000000000000001,7.799999999999997
2007-08-03 00:00:00,added Austin Croshere to GSW,-502.7000000000001,-12564,0.1,7.899999999999997
2007-09-24 00:00:00,added Troy Hudson to GSW,-585.9,-13149,-0.1,7.799999999999997
2007-11-17 00:00:00,added D.J. Mbenga to GSW,-663.0,-13812,-0.1,7.699999999999997
2008-01-08 00:00:00,added C.J. Watson to GSW,-2687.1,-16500,1.2999999999999998,8.999999999999996
2008-01-26 00:00:00,added Chris Webber to GSW,-138.60000000000002,-16638,0.0,8.999999999999996
2008-06-26 00:00:00,added Anthony Randolph to GSW,-3046.1,-19684,0.1999999999999999,9.199999999999996
2008-06-26 00:00:00,added Richard Hendrix to GSW,0.0,-19684,0.0,9.199999999999996
2008-07-10 00:00:00,added Corey Maggette to GSW,-2551.7,-22236,1.2,10.399999999999997
2008-07-19 00:00:00,added Ronny Turiaf to GSW,2122.4,-20114,1.9,12.299999999999995
2008-07-22 00:00:00,lost Darius Morris to NJN,1913.6,-18200,0.3,12.599999999999996
2008-07-22 00:00:00,lost Gorgui Dieng to NJN,-0.0,-18200,-0.0,12.599999999999996
2008-07-22 00:00:00,added Marcus Williams to GSW,-442.8,-18643,-0.1,12.499999999999996
2008-08-04 00:00:00,added Anthony Morrow to GSW,-1110.2,-19753,1.5,13.999999999999996
2008-09-09 00:00:00,added DeMarcus Nelson to GSW,-940.5,-20693,-0.2,13.799999999999995
2008-10-01 00:00:00,added Dan Dickau to GSW,0.0,-20693,0.0,13.799999999999995
2008-11-02 00:00:00,added Rob Kurz to GSW,-1193.4,-21887,-0.1,13.699999999999998
2008-11-21 00:00:00,lost Al Harrington to NYK,1756.0,-20131,-1.7999999999999998,11.9
2008-11-21 00:00:00,added Jamal Crawford to GSW,-3339.2000000000003,-23470,0.2,12.099999999999998
2009-01-05 00:00:00,added Jermareo Davidson to GSW,-577.2,-24047,-0.1,11.999999999999998
