date,Transaction,single_value,value
2000-10-17 00:00:00,lost Dana Barros to DET,1836.9,80927
2000-10-17 00:00:00,lost Ansu Sesay to DET,-0.0,80927
2000-10-17 00:00:00,added Loy Vaught to DAL,-901.6,80025
2000-11-28 00:00:00,added Mark Bryant to DAL,-929.2,79096
2001-02-22 00:00:00,lost Courtney Alexander to WAS,5918.0,85014
2001-02-22 00:00:00,lost Hubert Davis to WAS,1760.6,86775
2001-02-22 00:00:00,lost Christian Laettner to WAS,-5935.7,80839
2001-02-22 00:00:00,lost Etan Thomas to WAS,13176.000000000002,94015
2001-02-22 00:00:00,lost Loy Vaught to WAS,188.4,94203
2001-02-22 00:00:00,added Calvin Booth to DAL,937.6,95141
2001-02-22 00:00:00,added Obinna Ekezie to DAL,-220.8,94920
2001-02-22 00:00:00,added Juwan Howard to DAL,-5770.6,89150
2001-02-28 00:00:00,added Vernon Maxwell to DAL,-1510.5,87639
2001-06-27 00:00:00,added Kyle Hill to DAL,0.0,87639
2001-06-27 00:00:00,added Kenny Satterfield to DAL,0.0,87639
2001-07-27 00:00:00,added Adrian Griffin to DAL,2382.0,90021
2001-08-02 00:00:00,added Danny Manning to DAL,-662.4,89359
2001-08-02 00:00:00,added Darrick Martin to DAL,-422.4,88936
2001-08-02 00:00:00,added Khalid El-Amin to DAL,0.0,88936
2001-08-10 00:00:00,lost Howard Eisley to NYK,1587.6,90524
2001-08-10 00:00:00,lost Kyle Hill to HOU,-0.0,90524
2001-08-10 00:00:00,added Muggsy Bogues to DAL,0.0,90524
2001-08-22 00:00:00,lost Matt Freije to MIA,-0.0,90524
2001-08-22 00:00:00,added Tim Hardaway to DAL,-765.6,89758
2001-08-25 00:00:00,added Evan Eschmeyer to DAL,-1495.9,88262
2001-09-25 00:00:00,lost Kenny Satterfield to DEN,3766.0,92028
2001-10-01 00:00:00,added Chris Robinson to DAL,0.0,92028
2001-10-01 00:00:00,added Rubén Wolkowyski to DAL,0.0,92028
2001-11-20 00:00:00,added Omar Cook to DAL,0.0,92028
2001-11-27 00:00:00,added Johnny Newman to DAL,-1882.4,90146
2002-01-13 00:00:00,added Charlie Bell to DAL,11.2,90157
2002-02-21 00:00:00,lost Tim Hardaway to DEN,32.5,90190
2002-02-21 00:00:00,lost Donnell Harvey to DEN,4957.6,95147
2002-02-21 00:00:00,lost Juwan Howard to DEN,-2446.0000000000005,92701
2002-02-21 00:00:00,lost Frank Williams to DEN,-0.0,92701
2002-02-21 00:00:00,added Tariq Abdul-Wahad to DAL,-436.8,92265
2002-02-21 00:00:00,added Avery Johnson to DAL,-1984.0,90281
2002-02-21 00:00:00,added Raef LaFrentz to DAL,1438.8,91719
2002-02-21 00:00:00,added Nick Van Exel to DAL,935.1,92655
2002-06-26 00:00:00,added Mladen Sekularac to DAL,0.0,92655
2002-09-20 00:00:00,added Popeye Jones to DAL,-1798.1999999999998,90856
2002-10-01 00:00:00,added Raja Bell to DAL,-2111.4,88745
2002-10-10 00:00:00,added Adam Harrington to DAL,-410.7,88334
2002-10-18 00:00:00,added Walt Williams to DAL,-116.1,88218
2002-11-17 00:00:00,added Mark Strickland to DAL,-49.4,88169
2003-01-17 00:00:00,added Antoine Rigaudeau to DAL,-1337.7,86831
2003-06-23 00:00:00,lost Xue Yuyang to DEN,-0.0,86831
2003-06-23 00:00:00,added Vassilis Spanoulis to DAL,0.0,86831
2003-06-26 00:00:00,added Josh Howard to DAL,14848.3,101679
2003-06-26 00:00:00,added Xue Yuyang to DAL,0.0,101679
2003-07-29 00:00:00,added Marquis Daniels to DAL,4119.9,105799
2003-08-18 00:00:00,lost Evan Eschmeyer to GSW,-0.0,105799
2003-08-18 00:00:00,lost Avery Johnson to GSW,1783.6,107583
2003-08-18 00:00:00,lost Popeye Jones to GSW,145.0,107728
2003-08-18 00:00:00,lost Antoine Rigaudeau to GSW,-0.0,107728
2003-08-18 00:00:00,lost Nick Van Exel to GSW,1757.0,109485
2003-08-18 00:00:00,added Danny Fortson to DAL,-2500.0,106985
2003-08-18 00:00:00,added Antawn Jamison to DAL,4039.2,111024
2003-08-18 00:00:00,added Chris Mills to DAL,0.0,111024
2003-08-18 00:00:00,added Jiří Welsch to DAL,0.0,111024
2003-08-22 00:00:00,added Travis Best to DAL,-2286.0,108738
2003-10-20 00:00:00,lost Raef LaFrentz to BOS,-3913.5,104825
2003-10-20 00:00:00,lost Chris Mills to BOS,-0.0,104825
2003-10-20 00:00:00,lost Jiří Welsch to BOS,3536.1000000000004,108361
2003-10-20 00:00:00,lost Delonte West to BOS,-6195.8,102165
2003-10-20 00:00:00,added Tony Delk to DAL,-152.7,102012
2003-10-20 00:00:00,added Antoine Walker to DAL,1420.0,103432
2004-01-06 00:00:00,added Mamadou N'Diaye to DAL,-120.4,103312
2004-01-30 00:00:00,added Scott Williams to DAL,-1482.0,101830
2004-06-24 00:00:00,added Vassilis Spanoulis to DAL,0.0,101830
2004-06-24 00:00:00,lost Linas Kleiza to UTA,-0.0,101830
2004-06-24 00:00:00,added Pavel Podkolzin to DAL,-421.4,101408
2004-06-24 00:00:00,lost Vassilis Spanoulis to HOU,1604.8000000000002,103013
2004-06-24 00:00:00,added Luis Flores to DAL,0.0,103013
2004-06-24 00:00:00,lost Antawn Jamison to WAS,-16739.5,86274
2004-06-24 00:00:00,added Devin Harris to DAL,6648.499999999998,92922
2004-06-24 00:00:00,added Christian Laettner to DAL,0.0,92922
2004-06-24 00:00:00,added Jerry Stackhouse to DAL,-3017.5,89905
2004-07-26 00:00:00,lost Danny Fortson to SEA,7683.0,97588
2004-07-26 00:00:00,added Calvin Booth to DAL,-445.4,97142
2004-08-04 00:00:00,lost Tony Delk to ATL,1355.4,98498
2004-08-04 00:00:00,lost Antoine Walker to ATL,638.4,99136
2004-08-04 00:00:00,added Alan Henderson to DAL,-1684.1999999999998,97452
2004-08-04 00:00:00,added Jason Terry to DAL,52677.1,150129
2004-08-24 00:00:00,lost Luis Flores to GSW,445.3,150574
2004-08-24 00:00:00,lost Christian Laettner to GSW,-0.0,150574
2004-08-24 00:00:00,lost Eduardo Nájera to GSW,2074.0,152648
2004-08-24 00:00:00,lost Mladen Sekularac to GSW,-0.0,152648
2004-08-24 00:00:00,lost Petteri Koponen to GSW,-0.0,152648
2004-08-24 00:00:00,added Erick Dampier to DAL,-2088.8,150559
2004-08-24 00:00:00,added Dan Dickau to DAL,-251.2,150308
2004-08-24 00:00:00,added Evan Eschmeyer to DAL,0.0,150308
2004-08-24 00:00:00,added Steve Logan to DAL,0.0,150308
2004-09-14 00:00:00,added D.J. Mbenga to DAL,-1465.3,148843
2004-09-30 00:00:00,added Avery Johnson to DAL,0.0,148843
2004-12-03 00:00:00,lost Dan Dickau to NOH,-207.4,148636
2004-12-03 00:00:00,lost Marcin Gortat to NOH,-0.0,148636
2004-12-03 00:00:00,added Darrell Armstrong to DAL,-2948.8,145687
2005-02-24 00:00:00,lost Calvin Booth to MIL,113.4,145800
2005-02-24 00:00:00,lost Alan Henderson to MIL,-0.0,145800
2005-02-24 00:00:00,added Keith Van Horn to DAL,-1239.6,144561
2005-03-01 00:00:00,added Alan Henderson to DAL,-1684.1999999999998,142876
