date,Transaction,single_value,value
2004-06-24,added Christian Laettner to DAL,0.0,92922
2004-06-24,added Jerry Stackhouse to DAL,-3017.5,89905
2004-07-26,lost Danny Fortson to SEA,7683.0,97588
2004-07-26,added Calvin Booth to DAL,-445.4,97142
2004-08-04,lost Tony Delk to ATL,1355.4,98498
2004-08-04,lost Antoine Walker to ATL,638.4,99136
2004-08-04,added Alan Henderson to DAL,-1684.1999999999998,97452
2004-08-04,added Jason Terry to DAL,52677.1,150129
2004-08-24,lost Luis Flores to GSW,445.3,150574
2004-08-24,lost Christian Laettner to GSW,-0.0,150574
2004-08-24,lost Eduardo Nájera to GSW,2074.0,152648
2004-08-24,lost Mladen Sekularac to GSW,-0.0,152648
2004-08-24,lost Petteri Koponen to GSW,-0.0,152648
2004-08-24,added Erick Dampier to DAL,-2088.8,150559
2004-08-24,added Dan Dickau to DAL,-251.2,150308
2004-08-24,added Evan Eschmeyer to DAL,0.0,150308
2004-08-24,added Steve Logan to DAL,0.0,150308
2004-09-14,added D.J. Mbenga to DAL,-1465.3,148843
2004-09-30,added Avery Johnson to DAL,0.0,148843
2004-12-03,lost Dan Dickau to NOH,-207.4,148636
2004-12-03,lost Marcin Gortat to NOH,-0.0,148636
2004-12-03,added Darrell Armstrong to DAL,-2948.8,145687
2005-02-24,lost Calvin Booth to MIL,113.4,145800
2005-02-24,lost Alan Henderson to MIL,-0.0,145800
2005-02-24,added Keith Van Horn to DAL,-1239.6,144561
2005-03-01,added Alan Henderson to DAL,-1684.1999999999998,142876
