date,Transaction,single_value,value
1977-06-07 00:00:00,lost Swen Nater to BUF,-833.4,-833
1977-06-07 00:00:00,lost Tate Armstrong to BUF,-0.0,-833
1977-06-07 00:00:00,added Marques Johnson to MIL,0.0,-833
1977-06-10 00:00:00,added Kent Benson to MIL,2133.7,1300
1977-06-10 00:00:00,added Marques Johnson to MIL,77972.6,79272
1977-06-10 00:00:00,added Ernie Grunfeld to MIL,-2751.5,76521
1977-06-10 00:00:00,added Glen Williams to MIL,0.0,76521
1977-06-10 00:00:00,added Gary Yoder to MIL,0.0,76521
1977-06-10 00:00:00,added Lewis Brown to MIL,0.0,76521
1977-06-10 00:00:00,added Ron Norwood to MIL,0.0,76521
1977-06-10 00:00:00,added Chuck Goodyear to MIL,0.0,76521
1977-06-10 00:00:00,added Ron Bostick to MIL,0.0,76521
1977-06-10 00:00:00,added Larry Pikes to MIL,0.0,76521
1977-09-02 00:00:00,lost Roy Hamilton to BUF,-0.0,76521
1977-09-02 00:00:00,added John Gianelli to MIL,-4276.0,72245
1977-12-02 00:00:00,added Rich Laurel to MIL,-290.7,71954
1978-01-13 00:00:00,added Jim Eakins to MIL,0.0,71954
1978-06-01 00:00:00,lost Mike Mitchell to CLE,779.2999999999993,72734
1978-06-01 00:00:00,added Greg Kelser to MIL,0.0,72734
1978-06-09 00:00:00,added George Johnson to MIL,-578.5,72155
1978-06-09 00:00:00,added Pat Cummings to MIL,-7683.200000000001,64472
1978-06-09 00:00:00,added Otis Howard to MIL,-112.2,64360
1978-06-09 00:00:00,added Russ Coleman to MIL,0.0,64360
1978-06-09 00:00:00,added Dave Kyle to MIL,0.0,64360
1978-06-09 00:00:00,added Kim Anderson to MIL,0.0,64360
1978-06-09 00:00:00,added Tom Zaliagiris to MIL,0.0,64360
1978-06-09 00:00:00,added Gary Rosenberger to MIL,0.0,64360
1978-06-09 00:00:00,added Tom Anderson to MIL,0.0,64360
1978-07-26 00:00:00,lost Sammy Drummer to HOU,-0.0,64360
1978-07-26 00:00:00,added C.J. Kupec to MIL,0.0,64360
1978-09-14 00:00:00,added Del Beshore to MIL,0.0,64360
1978-09-18 00:00:00,added Kevin Restani to MIL,-2876.4,61483
1978-10-20 00:00:00,added Del Beshore to MIL,-4.7,61479
1978-10-23 00:00:00,lost Otis Howard to DET,345.8,61824
1978-10-23 00:00:00,added Eugene Robinson to MIL,0.0,61824
1978-10-26 00:00:00,added Norm Van Lier to MIL,0.0,61824
1979-01-25 00:00:00,added Sam Smith to MIL,0.0,61824
1979-02-15 00:00:00,added Sam Smith to MIL,-125.0,61699
1979-05-31 00:00:00,lost John Gianelli to NJN,-0.0,61699
1979-05-31 00:00:00,lost Calvin Natt to NJN,204.6,61904
1979-05-31 00:00:00,added Harvey Catchings to MIL,-2940.3,58964
1979-06-25 00:00:00,lost Greg Kelser to DET,4283.4,63247
1979-06-25 00:00:00,added Sidney Moncrief to MIL,0.0,63247
1979-06-25 00:00:00,added Sidney Moncrief to MIL,85883.09999999999,149130
1979-06-25 00:00:00,added Edgar Jones to MIL,0.0,149130
1979-06-25 00:00:00,added Larry Gibson to MIL,0.0,149130
1979-06-25 00:00:00,added Eugene Robinson to MIL,0.0,149130
1979-06-25 00:00:00,added Jim Tillman to MIL,0.0,149130
1979-06-25 00:00:00,added Derrick Mayes to MIL,0.0,149130
1979-06-25 00:00:00,added Stan Ray to MIL,0.0,149130
1979-06-25 00:00:00,added Larry Spicer to MIL,0.0,149130
1979-06-25 00:00:00,added Roger Lapham to MIL,0.0,149130
1979-06-25 00:00:00,added Chris Fahrbach to MIL,0.0,149130
1979-08-31 00:00:00,lost Kevin Restani to SAS,3677.1,152807
1979-10-09 00:00:00,lost Ernie Grunfeld to KCK,-1558.7,151249
1979-10-09 00:00:00,lost Dick Miller to KCK,-0.0,151249
1979-10-09 00:00:00,added Richard Washington to MIL,-2839.2000000000003,148409
1979-10-19 00:00:00,lost George Johnson to DEN,969.0,149378
1980-02-04 00:00:00,lost Kent Benson to DET,-2868.6,146510
1980-02-04 00:00:00,lost Larry Drew to DET,5849.700000000001,152359
1980-02-04 00:00:00,added Bob Lanier to MIL,0.0,152359
1980-05-16 00:00:00,added George Johnson to MIL,0.0,152359
1980-06-10 00:00:00,added Al Beal to MIL,0.0,152359
1980-06-10 00:00:00,added Jeff Wolf to MIL,0.0,152359
1980-06-10 00:00:00,added Ken Jones to MIL,0.0,152359
1980-06-10 00:00:00,added Alex Gilbert to MIL,0.0,152359
1980-06-10 00:00:00,added Ron White to MIL,0.0,152359
1980-06-10 00:00:00,added Keith Valentine to MIL,0.0,152359
1980-06-10 00:00:00,added Del Yarbrough to MIL,0.0,152359
1980-06-10 00:00:00,added Melvin Crayton to MIL,0.0,152359
1980-06-19 00:00:00,added Len Elmore to MIL,-1295.0,151064
1980-06-23 00:00:00,added Scott Lloyd to MIL,0.0,151064
1980-09-11 00:00:00,lost George Johnson to IND,10233.0,161297
1980-09-11 00:00:00,lost Jose Slaughter to IND,2163.0,163460
1980-09-11 00:00:00,added Mickey Johnson to MIL,4719.9,168180
1980-10-07 00:00:00,added Mike Evans to MIL,-2345.4,165835
1981-06-09 00:00:00,added Alton Lister to MIL,-3949.3,161886
1981-06-09 00:00:00,added Mark Smith to MIL,0.0,161886
1981-06-09 00:00:00,added Kris Anderson to MIL,0.0,161886
1981-06-09 00:00:00,added Kelvin Troy to MIL,0.0,161886
1981-06-09 00:00:00,added Jo Jo Hunter to MIL,0.0,161886
1981-06-09 00:00:00,added Lewis Latimore to MIL,0.0,161886
1981-06-09 00:00:00,added Mike Brkovich to MIL,0.0,161886
1981-06-09 00:00:00,added Chip Rucker to MIL,0.0,161886
1981-06-09 00:00:00,added Artie Green to MIL,0.0,161886
1981-09-24 00:00:00,lost Phillip Lockett to POR,-0.0,161886
1981-09-24 00:00:00,added Geoff Crompton to MIL,-872.9,161013
1981-11-02 00:00:00,added Bob Dandridge to MIL,0.0,161013
1981-11-02 00:00:00,lost Len Elmore to NJN,4215.0,165228
1981-11-16 00:00:00,added Scott May to MIL,2017.9,167246
1981-11-20 00:00:00,added Kevin Stacom to MIL,-477.0,166769
1982-03-17 00:00:00,added Robert Smith to MIL,0.0,166769
1982-04-07 00:00:00,added Robert Smith to MIL,-663.6,166105
1982-04-15 00:00:00,added Brad Holland to MIL,-54.0,166051
1982-06-28 00:00:00,lost Pat Cummings to DAL,8922.9,174974
1982-06-28 00:00:00,added Fred Roberts to MIL,0.0,174974
1982-06-29 00:00:00,added Paul Pressey to MIL,53246.9,228221
1982-06-29 00:00:00,added Fred Roberts to MIL,-11394.1,216827
1982-06-29 00:00:00,added Jerry Beck to MIL,0.0,216827
1982-06-29 00:00:00,added Tony Carr to MIL,0.0,216827
1982-06-29 00:00:00,added Bobby Austin to MIL,0.0,216827
1982-06-29 00:00:00,added Bryan Leonard to MIL,0.0,216827
1982-06-29 00:00:00,added Robert Tate to MIL,0.0,216827
1982-06-29 00:00:00,added Bob Coenen to MIL,0.0,216827
1982-09-09 00:00:00,lost Quinn Buckner to BOS,7099.000000000001,223926
1982-09-09 00:00:00,added Dave Cowens to MIL,0.0,223926
1982-09-13 00:00:00,added Steve Mix to MIL,0.0,223926
1982-09-27 00:00:00,added Charlie Criss to MIL,-398.4,223527
1982-10-15 00:00:00,lost Robert Smith to SDC,189.2,223717
1982-10-15 00:00:00,added Russell Todd to MIL,0.0,223717
1982-10-18 00:00:00,added Armond Hill to MIL,-135.20000000000002,223581
1982-11-10 00:00:00,lost Mickey Johnson to NJN,1402.7999999999995,224984
1982-11-10 00:00:00,lost Fred Roberts to NJN,-0.0,224984
1982-11-10 00:00:00,added Phil Ford to MIL,-3762.2,221222
1982-11-10 00:00:00,added Ted Kitchel to MIL,0.0,221222
1982-12-24 00:00:00,added Paul Mokeski to MIL,0.0,221222
1982-12-27 00:00:00,added Sam Pellom to MIL,-102.0,221120
1983-01-13 00:00:00,added Paul Mokeski to MIL,-18397.2,202723
1983-06-28 00:00:00,added Randy Breuer to MIL,-8763.600000000002,193959
1983-06-28 00:00:00,added Ted Kitchel to MIL,0.0,193959
1983-06-28 00:00:00,added Mike Davis to MIL,0.0,193959
1983-06-28 00:00:00,added Billy Goodwin to MIL,0.0,193959
1983-06-28 00:00:00,added Mark Nickens to MIL,0.0,193959
1983-06-28 00:00:00,added Mark Petteway to MIL,0.0,193959
1983-06-28 00:00:00,added Russell Todd to MIL,0.0,193959
1983-06-28 00:00:00,added Charles Hurt to MIL,0.0,193959
1983-06-28 00:00:00,added Anthony Hicks to MIL,0.0,193959
1983-06-28 00:00:00,added Brett Burkholder to MIL,0.0,193959
1983-06-28 00:00:00,added Bill Varner to MIL,0.0,193959
1983-06-28 00:00:00,added Bob Kelly to MIL,0.0,193959
1983-08-01 00:00:00,added Tiny Archibald to MIL,0.0,193959
1983-09-30 00:00:00,lost Fred Reynolds to WSB,-0.0,193959
1983-09-30 00:00:00,added Kevin Grevey to MIL,-3353.4,190606
1983-11-08 00:00:00,added Linton Townes to MIL,-9.0,190597
1983-11-23 00:00:00,added Lorenzo Romar to MIL,1022.7000000000002,191619
1984-01-05 00:00:00,added Rory White to MIL,-207.0,191412
1984-03-08 00:00:00,added Mike Dunleavy to MIL,622.3,192035
1984-06-19 00:00:00,added Kenny Fields to MIL,-2277.5,189757
1984-06-19 00:00:00,added Vernon Delancy to MIL,0.0,189757
1984-06-19 00:00:00,added Ernie Floyd to MIL,0.0,189757
1984-06-19 00:00:00,added McKinley Singleton to MIL,0.0,189757
1984-06-19 00:00:00,added Mike Reddick to MIL,0.0,189757
1984-06-19 00:00:00,added Tony William to MIL,0.0,189757
1984-06-19 00:00:00,added Brad Jergenson to MIL,0.0,189757
1984-06-19 00:00:00,added Edwin Green to MIL,0.0,189757
1984-06-19 00:00:00,added Mike Toomer to MIL,0.0,189757
1984-09-29 00:00:00,lost Junior Bridgeman to LAC,6341.799999999999,196099
1984-09-29 00:00:00,lost Harvey Catchings to LAC,3881.3,199980
1984-09-29 00:00:00,lost Marques Johnson to LAC,-669.1000000000001,199311
1984-09-29 00:00:00,added Terry Cummings to MIL,22286.5,221598
1984-09-29 00:00:00,added Craig Hodges to MIL,1873.6,223471
1984-09-29 00:00:00,added Ricky Pierce to MIL,22250.1,245721
1984-10-12 00:00:00,added Butch Graves to MIL,0.0,245721
1984-10-17 00:00:00,added Larry Micheaux to MIL,393.3,246115
1984-11-06 00:00:00,added Mark West to MIL,-136.8,245978
1984-11-11 00:00:00,added Charles Davis to MIL,-4560.2,241418
1985-02-12 00:00:00,added David Thirdkill to MIL,24.0,241442
1985-02-12 00:00:00,lost Hot Rod Williams to CLE,-30139.7,211302
1985-02-12 00:00:00,lost Kannard Johnson to CLE,116.4,211418
1985-02-12 00:00:00,added Paul Thompson to MIL,-363.2000000000001,211055
1985-04-02 00:00:00,added Chris Engler to MIL,-421.19999999999993,210634
1985-06-18 00:00:00,added Jerry Reynolds to MIL,1772.0,212406
1985-06-18 00:00:00,added Eugene McDowell to MIL,0.0,212406
1985-06-18 00:00:00,added Cozell McQueen to MIL,0.0,212406
1985-06-18 00:00:00,added Ray Knight to MIL,0.0,212406
1985-06-18 00:00:00,added Quentin Anderson to MIL,0.0,212406
1985-06-18 00:00:00,added Mario Elie to MIL,0.0,212406
1985-08-09 00:00:00,lost Bob Beecher to SAC,-0.0,212406
1985-08-09 00:00:00,added Mark McNamara to MIL,0.0,212406
1985-09-26 00:00:00,added McKinley Singleton to MIL,0.0,212406
1985-09-26 00:00:00,added Jeff Lamp to MIL,-280.40000000000003,212126
1985-09-30 00:00:00,added Bryan Warrick to MIL,-45.9,212080
1986-01-11 00:00:00,added Mike Glenn to MIL,-803.7,211276
1986-01-13 00:00:00,added Earl Jones to MIL,-494.5,210781
1986-03-10 00:00:00,added Derrick Rowland to MIL,-80.10000000000001,210701
1986-06-17 00:00:00,added Scott Skiles to MIL,-1025.0,209676
1986-06-17 00:00:00,added Keith Smith to MIL,-2535.5,207141
1986-06-17 00:00:00,added Baskerville Holmes to MIL,0.0,207141
1986-06-17 00:00:00,added Bobby Deaton to MIL,0.0,207141
1986-06-17 00:00:00,added John Kimbrell to MIL,0.0,207141
1986-06-17 00:00:00,added Jeff Strong to MIL,0.0,207141
1986-07-01 00:00:00,lost Alton Lister to SEA,8618.0,215759
1986-07-01 00:00:00,lost Mark Jackson to SEA,-0.0,215759
1986-07-01 00:00:00,lost Jeff Sanders to SEA,-0.0,215759
1986-07-01 00:00:00,added Jack Sikma to MIL,17136.1,232895
1986-07-01 00:00:00,added Bob McCann to MIL,0.0,232895
1986-07-01 00:00:00,added Scott Haffner to MIL,0.0,232895
1986-10-22 00:00:00,added Jim Lampley to MIL,0.0,232895
1986-10-23 00:00:00,added Dudley Bradley to MIL,1282.0,234177
1986-10-24 00:00:00,lost Curtis Hunter to DEN,-0.0,234177
1986-10-24 00:00:00,added Pete Williams to MIL,0.0,234177
1986-11-11 00:00:00,lost Chris Engler to POR,-85.0,234092
1986-11-11 00:00:00,added Winston Garland to MIL,0.0,234092
1986-11-17 00:00:00,added Hank McDowell to MIL,-182.0,233910
1986-12-09 00:00:00,added Cedric Henderson to MIL,-54.0,233856
1986-12-26 00:00:00,added Chris Engler to MIL,-388.8,233467
1987-01-04 00:00:00,added Junior Bridgeman to MIL,0.0,233467
1987-01-09 00:00:00,added Don Collins to MIL,-427.5,233040
1987-01-17 00:00:00,added John Lucas to MIL,8556.6,241596
1987-01-19 00:00:00,added Marvin Webster to MIL,0.0,241596
1987-01-24 00:00:00,added Junior Bridgeman to MIL,-1295.8,240300
1987-02-26 00:00:00,added Marvin Webster to MIL,-265.2,240035
1987-04-03 00:00:00,added Jerome Henderson to MIL,-579.6,239456
1988-01-22 00:00:00,,0.0,239456
1988-01-22 00:00:00,added Dave Hoppen to GSW,-2852.9,236603
1988-03-30 00:00:00,added Mark Wade to GSW,0.0,236603
1988-04-20 00:00:00,added Mark Wade to GSW,-873.3,235729
1988-06-08 00:00:00,lost Dave Feitl to WSB,4305.6,240035
1988-06-08 00:00:00,lost Doug Roth to WSB,2183.6,242219
1988-06-08 00:00:00,added Manute Bol to GSW,-3268.1,238951
1988-06-28 00:00:00,added Mitch Richmond to GSW,1635.6999999999998,240586
1988-06-28 00:00:00,added Keith Smart to GSW,0.0,240586
1988-10-01 00:00:00,added John Starks to GSW,-1973.2,238613
1988-10-05 00:00:00,added John Stroeder to GSW,0.0,238613
1988-11-22 00:00:00,lost Jerome Whitehead to SAS,3480.0,242093
1988-11-22 00:00:00,added Shelton Jones to GSW,200.2,242293
1988-12-17 00:00:00,added Steve Alford to GSW,-2170.0,240123
1989-01-02 00:00:00,added John Stroeder to GSW,38.0,240161
1989-03-22 00:00:00,added Orlando Graham to GSW,-290.4,239871
1989-06-23 00:00:00,added Šarūnas Marčiulionis to GSW,3835.6,243706
1989-06-27 00:00:00,lost Dana Barros to SEA,-5082.3,238624
1989-06-27 00:00:00,added Gary Payton to GSW,0.0,238624
1989-06-27 00:00:00,added Tim Hardaway to GSW,42087.5,280712
1989-08-07 00:00:00,lost Gary Payton to SEA,-152331.4,128380
1989-08-07 00:00:00,added Alton Lister to GSW,-6701.5,121679
1989-08-10 00:00:00,added Leonard Taylor to GSW,-377.4,121301
1989-09-22 00:00:00,added Uwe Blab to GSW,-3415.1,117886
1989-09-27 00:00:00,lost Ralph Sampson to SAC,4638.9,122525
1989-09-27 00:00:00,added Jim Petersen to GSW,-6514.3,116011
1989-10-02 00:00:00,lost Tellis Frank to MIA,6871.8,122883
1989-10-02 00:00:00,added Steve Bardo to GSW,0.0,122883
1989-10-05 00:00:00,added Tom Tolbert to GSW,0.0,122883
1989-10-07 00:00:00,added Marques Johnson to GSW,-485.1,122398
1989-11-09 00:00:00,added Tom Tolbert to GSW,-10940.3,111457
1989-12-04 00:00:00,added John Shasky to GSW,-586.5,110871
1990-02-22 00:00:00,lost Uwe Blab to SAS,485.0,111356
1990-02-22 00:00:00,added Chris Welp to GSW,-710.0,110646
1990-02-22 00:00:00,lost Winston Garland to LAC,4406.099999999999,115052
1990-02-22 00:00:00,added Kevin Pritchard to GSW,0.0,115052
1990-02-22 00:00:00,added Sasha Danilović to GSW,0.0,115052
1990-02-27 00:00:00,added Mike Smrek to GSW,-743.1,114309
1990-02-28 00:00:00,added Kelvin Upshaw to GSW,277.20000000000005,114586
1990-06-27 00:00:00,lost Rumeal Robinson to ATL,2688.0,117274
1990-06-27 00:00:00,lost Steve Bardo to ATL,-0.0,117274
1990-06-27 00:00:00,lost Trevor Wilson to ATL,1506.6,118781
1990-06-27 00:00:00,added Tyrone Hill to GSW,0.0,118781
1990-06-27 00:00:00,added Les Jepsen to GSW,0.0,118781
1990-06-27 00:00:00,added Tyrone Hill to GSW,-14719.600000000002,104061
1990-06-27 00:00:00,added Les Jepsen to GSW,-966.0,103095
1990-06-27 00:00:00,added Kevin Pritchard to GSW,-3865.0,99230
1990-08-01 00:00:00,lost Manute Bol to PHI,5104.0,104334
1990-08-01 00:00:00,added Chris Gatling to GSW,0.0,104334
1990-09-25 00:00:00,lost Terry Teagle to LAL,10007.4,114341
1990-09-25 00:00:00,added Shaun Vandiver to GSW,0.0,114341
1990-10-03 00:00:00,added Bart Kofoed to GSW,-197.4,114144
1990-10-25 00:00:00,added Steve Johnson to GSW,-1026.0,113118
1991-01-08 00:00:00,added Larry Robinson to GSW,0.0,113118
1991-01-11 00:00:00,added Larry Robinson to GSW,-1020.0,112098
1991-01-14 00:00:00,added Paul Mokeski to GSW,0.0,112098
1991-01-31 00:00:00,added Paul Mokeski to GSW,-1285.0,110813
1991-02-23 00:00:00,added Mario Elie to GSW,0.0,110813
1991-03-05 00:00:00,added Mario Elie to GSW,1864.2,112677
1991-04-06 00:00:00,added Vincent Askew to GSW,549.1000000000001,113226
1991-05-17 00:00:00,lost Kevin Pritchard to SAS,-0.0,113226
1991-06-26 00:00:00,added Chris Gatling to GSW,-3498.0,109728
1991-06-26 00:00:00,added Victor Alexander to GSW,-11859.9,97868
1991-06-26 00:00:00,added Shaun Vandiver to GSW,0.0,97868
1991-06-26 00:00:00,added Lamont Strothers to GSW,0.0,97868
1991-06-26 00:00:00,lost Lamont Strothers to POR,209.1,98077
1991-06-26 00:00:00,added Tyus Edney to GSW,0.0,98077
1991-06-26 00:00:00,added Tim Young to GSW,-671.3000000000001,97406
1991-11-01 00:00:00,lost Les Jepsen to SAC,565.5,97972
1991-11-01 00:00:00,lost Mitch Richmond to SAC,-45922.0,52050
1991-11-01 00:00:00,lost Tyus Edney to SAC,7768.200000000001,59818
1991-11-01 00:00:00,added Billy Owens to GSW,1588.6,61406
1991-12-22 00:00:00,added Jud Buechler to GSW,-1488.0,59918
1992-01-24 00:00:00,added Jaren Jackson to GSW,-205.2,59713
1992-01-28 00:00:00,added Mike Smrek to GSW,-7.800000000000001,59705
1992-02-10 00:00:00,added Kenny Battle to GSW,23.0,59728
1992-02-13 00:00:00,added Tony Massenburg to GSW,-187.0,59541
1992-03-04 00:00:00,added Billy Thompson to GSW,-6.2,59535
1992-06-24 00:00:00,added Latrell Sprewell to GSW,15133.6,74669
1992-06-24 00:00:00,added Sasha Danilović to GSW,0.0,74669
1992-06-24 00:00:00,added Matt Fish to GSW,0.0,74669
1992-07-31 00:00:00,added Keith Jennings to GSW,4084.6,78753
1992-07-31 00:00:00,added Jeff Grayer to GSW,-4789.599999999999,73964
1992-07-31 00:00:00,added Dell Demps to GSW,0.0,73964
1992-09-18 00:00:00,lost Tony Dumas to DAL,6563.1,80527
1992-09-18 00:00:00,added Byron Houston to GSW,-8269.4,72258
1992-11-21 00:00:00,added Ed Nealy to GSW,-595.4,71662
1992-11-24 00:00:00,added Paul Pressey to GSW,-777.1999999999999,70885
1993-02-09 00:00:00,added Sean Higgins to GSW,0.0,70885
1993-02-19 00:00:00,added Sean Higgins to GSW,-2718.6,68166
1993-02-25 00:00:00,lost Ed Nealy to CHI,244.9,68411
1993-03-02 00:00:00,added Barry Stevens to GSW,-4.800000000000001,68406
1993-03-12 00:00:00,added Pat Durham to GSW,-865.8,67541
1993-03-23 00:00:00,added Andre Spencer to GSW,0.0,67541
1993-04-12 00:00:00,added Andre Spencer to GSW,-814.0,66727
1993-04-14 00:00:00,added Joe Courtney to GSW,-273.0,66454
1993-06-30 00:00:00,added Anfernee Hardaway to GSW,0.0,66454
1993-06-30 00:00:00,added Darnell Mee to GSW,0.0,66454
1993-06-30 00:00:00,lost Anfernee Hardaway to ORL,-59421.7,7032
1993-06-30 00:00:00,lost Todd Fuller to ORL,-0.0,7032
1993-06-30 00:00:00,lost Vince Carter to ORL,-5815.2,1217
1993-06-30 00:00:00,lost Mike Miller to ORL,754.1,1971
1993-06-30 00:00:00,added Chris Webber to GSW,9613.4,11584
1993-06-30 00:00:00,lost Darnell Mee to DEN,823.8,12408
1993-06-30 00:00:00,added Josh Grant to GSW,-878.5999999999999,11529
1993-06-30 00:00:00,added Anthony Miller to GSW,0.0,11529
1993-07-15 00:00:00,lost Tyrone Hill to CLE,12172.8,23702
1993-07-15 00:00:00,added Clifford Rozier to GSW,0.0,23702
1993-08-16 00:00:00,added Andre Spencer to GSW,75.6,23778
1993-10-25 00:00:00,added Avery Johnson to GSW,-4348.8,19429
1993-11-01 00:00:00,added Gerald Glass to GSW,0.0,19429
1993-11-22 00:00:00,added Dell Demps to GSW,-88.0,19341
1994-01-15 00:00:00,added Tod Murphy to GSW,-57.0,19284
1994-02-28 00:00:00,added Todd Lichti to GSW,-353.79999999999995,18930
1994-06-29 00:00:00,added Clifford Rozier to GSW,-8588.4,10342
1994-06-29 00:00:00,added Anthony Miller to GSW,0.0,10342
1994-06-29 00:00:00,added Dwayne Morton to GSW,-1382.5,8959
1994-07-01 00:00:00,lost Anthony Miller to LAL,1918.5,10878
1994-07-01 00:00:00,added Dwayne Whitfield to GSW,0.0,10878
1994-07-18 00:00:00,lost Byron Houston to SEA,1367.4,12245
1994-07-18 00:00:00,lost Šarūnas Marčiulionis to SEA,1432.8,13678
1994-07-18 00:00:00,added Ricky Pierce to GSW,-336.5,13342
1994-07-18 00:00:00,added Carlos Rogers to GSW,-3356.1,9985
1994-07-18 00:00:00,added Martin Lewis to GSW,0.0,9985
1994-07-18 00:00:00,added Michael McDonald to GSW,0.0,9985
1994-09-28 00:00:00,added Bob McCann to GSW,0.0,9985
1994-10-06 00:00:00,added Rod Higgins to GSW,-243.8,9742
1994-10-06 00:00:00,added David Wood to GSW,-4764.0,4978
1994-10-18 00:00:00,added Manute Bol to GSW,72.9,5051
1994-11-02 00:00:00,lost Sasha Danilović to MIA,1269.3000000000002,6320
1994-11-02 00:00:00,lost Billy Owens to MIA,-1569.6,4750
1994-11-02 00:00:00,added Rony Seikaly to GSW,-9269.2,-4518
1994-11-17 00:00:00,lost Chris Webber to WSB,-25286.9,-29805
1994-11-17 00:00:00,added Tom Gugliotta to GSW,-662.0,-30467
1994-11-17 00:00:00,added Todd Fuller to GSW,-8875.7,-39343
1994-11-17 00:00:00,added Vince Carter to GSW,0.0,-39343
1994-11-17 00:00:00,added Chris Mihm to GSW,0.0,-39343
1995-01-12 00:00:00,added Ryan Lorthridge to GSW,0.0,-39343
1995-01-22 00:00:00,added Ryan Lorthridge to GSW,-1612.8,-40955
1997-02-14 00:00:00,,0.0,-40955
1997-02-14 00:00:00,lost Jamal Mashburn to MIA,-1891.5,-42847
1997-02-14 00:00:00,added Sasha Danilović to DAL,-262.8,-43110
1997-02-14 00:00:00,added Martin Müürsepp to DAL,-1253.7,-44363
1997-02-14 00:00:00,added Kurt Thomas to DAL,-1226.4,-45590
1997-02-17 00:00:00,added Erick Strickland to DAL,0.0,-45590
1997-02-17 00:00:00,lost Sam Cassell to NJN,-12718.8,-58309
1997-02-17 00:00:00,lost Chris Gatling to NJN,5028.9,-53280
1997-02-17 00:00:00,lost Jim Jackson to NJN,231.0,-53049
1997-02-17 00:00:00,lost George McCloud to NJN,-0.0,-53049
1997-02-17 00:00:00,lost Eric Montross to NJN,2869.6,-50179
1997-02-17 00:00:00,added Shawn Bradley to DAL,8308.8,-41870
1997-02-17 00:00:00,added Ed O'Bannon to DAL,-1365.0,-43235
1997-02-17 00:00:00,added Robert Pack to DAL,-3616.9,-46852
1997-02-17 00:00:00,added Khalid Reeves to DAL,-5394.6,-52247
1997-02-25 00:00:00,added Erick Strickland to DAL,-6402.1,-58649
1997-02-27 00:00:00,added Jason Sasser to DAL,44.8,-58604
1997-03-11 00:00:00,added Jamie Watson to DAL,-316.5,-58921
1997-03-21 00:00:00,added Stevin Smith to DAL,-570.0,-59491
1997-04-10 00:00:00,added Stacey King to DAL,-714.0,-60205
1997-06-25 00:00:00,added Kelvin Cato to DAL,0.0,-60205
1997-06-25 00:00:00,added Bubba Wells to DAL,-1382.5,-61587
1997-06-25 00:00:00,lost Kelvin Cato to POR,549.6999999999999,-61037
1997-06-25 00:00:00,added Chris Anstey to DAL,-3972.0,-65009
1997-09-04 00:00:00,added Hubert Davis to DAL,-13840.9,-78850
1997-09-24 00:00:00,lost Derek Harper to ORL,2289.3,-76561
1997-09-24 00:00:00,lost Ed O'Bannon to ORL,-0.0,-76561
1997-09-24 00:00:00,added Dennis Scott to DAL,-2336.1,-78897
1997-10-07 00:00:00,added Kevin Ollie to DAL,-1155.6,-80053
1997-10-21 00:00:00,added Adrian Caldwell to DAL,-16.799999999999997,-80069
1997-12-17 00:00:00,added Eric Riley to DAL,-2393.6000000000004,-82463
1998-02-18 00:00:00,lost Dennis Scott to PHO,295.8,-82167
1998-02-18 00:00:00,added Cedric Ceballos to DAL,-2156.4,-84324
1998-03-27 00:00:00,added Shawn Respert to DAL,-1247.0,-85571
1998-06-24 00:00:00,added Robert Traylor to DAL,0.0,-85571
1998-06-24 00:00:00,added Ansu Sesay to DAL,0.0,-85571
1998-06-24 00:00:00,added Bruno Šundov to DAL,-884.4,-86455
1998-06-24 00:00:00,added Greg Buckner to DAL,-3949.9,-90405
1998-06-24 00:00:00,lost Pat Garrity to PHO,1614.0,-88791
1998-06-24 00:00:00,lost Martin Müürsepp to PHO,-0.0,-88791
1998-06-24 00:00:00,lost Bubba Wells to PHO,-0.0,-88791
1998-06-24 00:00:00,lost Shawn Marion to PHO,-103916.9,-192708
1998-06-24 00:00:00,added Steve Nash to DAL,30054.5,-162653
1998-06-24 00:00:00,lost Robert Traylor to MIL,-36.89999999999998,-162690
1998-06-24 00:00:00,added Pat Garrity to DAL,0.0,-162690
1998-06-24 00:00:00,added Dirk Nowitzki to DAL,232573.7,69882
1999-01-22 00:00:00,added Hot Rod Williams to DAL,-644.8000000000001,69238
1999-01-23 00:00:00,added Gary Trent to DAL,-580.1000000000001,68658
1999-06-30 00:00:00,added Wang Zhizhi to DAL,85.59999999999997,68743
1999-06-30 00:00:00,added Gordan Giriček to DAL,0.0,68743
1999-06-30 00:00:00,lost Gordan Giriček to SAS,-0.0,68743
1999-06-30 00:00:00,lost Chris Carrawell to SAS,-0.0,68743
1999-06-30 00:00:00,added Leon Smith to DAL,0.0,68743
1999-09-01 00:00:00,lost A.C. Green to LAL,578.6999999999999,69322
1999-09-01 00:00:00,added Sean Rooks to DAL,-2802.8,66519
1999-09-01 00:00:00,added Pete Mickeal to DAL,0.0,66519
1999-09-29 00:00:00,lost Chris Anstey to CHI,2316.1,68835
1999-09-29 00:00:00,added Dan Langhi to DAL,0.0,68835
1999-10-04 00:00:00,added Zendon Hamilton to DAL,0.0,68835
1999-10-05 00:00:00,added Ben Davis to DAL,0.0,68835
1999-10-06 00:00:00,added Kevin Ollie to DAL,0.0,68835
1999-11-01 00:00:00,added Randell Jackson to DAL,-6.3,68829
1999-11-04 00:00:00,added Rick Hughes to DAL,-1120.0,67709
1999-12-02 00:00:00,added Damon Jones to DAL,0.0,67709
2000-01-08 00:00:00,added Damon Jones to DAL,0.0,67709
2000-01-28 00:00:00,added Damon Jones to DAL,-540.8000000000001,67168
2000-02-03 00:00:00,added Dennis Rodman to DAL,-1244.8000000000002,65923
2000-04-10 00:00:00,added Rodrick Rhodes to DAL,-119.2,65804
2000-06-28 00:00:00,added Etan Thomas to DAL,0.0,65804
2000-06-28 00:00:00,added Dan Langhi to DAL,0.0,65804
2000-06-28 00:00:00,added Pete Mickeal to DAL,0.0,65804
2000-06-28 00:00:00,lost Brandon Armstrong to ORL,-0.0,65804
2000-06-28 00:00:00,added Courtney Alexander to DAL,-2926.4,62878
2000-06-28 00:00:00,lost Dan Langhi to HOU,3514.7,66392
2000-06-28 00:00:00,added Eduardo Nájera to DAL,-490.4000000000001,65902
2000-06-28 00:00:00,added Kyle Hill to DAL,0.0,65902
2000-06-28 00:00:00,lost Pete Mickeal to NYK,-0.0,65902
2000-06-28 00:00:00,lost Erick Strickland to NYK,757.8000000000001,66660
2000-06-28 00:00:00,added Donnell Harvey to DAL,-924.7,65735
2000-06-28 00:00:00,added John Wallace to DAL,0.0,65735
2000-06-28 00:00:00,lost Sean Rooks to LAC,10888.9,76624
2000-06-28 00:00:00,added Eric Murdock to DAL,0.0,76624
2000-08-16 00:00:00,lost Bruno Šundov to UTA,-0.0,76624
2000-08-16 00:00:00,lost Robert Pack to BOS,-0.0,76624
2000-08-16 00:00:00,lost Hot Rod Williams to BOS,-0.0,76624
2000-08-16 00:00:00,added Dana Barros to DAL,0.0,76624
2000-08-16 00:00:00,added Bill Curley to DAL,-241.50000000000003,76382
2000-08-16 00:00:00,added Howard Eisley to DAL,0.0,76382
2000-08-29 00:00:00,lost Cedric Ceballos to DET,66.4,76449
2000-08-29 00:00:00,lost Eric Murdock to DET,-0.0,76449
2000-08-29 00:00:00,lost John Wallace to DET,1897.2,78346
2000-08-29 00:00:00,added Christian Laettner to DAL,744.0,79090
2000-08-29 00:00:00,added Terry Mills to DAL,0.0,79090
