date,Transaction,single_value,value
2019-06-20,added De'Andre Hunter to LAL,0.0,0
2019-06-20,lost Paul Reed to ORL,-0.0,0
2019-06-20,added Talen Horton-Tucker to LAL,0.0,0
2019-07-01,added Zach Norvell Jr. to LAL,-64.0,-64
2019-07-06,lost Isaac Bonga to WAS,6005.6,5941
2019-07-06,lost Jemerrio Jones to WAS,-0.0,5941
2019-07-06,lost Moritz Wagner to WAS,1958.0,7899
2019-07-06,lost Kennedy Chandler to WAS,-0.0,7899
2019-07-06,lost Lonzo Ball to NOP,-4184.9,3714
2019-07-06,lost Josh Hart to NOP,1345.9,5060
2019-07-06,lost De'Andre Hunter to NOP,-0.0,5060
2019-07-06,lost Brandon Ingram to NOP,-17720.7,-12660
2019-07-06,lost Dyson Daniels to NOP,1060.8000000000002,-11599
2019-07-06,added Anthony Davis to LAL,17048.0,5448
2019-07-06,added Danny Green to LAL,843.5,6292
2019-07-06,added DeMarcus Cousins to LAL,0.0,6292
2019-07-06,added Kentavious Caldwell-Pope to LAL,-1409.6000000000004,4882
2019-07-06,added JaVale McGee to LAL,1695.0,6577
2019-07-06,added Quinn Cook to LAL,-1955.2,4622
2019-07-07,added Jared Dudley to LAL,-254.79999999999995,4367
2019-07-07,added Troy Daniels to LAL,-1003.2,3364
2019-07-07,added Alex Caruso to LAL,-235.0,3129
2019-07-08,added Rajon Rondo to LAL,-1377.6,1751
2019-07-08,added Avery Bradley to LAL,-8026.6,-6274
2019-07-13,added Talen Horton-Tucker to LAL,-1734.8999999999996,-8009
2019-08-26,added Dwight Howard to LAL,261.2,-7748
2019-12-11,added Devontae Cacok to LAL,-96.2,-7844
2020-02-23,added Markieff Morris to LAL,-278.5999999999999,-8123
2020-03-06,added Dion Waiters to LAL,-330.0,-8453
2020-11-18,added Jaden McDaniels to LAL,0.0,-8453
2020-11-18,lost Danny Green to OKC,-0.0,-8453
2020-11-18,lost Jaden McDaniels to OKC,-0.0,-8453
2020-11-18,added Dennis Schroder to LAL,-2151.6000000000004,-10604
2020-11-22,added Wesley Matthews to LAL,-1921.0,-12525
2020-11-22,added Montrezl Harrell to LAL,4740.0,-7785
2020-11-22,added Kentavious Caldwell-Pope to LAL,-951.0,-8736
2020-11-23,lost JaVale McGee to CLE,553.3000000000001,-8183
2020-11-23,added Jordan Bell to LAL,0.0,-8183
2020-11-23,added Alfonzo McKinnie to LAL,-103.2,-8286
2020-11-23,added Markieff Morris to LAL,-3120.0,-11406
2020-11-24,added Marc Gasol to LAL,2283.9,-9122
2020-11-26,added Kostas Antetokounmpo to LAL,-705.6,-9828
2020-12-01,added Jared Dudley to LAL,-283.5,-10112
2020-12-03,added Anthony Davis to LAL,45174.0,35062
2021-02-26,added Damian Jones to LAL,-22.399999999999977,35039
2021-03-28,added Andre Drummond to LAL,-884.0,34155
2021-04-06,added Ben McLemore to LAL,-1104.0,33051
2021-07-29,added Isaiah Jackson to LAL,0.0,33051
2021-08-03,added Joel Ayayi to LAL,0.0,33051
2021-08-03,added Austin Reaves to LAL,-1404.1000000000004,31647
2021-08-06,added Carmelo Anthony to LAL,-896.5,30751
2021-08-06,added Kent Bazemore to LAL,-2343.5,28407
2021-08-06,lost Kentavious Caldwell-Pope to WAS,3493.5,31901
2021-08-06,lost Montrezl Harrell to WAS,-5361.599999999999,26539
2021-08-06,lost Kyle Kuzma to WAS,11457.3,37996
2021-08-06,lost Isaiah Jackson to IND,329.7,38326
2021-08-06,added Russell Westbrook to LAL,-4433.900000000001,33892
2021-08-06,added Tristan Vukcevic to LAL,0.0,33892
2021-08-06,added Bobi Klintman to LAL,0.0,33892
2021-08-06,added Talen Horton-Tucker to LAL,-4986.3,28906
2021-08-06,added Malik Monk to LAL,-1069.5,27836
2021-08-06,added Kendrick Nunn to LAL,-2640.0,25196
2021-08-06,added Trevor Ariza to LAL,-1570.8,23625
2021-08-06,added Wayne Ellington to LAL,-1134.0,22491
2021-08-06,added Dwight Howard to LAL,-194.2,22297
2021-08-10,added Mac McClung to LAL,0.0,22297
2021-08-10,added Chaundee Brown Jr. to LAL,0.0,22297
2021-08-31,added Rajon Rondo to LAL,-1300.5,20997
2021-09-09,added DeAndre Jordan to LAL,-244.8,20752
2021-09-10,lost Marc Gasol to MEM,-0.0,20752
2021-09-10,added Wang Zhelin to LAL,0.0,20752
2021-09-28,added Cameron Oliver to LAL,0.0,20752
2021-09-29,added Trevelin Queen to LAL,0.0,20752
2021-10-12,added Sekou Doumbouya to LAL,0.0,20752
2021-10-13,added Frank Mason to LAL,0.0,20752
2021-10-18,added Jay Huff to LAL,-148.0,20604
2021-11-16,added Chaundee Brown Jr. to LAL,-348.6,20255
2021-12-17,added Isaiah Thomas to LAL,-858.5,19397
2021-12-21,added Mason Jones to LAL,-45.9,19351
2021-12-21,added Jemerrio Jones to LAL,-15.0,19336
2021-12-24,added Darren Collison to LAL,-403.3,18933
2021-12-24,added Stanley Johnson to LAL,0.0,18933
2022-01-03,lost Brad Newley to NYK,-0.0,18933
2022-01-03,lost Wang Zhelin to NYK,-0.0,18933
2022-01-03,lost Rajon Rondo to CLE,-122.7,18810
2022-01-03,added Louis Labeyrie to LAL,0.0,18810
2022-01-12,added Sekou Doumbouya to LAL,300.8,19111
2022-01-17,added Stanley Johnson to LAL,0.0,19111
2022-01-27,added Stanley Johnson to LAL,-2953.8,16157
2022-03-01,added D.J. Augustin to LAL,-969.8,15187
2022-03-01,added Wenyen Gabriel to LAL,-4025.5,11162
2022-04-09,added Mac McClung to LAL,-193.6,10968
2022-06-23,added Max Christie to LAL,0.0,10968
2022-06-23,added Max Christie to LAL,0.0,10968
2022-07-01,added Scotty Pippen Jr. to LAL,-188.8,10779
2022-07-01,added Cole Swider to LAL,-139.4,10640
2022-07-01,added Juan Toscano-Anderson to LAL,-1241.0,9399
2022-07-01,added Troy Brown Jr. to LAL,-1860.0,7539
2022-07-01,added Damian Jones to LAL,-352.0,7187
2022-07-06,added Thomas Bryant to LAL,2014.8,9202
2022-07-06,added Lonnie Walker to LAL,-1815.8,7386
2022-07-08,added Max Christie to LAL,-4985.6,2400
2022-07-23,added Fabian White Jr. to LAL,0.0,2400
2022-07-24,added Javante McCoy to LAL,0.0,2400
2022-07-27,added Jay Huff to LAL,0.0,2400
2022-08-25,lost Talen Horton-Tucker to UTA,3311.6000000000004,5712
2022-08-25,lost Stanley Johnson to UTA,-0.0,5712
2022-08-25,added Patrick Beverley to LAL,-2179.8,3532
2022-09-16,added Dennis Schroder to LAL,-5759.4,-2226
2022-09-26,added Matt Ryan to LAL,-735.3000000000001,-2962
2022-09-26,added Dwayne Bacon to LAL,0.0,-2962
2022-10-08,added L.J. Figueroa to LAL,0.0,-2962
2022-10-08,added Shaquille Harrison to LAL,0.0,-2962
2022-10-10,added Bryce Hamilton to LAL,0.0,-2962
2022-10-11,added Nate Pierre-Louis to LAL,0.0,-2962
2023-01-06,added Sterling Brown to LAL,-79.19999999999999,-3041
2023-01-23,lost Kendrick Nunn to WAS,697.6,-2343
2023-01-23,lost Tristan Vukcevic to WAS,1017.2,-1326
2023-01-23,added Rui Hachimura to LAL,-1402.1999999999998,-2728
2023-02-09,lost Patrick Beverley to ORL,-0.0,-2728
2023-02-09,lost Thomas Bryant to DEN,1353.0,-1375
2023-02-09,added Davon Reed to LAL,116.1,-1259
2023-02-09,added Bronny James to LAL,0.0,-1259
2023-02-09,added Mo Bamba to LAL,-484.0,-1743
2023-02-09,lost Damian Jones to UTA,451.5,-1292
2023-02-09,lost Juan Toscano-Anderson to UTA,1440.5,148
2023-02-09,lost Russell Westbrook to UTA,-0.0,148
2023-02-09,lost Bobi Klintman to MIN,-0.0,148
2023-02-09,added D'Angelo Russell to LAL,1262.4,1410
2023-02-09,added Malik Beasley to LAL,-1800.9,-390
2023-02-09,added Jarred Vanderbilt to LAL,-1472.8000000000002,-1863
2023-04-09,added Tristan Thompson to LAL,0.0,-1863
2023-04-09,added Shaquille Harrison to LAL,0.0,-1863
2023-06-22,added Jalen Hood-Schifino to LAL,0.0,-1863
2023-06-22,added Mojave King to LAL,0.0,-1863
2023-06-23,lost Mojave King to IND,-0.0,-1863
2023-06-23,added Maxwell Lewis to LAL,0.0,-1863
2023-07-03,added D'Moi Hodge to LAL,-258.3,-2121
2023-07-03,added Colin Castleton to LAL,-306.8,-2428
2023-07-06,added Cam Reddish to LAL,-4798.0,-7226
2023-07-06,added Rui Hachimura to LAL,-3057.8,-10283
2023-07-06,added Taurean Prince to LAL,-5902.4,-16186
2023-07-06,added Austin Reaves to LAL,5863.6,-10322
2023-07-06,added Jaxson Hayes to LAL,-1967.5,-12290
2023-07-06,added Gabe Vincent to LAL,-7308.7,-19598
2023-07-07,added D'Angelo Russell to LAL,862.1999999999998,-18736
2023-07-08,added Maxwell Lewis to LAL,-1666.0,-20402
2023-07-08,added Jalen Hood-Schifino to LAL,-1788.5,-22191
2023-07-26,added Alex Fudge to LAL,-253.40000000000003,-22444
2023-09-06,added Christian Wood to LAL,-2441.6,-24886
2024-01-06,added Dylan Windler to LAL,89.60000000000001,-24796
2024-01-08,added Skylar Mays to LAL,-46.2,-24842
2024-02-10,added Spencer Dinwiddie to LAL,-2169.6,-27012
2024-03-02,added Harry Giles to LAL,-245.1,-27257
2024-06-26,added Dalton Knecht to LAL,0.0,-27257
2024-06-26,added Bronny James to LAL,0.0,-27257
2024-06-26,added Dalton Knecht to LAL,0.0,-27257
2024-06-26,added Bronny James to LAL,0.0,-27257
2024-07-02,added Dalton Knecht to LAL,-2963.1,-30220
2024-07-02,added Bronny James to LAL,-1026.0,-31246
2024-07-03,added Blake Hinson to LAL,0.0,-31246
2024-07-03,added Armel Traore to LAL,-663.3000000000001,-31909
2024-07-06,added LeBron James to LAL,13018.8,-18891
2024-07-06,added Colin Castleton to LAL,0.0,-18891
2024-07-06,added Max Christie to LAL,-2192.6,-21083
2024-09-16,added Christian Koloko to LAL,-1017.6,-22101
2024-10-19,added Quincy Olivari to LAL,-187.0,-22288
2024-12-29,lost Maxwell Lewis to BRK,499.4,-21788
2024-12-29,lost D'Angelo Russell to BRK,-717.0,-22505
2024-12-29,added Dorian Finney-Smith to LAL,-2108.0,-24613
2024-12-29,added Shake Milton to LAL,-1058.4,-25672
2024-12-29,lost future 2nd round pick to BRK,-0.0,-25672
2024-12-29,lost future 2nd round pick to BRK,-0.0,-25672
2024-12-29,lost future 2nd round pick to BRK,-0.0,-25672
2025-01-15,added Trey Jemison to LAL,-1278.4,-26950
2025-02-02,lost Jalen Hood-Schifino to UTA,-0.0,-26950
2025-02-02,lost future 2nd round pick to UTA,-0.0,-26950
2025-02-02,lost Max Christie to DAL,2788.0,-24162
2025-02-02,lost Anthony Davis to DAL,-507.5,-24670
2025-02-02,lost future 1st round pick to DAL,-0.0,-24670
2025-02-02,added Luka Doncic to LAL,4328.799999999999,-20341
2025-02-02,added Maxi Kleber to LAL,0.0,-20341
2025-02-02,added Markieff Morris to LAL,-673.4,-21014
2025-02-07,added Jordan Goodwin to LAL,-85.4,-21100
2025-02-11,added Alex Len to LAL,-806.6,-21906
