,date,Transaction,value,Running Score
496,2023-07-07,added Cason Wallace to OKC,0,-128875
497,2023-07-08,added Patty Mills to OKC,0,-128875
498,2023-07-08,added future 2nd round pick to OKC,0,-128875
499,2023-07-08,added future 2nd round pick to OKC,0,-128875
500,2023-07-08,added future 2nd round pick to OKC,0,-128875
501,2023-07-12,lost Patty Mills to ATL,0,-128875
502,2023-07-12,added Usman Garuba to OKC,0,-128875
503,2023-07-12,added Rudy Gay to OKC,0,-128875
504,2023-07-12,added Ty Ty Washington to OKC,0,-128875
505,2023-07-12,added future 2nd round pick to OKC,0,-128875
506,2023-07-17,added Vasilije Micić to OKC,0,-128875
507,2023-07-20,added Jack White to OKC,0,-128875
508,2023-08-18,added Lindy Waters III to OKC,0,-128875
509,2023-08-21,added Olivier Sarr to OKC,0,-128875
510,2023-10-17,lost Victor Oladipo to HOU,0,-128875
511,2023-10-17,lost Jeremiah Robinson-Earl to HOU,0,-128875
512,2023-10-17,added Kevin Porter Jr. to OKC,0,-128875
513,2023-10-17,added future 2nd round pick to OKC,0,-128875
514,2023-10-17,added future 2nd round pick to OKC,0,-128875
515,2023-11-01,lost future 2nd round pick to PHI,0,-128875
516,2023-11-01,added future 1st round pick to OKC,0,-128875
