date,Transaction,single_value,value
2021-06-18 00:00:00,lost Kemba Walker to OKC,0,0
2021-06-18 00:00:00,lost Alperen Şengün to OKC,0,0
2021-06-18 00:00:00,added Moses Brown to BOS,0,0
2021-06-18 00:00:00,added Al Horford to BOS,14964,14964
2021-06-18 00:00:00,added Amari Bailey to BOS,0,14964
2021-07-29 00:00:00,added Juhann Begarin to BOS,0,14964
2021-07-31 00:00:00,lost Moses Brown to DAL,811,15775
2021-07-31 00:00:00,added Josh Richardson to BOS,326,16101
2021-08-07 00:00:00,lost Tristan Thompson to SAC,1683,17784
2021-08-07 00:00:00,added Kris Dunn to BOS,0,17784
2021-08-07 00:00:00,added Bruno Fernando to BOS,-162,17622
2021-08-07 00:00:00,added Julian Phillips to BOS,0,17622
2021-08-13 00:00:00,added Dennis Schroder to BOS,-1719,15902
2021-08-13 00:00:00,added Enes Kanter to BOS,-575,15327
2021-08-13 00:00:00,added Sam Hauser to BOS,363,15690
2021-08-16 00:00:00,added Evan Fournier to BOS,0,15690
2021-08-17 00:00:00,lost Evan Fournier to NYK,3486,19177
2021-08-17 00:00:00,lost Amari Bailey to NYK,0,19177
2021-09-14 00:00:00,added Juwan Morgan to BOS,0,19177
2021-09-15 00:00:00,lost Kris Dunn to MEM,0,19177
2021-09-15 00:00:00,lost Carsen Edwards to MEM,0,19177
2021-09-15 00:00:00,added Juan Hernangomez to BOS,-796,18380
2021-09-23 00:00:00,added Theo Pinson to BOS,0,18380
2021-09-27 00:00:00,added Garrison Mathews to BOS,0,18380
2021-09-27 00:00:00,added Ryan Arcidiacono to BOS,0,18380
2021-10-15 00:00:00,added Chris Clemons to BOS,0,18380
2021-10-15 00:00:00,added Luke Kornet to BOS,0,18380
2021-10-18 00:00:00,added Brodric Thomas to BOS,-168,18212
2021-10-19 00:00:00,added Jabari Parker to BOS,78,18291
2021-12-18 00:00:00,added Justin Jackson to BOS,-5,18286
2021-12-20 00:00:00,added C.J. Miles to BOS,-32,18253
2021-12-22 00:00:00,added Joe Johnson to BOS,30,18283
2021-12-25 00:00:00,added Al-Farouq Aminu to BOS,0,18283
2021-12-25 00:00:00,added Norvel Pelle to BOS,0,18283
2022-01-19 00:00:00,lost Juan Hernangomez to SAS,127,18411
2022-01-19 00:00:00,added Bol Bol to BOS,0,18411
2022-01-19 00:00:00,added PJ Dozier to BOS,0,18411
2022-02-10 00:00:00,lost Romeo Langford to SAS,3725,22136
2022-02-10 00:00:00,lost Josh Richardson to SAS,1199,23335
2022-02-10 00:00:00,lost Blake Wesley to SAS,6422,29758
2022-02-10 00:00:00,added Derrick White to BOS,4923,34682
2022-02-10 00:00:00,lost future 1st round pick to SAS,0,34682
2022-02-10 00:00:00,lost Bruno Fernando to HOU,477,35159
2022-02-10 00:00:00,lost Enes Freedom to HOU,0,35159
2022-02-10 00:00:00,lost Dennis Schroder to HOU,1777,36937
2022-02-10 00:00:00,added Daniel Theis to BOS,-39,36898
2022-02-10 00:00:00,lost Bol Bol to ORL,1354,38252
2022-02-10 00:00:00,lost PJ Dozier to ORL,0,38252
2022-02-10 00:00:00,added future 2nd round pick to BOS,0,38252
2022-02-10 00:00:00,lost future 2nd round pick to ORL,0,38252
2022-02-11 00:00:00,added Luke Kornet to BOS,178,38431
2022-02-23 00:00:00,added Kelan Martin to BOS,-150,38280
2022-02-23 00:00:00,added Malik Fitts to BOS,0,38280
2022-02-28 00:00:00,added Matt Ryan to BOS,-68,38212
2022-03-04 00:00:00,added Nik Stauskas to BOS,-109,38102
2022-03-15 00:00:00,added Malik Fitts to BOS,274,38376
2022-03-28 00:00:00,added Juwan Morgan to BOS,0,38376
2022-04-09 00:00:00,added Juwan Morgan to BOS,-24,38352
2022-06-23 00:00:00,added JD Davison to BOS,0,38352
2022-07-09 00:00:00,lost Malik Fitts to IND,0,38352
2022-07-09 00:00:00,lost Juwan Morgan to IND,0,38352
2022-07-09 00:00:00,lost Aaron Nesmith to IND,5448,43800
2022-07-09 00:00:00,lost Nik Stauskas to IND,0,43800
2022-07-09 00:00:00,lost Daniel Theis to IND,152,43953
2022-07-09 00:00:00,lost Julian Strawther to IND,0,43953
2022-07-09 00:00:00,added Malcolm Brogdon to BOS,4883,48836
2022-07-09 00:00:00,added JD Davison to BOS,-277,48559
2022-07-09 00:00:00,added Luke Kornet to BOS,804,49363
2022-07-09 00:00:00,added Sam Hauser to BOS,1290,50653
2022-07-12 00:00:00,added Danilo Gallinari to BOS,0,50653
2022-07-16 00:00:00,added Mfiondu Kabengele to BOS,-320,50333
2022-08-24 00:00:00,added Bruno Caboclo to BOS,0,50333
2022-09-07 00:00:00,added Noah Vonleh to BOS,-1077,49255
2022-09-14 00:00:00,added Justin Jackson to BOS,-278,48977
2022-09-14 00:00:00,added Jake Layman to BOS,0,48977
2022-09-14 00:00:00,added Denzel Valentine to BOS,0,48977
2022-09-21 00:00:00,added Luka Šamanić to BOS,0,48977
2022-09-23 00:00:00,added Brodric Thomas to BOS,0,48977
2022-10-03 00:00:00,added Blake Griffin to BOS,56,49034
2022-10-10 00:00:00,added A.J. Reeves to BOS,0,49034
2022-10-12 00:00:00,added Reginald Kissoonlal to BOS,0,49034
2022-10-13 00:00:00,added Eric Demers to BOS,0,49034
2022-10-15 00:00:00,added Marial Shayok to BOS,0,49034
2023-01-05 00:00:00,lost Noah Vonleh to SAS,0,49034
2023-02-09 00:00:00,lost Justin Jackson to OKC,0,49034
2023-02-09 00:00:00,lost Keyonte Johnson to OKC,0,49034
2023-02-09 00:00:00,added Mike Muscala to BOS,-452,48582
2023-02-09 00:00:00,lost future 2nd round pick to OKC,0,48582
2023-04-07 00:00:00,added Justin Champagnie to BOS,-356,48225
2023-06-22 00:00:00,added Julian Phillips to BOS,0,48225
2023-06-23 00:00:00,lost Danilo Gallinari to WAS,0,48225
2023-06-23 00:00:00,lost Mike Muscala to WAS,0,48225
2023-06-23 00:00:00,lost Julian Phillips to WAS,0,48225
2023-06-23 00:00:00,lost Marcus Smart to MEM,0,48225
2023-06-23 00:00:00,added Marcus Sasser to BOS,0,48225
2023-06-23 00:00:00,added future 1st round pick to BOS,0,48225
2023-06-23 00:00:00,added Kristaps Porzingis to BOS,0,48225
2023-06-28 00:00:00,lost Marcus Sasser to DET,0,48225
2023-06-28 00:00:00,added James Nnaji to BOS,0,48225
2023-06-28 00:00:00,added future 2nd round pick to BOS,0,48225
2023-06-28 00:00:00,added future 2nd round pick to BOS,0,48225
2023-06-28 00:00:00,lost James Nnaji to CHO,0,48225
2023-06-28 00:00:00,added Mouhamed Gueye to BOS,0,48225
2023-06-28 00:00:00,added Colby Jones to BOS,0,48225
2023-06-28 00:00:00,lost Colby Jones to SAC,0,48225
2023-06-28 00:00:00,added Jordan Walsh to BOS,0,48225
2023-06-28 00:00:00,added future 2nd round pick to BOS,0,48225
2023-06-28 00:00:00,lost Mouhamed Gueye to ATL,0,48225
2023-06-28 00:00:00,added future 2nd round pick to BOS,0,48225
2023-07-06 00:00:00,added Oshae Brissett to BOS,0,48225
2023-07-06 00:00:00,added Jordan Walsh to BOS,0,48225
2023-07-09 00:00:00,added JD Davison to BOS,0,48225
2023-07-11 00:00:00,added Grant Williams to BOS,0,48225
2023-07-12 00:00:00,lost Grant Williams to DAL,0,48225
2023-07-12 00:00:00,added future 2nd round pick to BOS,0,48225
2023-07-12 00:00:00,added future 2nd round pick to BOS,0,48225
2023-07-12 00:00:00,added future 2nd round pick to BOS,0,48225
2023-07-15 00:00:00,added Jay Scrubb to BOS,0,48225
2023-07-17 00:00:00,added Dalano Banton to BOS,0,48225
2023-08-31 00:00:00,added Sviatoslav Mykhailiuk to BOS,0,48225
2023-09-17 00:00:00,added Neemias Queta to BOS,0,48225
2023-10-01 00:00:00,lost Malcolm Brogdon to POR,0,48225
2023-10-01 00:00:00,lost Robert Williams to POR,0,48225
2023-10-01 00:00:00,added Jrue Holiday to BOS,0,48225
2023-10-01 00:00:00,lost future 1st round pick to POR,0,48225
2023-10-01 00:00:00,lost future 1st round pick to POR,0,48225
2023-10-22 00:00:00,added Nathan Knight to BOS,0,48225
2023-12-14 00:00:00,added Drew Peterson to BOS,0,48225
