date,Transaction,single_value,value
1986-06-17,added Chuck Person to IND,-6493,-6493
1986-06-17,added Greg Dreiling to IND,-13544,-20038
1986-06-17,added Derrick Taylor to IND,0,-20038
1986-06-17,added Richard Rellford to IND,0,-20038
1986-06-17,added Jeff Hall to IND,0,-20038
1986-06-17,added Steve Woodside to IND,0,-20038
1986-09-18,lost Greg Butler to CHI,0,-20038
1986-09-18,lost Litterial Green to CHI,0,-20038
1986-09-18,added Kyle Macy to IND,-375,-20413
1986-10-02,lost Russ Schoene to SEA,7801,-12611
1986-10-02,lost Terence Stansbury to SEA,1612,-10999
1986-10-02,added John Long to IND,-6162,-17161
1986-10-02,added Walker Russell to IND,-1584,-18745
1986-12-29,added Pete Verhoeven to IND,-321,-19066
1987-01-01,added Michael Brooks to IND,-843,-19910
1987-06-21,lost Gary Leonard to MIL,0,-19910
1987-06-21,added Scott Skiles to IND,-5862,-25772
1987-06-22,added Reggie Miller to IND,166487,140715
1987-06-22,added Brian Rowsom to IND,-134,140580
1987-06-22,added Sean Couch to IND,0,140580
1987-06-22,added Mike Milling to IND,0,140580
1987-06-22,added Gary Graham to IND,0,140580
1987-06-22,added Montel Hatcher to IND,0,140580
1987-10-05,added Clinton Wheeler to IND,-205,140375
1987-10-05,added Anthony Frederick to IND,-939,139436
1987-10-08,added Jim Thomas to IND,0,139436
1988-06-28,added Rik Smits to IND,-5505,133931
1988-06-28,added Herbert Crook to IND,0,133931
1988-06-28,added Michael Anderson to IND,0,133931
1988-10-04,lost Ron Anderson to PHI,18149,152081
1988-10-04,added Everette Stephens to IND,-1170,150910
1988-10-05,added Richard Morton to IND,-29,150880
1989-02-02,added Sedric Toney to IND,-239,150641
1989-02-20,lost Wayman Tisdale to SAC,14820,165461
1989-02-20,lost Bimbo Coles to SAC,0,165461
1989-02-20,added LaSalle Thompson to IND,-20307,145154
1989-02-20,added Randy Wittman to IND,-5123,140031
1989-02-21,lost Herb Williams to DAL,16756,156787
1989-02-21,added Detlef Schrempf to IND,28732,185519
1989-02-21,added Antonio Davis to IND,0,185519
1989-06-27,added George McCloud to IND,-11475,174044
1989-06-27,lost Stuart Gray to CHH,1491,175535
1989-06-27,added Dyron Nix to IND,-632,174903
1989-09-08,added Mike Sanders to IND,-12637,162265
1989-10-03,added Rickey Green to IND,-1668,160597
1989-10-09,added Calvin Natt to IND,-65,160531
1990-06-27,added Antonio Davis to IND,-8393,152138
1990-06-27,added Kenny Williams to IND,187,152325
1990-08-07,added Micheal Williams to IND,15634,167959
1991-01-16,added Byron Dinkins to IND,-38,167920
1991-01-22,added Jawann Oldham to IND,-106,167814
1991-06-26,added Dale Davis to IND,13008,180823
1991-06-26,added Sean Green to IND,-2216,178606
1991-09-06,added Greg Grant to IND,0,178606
1992-01-24,added Jerome Lane to IND,-150,178456
1992-06-24,added Malik Sealy to IND,-3812,174643
1992-09-08,lost Chuck Person to MIN,10827,185471
1992-09-08,lost Micheal Williams to MIN,-9504,175967
1992-09-08,added Sam Mitchell to IND,-8602,167364
1992-09-08,added Pooh Richardson to IND,309,167674
1992-10-07,added Andre Spencer to IND,0,167674
1993-06-30,added Scott Haskin to IND,-520,167153
1993-06-30,added Thomas Hill to IND,0,167153
1993-06-30,added Spencer Dunkley to IND,0,167153
1993-08-31,added Haywoode Workman to IND,-1289,165864
1993-10-08,added Ledell Eackles to IND,0,165864
1993-10-11,lost Sean Green to PHI,2423,168287
1993-11-01,lost Detlef Schrempf to SEA,-37732,130555
1993-11-01,added Derrick McKey to IND,11571,142127
1993-11-01,added Gerald Paddio to IND,-368,141758
1993-12-06,added Byron Scott to IND,3934,145693
1994-04-05,added Lester Conner to IND,50,145744
1994-06-29,added Eric Piatkowski to IND,0,145744
1994-06-29,added William Njoku to IND,0,145744
1994-06-29,added Damon Bailey to IND,0,145744
1994-06-30,lost Eric Piatkowski to LAC,-3150,142593
1994-06-30,lost Pooh Richardson to LAC,10954,153547
1994-06-30,lost Malik Sealy to LAC,6931,160479
1994-06-30,added Mark Jackson to IND,30329,190808
1994-06-30,added Greg Minor to IND,0,190808
1994-09-30,added Duane Ferrell to IND,-3155,187653
1994-10-01,added Joe Wolf to IND,0,187653
1994-10-06,added Dan O'Sullivan to IND,0,187653
1994-10-07,added John Williams to IND,-2532,185120
1995-03-04,added Mark Strickland to IND,-50,185070
1995-03-24,added Greg Kite to IND,0,185070
1995-04-13,added Greg Kite to IND,-933,184136
1995-06-28,added Travis Best to IND,3613,187750
1995-06-28,added Fred Hoiberg to IND,2085,189836
1995-10-03,added Eddie Johnson to IND,-2242,187593
1995-10-03,added Ricky Pierce to IND,-842,186751
1995-10-04,added Adrian Caldwell to IND,-1896,184854
1995-10-04,added Kevin Salvadori to IND,0,184854
1995-10-18,added Dwayne Schintzius to IND,-1128,183726
1996-06-13,lost Mark Jackson to DEN,-1400,182325
1996-06-13,lost Ricky Pierce to DEN,1320,183645
1996-06-13,lost Efthimis Rentzias to DEN,0,183645
1996-06-13,added Jalen Rose to IND,7894,191540
1996-06-13,added Reggie Williams to IND,-333,191207
1996-06-13,added Erick Dampier to IND,0,191207
1996-06-26,added Erick Dampier to IND,-3892,187314
1996-06-26,added Mark Pope to IND,-1966,185348
1996-08-17,added Jerome Allen to IND,-1591,183757
1996-09-27,added Brent Scott to IND,-352,183405
1996-11-04,lost Reggie Williams to NJN,133,183538
1996-11-04,added Vincent Askew to IND,-1397,182141
1997-02-20,lost Vincent Askew to DEN,137,182279
1997-02-20,lost Eddie Johnson to DEN,0,182279
1997-02-20,lost Jason Lawson to DEN,0,182279
1997-02-20,lost Tremaine Fowlkes to DEN,0,182279
1997-02-20,added Mark Jackson to IND,20310,202589
1997-02-20,added LaSalle Thompson to IND,-259,202330
1997-02-20,lost Jerome Allen to DEN,878,203209
1997-02-20,added Darvin Ham to IND,44,203253
1997-06-25,added Austin Croshere to IND,682,203936
1997-07-10,added Etdrick Bohannon to IND,-262,203673
1997-08-12,lost Erick Dampier to GSW,25511,229185
1997-08-12,lost Duane Ferrell to GSW,2700,231885
1997-08-12,added Chris Mullin to IND,16645,248530
1997-09-08,added Mark West to IND,-577,247953
1997-10-02,added Gerald Madkins to IND,0,247953
1998-06-24,added Al Harrington to IND,-23820,224133
1999-01-21,added Sam Perkins to IND,2523,226656
1999-06-30,added Vonteego Cummings to IND,0,226656
1999-06-30,lost Vonteego Cummings to GSW,8131,234787
1999-06-30,lost Troy Murphy to GSW,11830,246618
1999-06-30,added Jeff Foster to IND,-7005,239612
1999-08-01,lost Antonio Davis to TOR,17203,256816
1999-08-01,added Jonathan Bender to IND,-8852,247963
1999-10-01,added Žan Tabak to IND,-3502,244461
1999-10-04,added Mitchell Butler to IND,0,244461
2000-06-28,added Primož Brezec to IND,-1601,242859
2000-06-28,added Jaquay Walls to IND,0,242859
2000-08-31,lost Dale Davis to POR,-3988,238870
2000-08-31,added Joe Kleine to IND,0,238870
2000-08-31,added Jermaine O'Neal to IND,23025,261896
2000-09-22,added Tyus Edney to IND,-157,261738
2000-10-02,added Lari Ketner to IND,-107,261630
2000-10-03,added Bruno Šundov to IND,-1096,260533
2000-10-05,added Terry Mills to IND,-926,259607
2001-06-27,added Jamison Brewer to IND,-355,259252
2001-06-27,lost Boris Diaw to ATL,8617,267869
2001-06-27,added Jamaal Tinsley to IND,6199,274068
2001-09-06,added Carlos Rogers to IND,67,274135
2001-09-21,added Norm Richardson to IND,-84,274051
2002-02-19,lost Travis Best to CHI,1427,275479
2002-02-19,lost Norm Richardson to CHI,340,275819
2002-02-19,lost Jalen Rose to CHI,5211,281031
2002-02-19,lost Lonny Baxter to CHI,4373,285404
2002-02-19,added Metta World Peace to IND,20938,306343
2002-02-19,added Ron Mercer to IND,-7378,298964
2002-02-19,added Brad Miller to IND,9949,308913
2002-02-19,added Kevin Ollie to IND,519,309432
2002-06-26,added Fred Jones to IND,-1280,308152
2002-09-05,added Erick Strickland to IND,255,308407
2002-11-06,added Greg Foster to IND,0,308407
2003-03-27,added Tim Hardaway to IND,127,308534
2012-06-28,added Miles Plumlee to IND,-429,308105
2012-06-29,added Orlando Johnson to IND,-1346,306758
2012-07-12,added Gerald Green to IND,-2052,304706
2012-07-12,lost Darren Collison to DAL,-237,304469
2012-07-12,lost Dahntay Jones to DAL,3048,307517
2012-07-12,added Ian Mahinmi to IND,-7347,300169
2012-07-13,added D.J. Augustin to IND,-735,299433
2012-09-06,added Sam Young to IND,0,299433
2012-09-06,added Sundiata Gaines to IND,0,299433
2012-09-06,added Blake Ahearn to IND,0,299433
2012-09-18,added Ben Hansbrough to IND,-840,298593
2013-01-07,added Dominic McGuire to IND,-170,298423
2013-01-28,added Sam Young to IND,-1871,296552
2013-06-27,added Solomon Hill to IND,-4027,292525
2013-06-27,added Colton Iverson to IND,0,292525
2013-06-27,lost Colton Iverson to BOS,0,292525
2008-06-26,,0,292525
2008-06-26,added Danilo Gallinari to NYK,1787,294312
2008-07-09,added Chris Duhon to NYK,-9539,284773
2008-07-24,added Anthony Roberson to NYK,-202,284571
2008-07-28,lost Renaldo Balkman to DEN,-807,283763
2008-07-28,added Taurean Green to NYK,0,283763
2008-07-28,added Bobby Jones to NYK,0,283763
2008-07-28,added Andy Rautins to NYK,0,283763
2008-08-29,added Patrick Ewing to NYK,0,283763
2008-11-21,lost Mardy Collins to LAC,5334,289097
2008-11-21,lost Zach Randolph to LAC,-136,288961
2008-11-21,added Cuttino Mobley to NYK,0,288961
2008-11-21,added Tim Thomas to NYK,154,289115
2008-11-21,lost Jamal Crawford to GSW,3339,292454
2008-11-21,added Al Harrington to NYK,-1756,290698
2009-02-19,lost Jerome James to CHI,0,290698
2009-02-19,lost Anthony Roberson to CHI,184,290882
2009-02-19,lost Tim Thomas to CHI,508,291390
2009-02-19,added Larry Hughes to NYK,-2369,289021
2009-02-19,lost Malik Rose to OKC,1426,290447
2009-02-19,added Chris Wilcox to NYK,-1155,289292
2009-03-03,added Cheikh Samb to NYK,-196,289096
2009-03-06,added Demetris Nichols to NYK,-10,289085
2009-03-23,added Courtney Sims to NYK,-34,289051
2009-03-27,added Joe Crawford to NYK,-62,288989
2009-04-09,added Mouhamed Sene to NYK,42,289031
2009-04-14,added Chris Hunter to NYK,0,289031
2009-06-25,added Jordan Hill to NYK,-1159,287872
2009-06-25,lost Andrew Goudelock to LAL,2190,290062
2009-06-25,added Toney Douglas to NYK,-3320,286742
2009-06-25,lost Quentin Richardson to MEM,0,286742
2009-06-25,added Darko Miličić to NYK,-127,286615
2009-09-11,added Gabe Pruitt to NYK,0,286615
2009-09-24,added Ron Howard to NYK,0,286615
2009-09-25,added Marcus Landry to NYK,-723,285891
2009-12-13,added Jonathan Bender to NYK,-1197,284694
2010-02-17,lost Darko Miličić to MIN,7248,291942
2010-02-17,added Brian Cardinal to NYK,0,291942
2010-02-18,lost Marcus Landry to BOS,104,292046
2010-02-18,lost Nate Robinson to BOS,2184,294230
2010-02-18,added J.R. Giddens to NYK,-686,293544
2010-02-18,added Eddie House to NYK,-2151,291393
2010-02-18,added Henry Walker to NYK,-2934,288458
2010-02-18,lost Larry Hughes to SAC,0,288458
2010-02-18,lost Jordan Hill to HOU,6498,294956
2010-02-18,lost Jared Jeffries to HOU,1752,296709
2010-02-18,lost Royce White to HOU,0,296709
2010-02-18,added Tracy McGrady to NYK,-1442,295267
2010-02-18,added Sergio Rodríguez to NYK,-1593,293674
2010-04-02,added Earl Barron to NYK,0,293674
2010-04-02,added Earl Barron to NYK,-1225,292449
2010-06-24,added Andy Rautins to NYK,-316,292132
2010-06-24,added Landry Fields to NYK,508,292640
2010-06-24,added Jerome Jordan to NYK,-21,292618
2010-07-08,added Amar'e Stoudemire to NYK,1167,293786
2010-07-09,lost David Lee to GSW,-7330,286456
2010-07-09,added Kelenna Azubuike to NYK,0,286456
2010-07-09,added Anthony Randolph to NYK,-825,285630
2010-07-09,added Ronny Turiaf to NYK,1597,287228
2010-07-09,added Quincy Miller to NYK,0,287228
2010-07-09,added Romero Osby to NYK,0,287228
2010-07-12,added Raymond Felton to NYK,-1359,285868
2010-07-13,added Timofey Mozgov to NYK,-2198,283670
2010-08-10,added Roger Mason to NYK,-1148,282521
2010-09-23,added Shawne Williams to NYK,-926,281595
2011-02-22,lost Eddy Curry to MIN,0,281595
2011-02-22,lost Anthony Randolph to MIN,876,282472
2011-02-22,lost Wilson Chandler to DEN,11110,293583
2011-02-22,lost Raymond Felton to DEN,-663,292920
2011-02-22,lost Danilo Gallinari to DEN,-21571,271348
2011-02-22,lost Timofey Mozgov to DEN,6423,277771
2011-02-22,lost Quincy Miller to DEN,3158,280930
2011-02-22,lost Romero Osby to DEN,0,280930
2011-02-22,lost Dario Šarić to DEN,0,280930
2011-02-22,lost Jamal Murray to DEN,-5636,275293
2011-02-22,added Carmelo Anthony to NYK,49579,324873
2011-02-22,added Renaldo Balkman to NYK,-246,324626
2011-02-22,added Chauncey Billups to NYK,1062,325688
2011-02-22,added Anthony Carter to NYK,-558,325130
2011-02-22,added Shelden Williams to NYK,-297,324833
2011-02-22,added Jakob Pöltl to NYK,0,324833
2011-02-22,added Corey Brewer to NYK,0,324833
2011-03-01,added Jared Jeffries to NYK,-1516,323317
2011-06-23,added Iman Shumpert to NYK,-7660,315657
2011-06-23,added Josh Harrellson to NYK,54,315711
