date,Transaction,single_value,value
2020-06-26 00:00:00,added Justin Patton to DET,0,0
2020-11-18 00:00:00,added Killian Hayes to DET,0,0
2020-11-18 00:00:00,added Tony Bradley to DET,0,0
2020-11-18 00:00:00,added Saben Lee to DET,0,0
2020-11-19 00:00:00,added Saben Lee to DET,-1562,-1562
2020-11-19 00:00:00,lost Luke Kennard to LAC,301,-1260
2020-11-19 00:00:00,lost Justin Patton to LAC,0,-1260
2020-11-19 00:00:00,lost Julian Phillips to LAC,0,-1260
2020-11-19 00:00:00,lost Bruce Brown to BRK,-1096,-2356
2020-11-19 00:00:00,added Saddiq Bey to DET,0,-2356
2020-11-19 00:00:00,added Jaylen Hands to DET,0,-2356
2020-11-19 00:00:00,added Dzanan Musa to DET,0,-2356
2020-11-19 00:00:00,added JT Thor to DET,0,-2356
2020-11-19 00:00:00,added Rodney McGruder to DET,135,-2221
2020-11-20 00:00:00,lost Tony Snell to ATL,496,-1725
2020-11-20 00:00:00,lost Khyri Thomas to ATL,0,-1725
2020-11-20 00:00:00,added Dewayne Dedmon to DET,0,-1725
2020-11-22 00:00:00,added Jerami Grant to DET,3811,2086
2020-11-22 00:00:00,added Nikola Radičević to DET,0,2086
2020-11-23 00:00:00,lost Tony Bradley to PHI,-947,1139
2020-11-23 00:00:00,added Zhaire Smith to DET,0,1139
2020-11-24 00:00:00,added Christian Wood to DET,0,1139
2020-11-24 00:00:00,lost Christian Wood to HOU,-5206,-4067
2020-11-24 00:00:00,lost Luka Garza to HOU,0,-4067
2020-11-24 00:00:00,added Trevor Ariza to DET,0,-4067
2020-11-24 00:00:00,added Isaiah Stewart to DET,0,-4067
2020-11-27 00:00:00,lost Trevor Ariza to OKC,0,-4067
2020-11-27 00:00:00,added Delon Wright to DET,3050,-1016
2020-11-30 00:00:00,added Killian Hayes to DET,-18773,-19789
2020-11-30 00:00:00,added Saddiq Bey to DET,-2815,-22605
2020-11-30 00:00:00,added Isaiah Stewart to DET,-10562,-33168
2020-12-01 00:00:00,added Mason Plumlee to DET,3297,-29870
2020-12-01 00:00:00,added Deividas Sirvydis to DET,-718,-30588
2020-12-01 00:00:00,added Jahlil Okafor to DET,-1110,-31699
2020-12-01 00:00:00,added Wayne Ellington to DET,-202,-31901
2020-12-01 00:00:00,added Josh Jackson to DET,-7295,-39197
2020-12-02 00:00:00,added Louis King to DET,0,-39197
2020-12-27 00:00:00,added Frank Jackson to DET,-1254,-40452
2021-02-08 00:00:00,lost Derrick Rose to NYK,-2461,-42913
2021-02-08 00:00:00,added Dennis Smith to DET,274,-42638
2021-02-08 00:00:00,added Isaiah Livers to DET,0,-42638
2021-03-13 00:00:00,lost Sviatoslav Mykhailiuk to OKC,2277,-40361
2021-03-13 00:00:00,added Hamidou Diallo to DET,-1488,-41849
2021-03-18 00:00:00,added Tyler Cook to DET,0,-41849
2021-03-25 00:00:00,lost Delon Wright to SAC,-835,-42684
2021-03-25 00:00:00,added Cory Joseph to DET,451,-42233
2021-03-25 00:00:00,added Luka Garza to DET,0,-42233
2021-04-07 00:00:00,added Tyler Cook to DET,-1220,-43453
2021-07-29 00:00:00,added Cade Cunningham to DET,0,-43453
2021-07-29 00:00:00,added JT Thor to DET,0,-43453
2021-07-29 00:00:00,added Isaiah Livers to DET,0,-43453
2021-07-29 00:00:00,added Luka Garza to DET,0,-43453
2021-08-06 00:00:00,added Kelly Olynyk to DET,1222,-42231
2021-08-06 00:00:00,added Trey Lyles to DET,0,-42231
2021-08-06 00:00:00,added Saben Lee to DET,-241,-42473
2021-08-06 00:00:00,added Isaiah Livers to DET,-3452,-45925
2021-08-06 00:00:00,lost Mason Plumlee to CHO,-3832,-49758
2021-08-06 00:00:00,lost JT Thor to CHO,5340,-44417
2021-08-06 00:00:00,added Balša Koprivica to DET,0,-44417
2021-08-08 00:00:00,added Cade Cunningham to DET,-3620,-48038
2021-08-08 00:00:00,added Rodney McGruder to DET,-1841,-49880
2021-08-10 00:00:00,added Frank Jackson to DET,-4074,-53954
2021-08-10 00:00:00,added Cory Joseph to DET,-5200,-59154
2021-08-16 00:00:00,added Chris Smith to DET,0,-59154
2021-08-16 00:00:00,added Luka Garza to DET,-972,-60127
2021-08-16 00:00:00,added Jamorko Pickett to DET,0,-60127
2021-08-19 00:00:00,added Hamidou Diallo to DET,-2028,-62156
2021-09-04 00:00:00,lost Sekou Doumbouya to BRK,0,-62156
2021-09-04 00:00:00,lost Jahlil Okafor to BRK,0,-62156
2021-09-04 00:00:00,added DeAndre Jordan to DET,0,-62156
2021-09-04 00:00:00,added Ismael Kamagate to DET,0,-62156
2021-09-16 00:00:00,added Anthony Tarke to DET,0,-62156
2021-09-24 00:00:00,added Jamorko Pickett to DET,-880,-63036
2021-09-27 00:00:00,added Deividas Sirvydis to DET,0,-63036
2021-09-27 00:00:00,added Derrick Walton Jr. to DET,0,-63036
2021-09-27 00:00:00,added Cassius Stanley to DET,0,-63036
2021-09-29 00:00:00,added Jared Cunningham to DET,0,-63036
2021-12-23 00:00:00,added Cheick Diallo to DET,-232,-63268
2021-12-25 00:00:00,added Derrick Walton to DET,-464,-63732
2021-12-25 00:00:00,added Cassius Stanley to DET,0,-63732
2021-12-26 00:00:00,added Deividas Sirvydis to DET,-234,-63967
2021-12-28 00:00:00,added Justin Robinson to DET,-627,-64595
2021-12-28 00:00:00,added Trayvon Palmer to DET,-255,-64850
2021-12-29 00:00:00,added Micah Potter to DET,-220,-65070
2021-12-31 00:00:00,added Jaysean Paige to DET,-220,-65291
2022-01-10 00:00:00,lost Rodney McGruder to DEN,0,-65291
2022-01-10 00:00:00,added Bol Bol to DET,0,-65291
2022-01-21 00:00:00,added Cassius Stanley to DET,-899,-66190
2022-02-10 00:00:00,lost Josh Jackson to SAC,1131,-65058
2022-02-10 00:00:00,lost Trey Lyles to SAC,1794,-63264
2022-02-10 00:00:00,lost Isaiah Wong to MIL,0,-63264
2022-02-10 00:00:00,lost future 2nd round pick to MIL,0,-63264
2022-02-10 00:00:00,added Marvin Bagley III to DET,-294,-63558
2022-03-24 00:00:00,added Braxton Key to DET,0,-63558
2022-04-03 00:00:00,added Carsen Edwards to DET,-734,-64293
2022-04-03 00:00:00,added Braxton Key to DET,-585,-64878
2022-06-23 00:00:00,added Jaden Ivey to DET,0,-64878
2022-06-23 00:00:00,added Ismael Kamagate to DET,0,-64878
2022-07-02 00:00:00,added Jaden Ivey to DET,-7603,-72481
2022-07-02 00:00:00,added Buddy Boeheim to DET,-855,-73336
2022-07-06 00:00:00,lost Jerami Grant to POR,449,-72887
2022-07-06 00:00:00,lost Ismael Kamagate to POR,0,-72887
2022-07-06 00:00:00,added Gabriele Procida to DET,0,-72887
2022-07-06 00:00:00,added future 1st round pick to DET,0,-72887
2022-07-06 00:00:00,added future 2nd round pick to DET,0,-72887
2022-07-06 00:00:00,added future 2nd round pick to DET,0,-72887
2022-07-06 00:00:00,added Marvin Bagley III to DET,-891,-73778
2022-07-06 00:00:00,added Jalen Duren to DET,0,-73778
2022-07-06 00:00:00,added Kemba Walker to DET,0,-73778
2022-07-06 00:00:00,lost future 1st round pick to NYK,0,-73778
2022-07-07 00:00:00,added Jalen Duren to DET,-1336,-75114
2022-07-11 00:00:00,lost Nikola Radičević to NYK,0,-75114
2022-07-11 00:00:00,added Alec Burks to DET,1346,-73768
2022-07-11 00:00:00,added Nerlens Noel to DET,-304,-74072
2022-07-11 00:00:00,added James Nnaji to DET,0,-74072
2022-07-11 00:00:00,added future 2nd round pick to DET,0,-74072
2022-07-11 00:00:00,lost future 2nd round pick to NYK,0,-74072
2022-08-01 00:00:00,added Rodney McGruder to DET,-786,-74858
2022-08-01 00:00:00,added Kevin Knox to DET,-1660,-76518
2022-09-12 00:00:00,added Micah Potter to DET,0,-76518
2022-09-14 00:00:00,added Keifer Sykes to DET,0,-76518
2022-09-19 00:00:00,added Kyler Edwards to DET,0,-76518
2022-09-22 00:00:00,lost Saben Lee to UTA,0,-76518
2022-09-22 00:00:00,lost Kelly Olynyk to UTA,-776,-77295
2022-09-22 00:00:00,added Bojan Bogdanovic to DET,1514,-75780
2022-09-25 00:00:00,added Stanley Umude to DET,0,-75780
2022-09-25 00:00:00,added Jules Bernard to DET,0,-75780
2022-10-14 00:00:00,added Devontae Cacok to DET,0,-75780
2022-12-26 00:00:00,added Jared Rhoden to DET,-1207,-76988
2023-02-09 00:00:00,lost Kevin Knox to POR,1651,-75337
2023-02-09 00:00:00,lost Saddiq Bey to ATL,-314,-75651
2023-02-09 00:00:00,added James Wiseman to DET,-2601,-78253
2023-02-10 00:00:00,added Stanley Umude to DET,97,-78156
2023-02-23 00:00:00,added R.J. Hampton to DET,-1711,-79867
2023-03-03 00:00:00,added Eugene Omoruyi to DET,0,-79867
2023-03-23 00:00:00,added Eugene Omoruyi to DET,-1529,-81397
2023-06-22 00:00:00,added Ausar Thompson to DET,0,-81397
2023-06-22 00:00:00,added James Nnaji to DET,0,-81397
2023-06-28 00:00:00,lost James Nnaji to BOS,0,-81397
2023-06-28 00:00:00,added Marcus Sasser to DET,0,-81397
2023-06-28 00:00:00,lost future 2nd round pick to BOS,0,-81397
2023-06-28 00:00:00,lost future 2nd round pick to BOS,0,-81397
2023-07-02 00:00:00,added Ausar Thompson to DET,0,-81397
2023-07-02 00:00:00,added Malcolm Cazalon to DET,0,-81397
2023-07-02 00:00:00,added Jared Rhoden to DET,0,-81397
2023-07-05 00:00:00,added Marcus Sasser to DET,0,-81397
2023-07-06 00:00:00,added Monte Morris to DET,0,-81397
2023-07-06 00:00:00,lost future 2nd round pick to WAS,0,-81397
2023-07-06 00:00:00,added Joe Harris to DET,0,-81397
2023-07-06 00:00:00,added future 2nd round pick to DET,0,-81397
2023-07-06 00:00:00,added future 2nd round pick to DET,0,-81397
2023-10-23 00:00:00,added Stanley Umude to DET,0,-81397
2023-11-08 00:00:00,added Kevin Knox to DET,0,-81397
