,Transaction Date,Transaction,Score,Running Score
1,1996-10-17 00:00:00,added Oliver Miller to DAL,-2090,-2090
2,1996-12-26 00:00:00,lost Tony Dumas to PHO,545,-1544
3,1996-12-26 00:00:00,lost Jason Kidd to PHO,-48402,-49946
4,1996-12-26 00:00:00,lost Loren Meyer to PHO,3367,-46578
5,1996-12-26 00:00:00,added Sam Cassell to DAL,-159,-46738
6,1996-12-26 00:00:00,added Michael Finley to DAL,39994,-6743
7,1996-12-26 00:00:00,added A.C. Green to DAL,-8268,-15012
8,1996-12-26 00:00:00,added Greg Buckner to DAL,-3949,-18962
